No.,会社名,設立年,代表者名,従業員数,住所,会社URL
754,有限会社ステージコラボレーションIGA,1988年,西出　裕貴,5-9人,佐那具町762番地の4,http://www.stageiga.com/index.html
755,株式会社アドクルーズ,1989年,浅井 功雄,10-29人,東京都中央区日本橋本町4-3-4　東海日本橋ビル,https://adcrews.co.jp/
756,株式会社ビッグ・バーン,1995年,木下　雅一,1-4人,東京都中央区八丁堀３－２１－３ライオンズマンション第２　８０２,https://www.b-bang.co.jp/
757,株式会社越知企画,1968年,越知　達哉,5-9人,東京都新宿区西落合2-10-11,http://www.ochi-planning.co.jp/company.html
758,株式会社読売エージェンシー東海,2012年,島田　正和,30-99人,愛知県名古屋市中区栄一丁目17番6号 読売新聞中部支社4階,http://www.yag-tokai.co.jp
759,株式会社エス・アール・シー,2007年,鵜飼　良,5-9人,愛知県名古屋市中区栄2丁目1番12号 　ダイアパレス伏見1111号室,http://src-office.com/
760,株式会社 アズディップ,2003年,奥野克也,5-9人,180-0006東京都武蔵野市中町2-5-4　君島ビル,https://www.azdep.jp/
761,株式会社クルール･プロジェ,2005年,阿久津 潤,10-29人,栃木県宇都宮市簗瀬町1784ー2 Yanaze BLDG 2階,https://couleurprojet.com/
762,エス・フィールド 株式会社,2011年,菅原　尚也,30-99人,神奈川県川崎市砂子2-9-1参鳥居館ビル5階,https://es-field.com/design/
763,株式会社ミール,1990年,杉村秀子,5-9人,北海道札幌市北37条東21丁目2番2号,https://www.mirco-ru.com/
764,株式会社ワオ コミュニケーションズ,1998年,土屋　克己,5-9人,神奈川県川崎市下小田中２丁目２番１－２０１号,https://www.wao-com.jp/
765,株式会社プロエスト,2005年,長谷川　晃,30-99人,東京都港区芝浦3-14-17,https://www.proest.co.jp/index.html
766,ＭＢＣアドバタイジング,1969年,加納 修一,100-499人,鹿児島県鹿児島市樋之口町1-1-5F,https://www.mbcad.jp/
767,ANO株式会社,2018年,深町昭記,10-29人,墨田区東駒形4丁目24番3号　伊藤ビル2階,https://ano-inc.jp/
768,株式会社ウィンド,2010年,兼子 伸幸,30-99人,愛知県名古屋市上野3-10-18,http://www.windpromot.co.jp/
769,感動会社楽通株式会社,2015年,田村　慎太郎,5-9人,兵庫県姫路市三条町2-13,http://rakutsu.jp/
770,株式会社 リアル,1985年,山口正明,5-9人,神田紺屋町20-1 神保ビル6F-A,http://www.real-ad.co.jp/
771,株式会社Basement Speaks.E,2016年,八木沼 剛,5-9人,東京都渋谷区恵比寿西2-6-3 505,https://basementspeaks-e.com/
772,株式会社ジャプロ,2008年,和田 怜,30-99人, - ,https://www.japro-inc.jp/
773,株式会社P-STAGE,2017年,野戸和憲,5-9人,品川区西五反田6-15-3塚本ビル301,https://p-sta.co.jp/
774,ｔｂｃ Ａｚ 株式会社,1970年,石森勝巳,30-99人,宮城県仙台市青葉区本町２丁目３番１０号,https://www.tbc-az.co.jp/
775,有限会社雄物川印刷,1994年,高橋 富男,5-9人,秋田県横手市雄物川町薄井字神谷地218-2,http://www.omonogawa.co.jp/
776,株式会社クラウンアーツ,2016年,内田　健太,5-9人,東京都品川区西五反田7-22-17 TOCビル4階,https://crownarts.co.jp/
777,株式会社アワシャーレ,2017年,小嶋美代子,5-9人,柳橋,https://ourshare.jp/
778,株式会社ドミネーターズ,2016年,寺口 哲央,10-29人,東京都渋谷区恵比寿西2-4-5 第28荒井ビル2階,https://dominatorz.co.jp/
779,株式会社ひらせ,2023年,平瀬 友喜,5-9人,三田町29-9,http://www.hirase-gakki.com/
780,株式会社BiT & Company,2023年,宮本駿,10-29人,東京都千代田区神田錦町２丁目2−１ 神田スクエア 11F 11-101,https://bit-company.jp/
781,株式会社ARDIA,2013年,小松田峰,100-499人,東京都千代田区内神田2-8-5 山口ビル3F,http://ardia.co.jp
782,株式会社URBANROOF,2019年,浅井千貴,5-9人,深大寺東町5-21-29,https://www.urbanroof.net/
783,株式会社Moffly,2017年,藤次 一嘉,5-9人,東京都豊島区東池袋１丁目９−６,https://tagsapi.com/
784,株式会社Vipro,2016年,飯田知弘,5-9人,大阪府大阪市中央区道修町1丁目2-11 アルテビル道修町201,https://vipro.co.jp/
785,株式会社WAVE,2022年,新井 雄貴,5-9人,宇田川町２−１ 渋谷ホームズ807,https://wave-app.jp/
786,株式会社PLC,2012年,天尾　雄太,30-99人,東京都台東区浅草橋3丁目20番15号浅草橋ミハマビル別館4階,http://www.plc-2012.com/index.html
787,株式会社アカネソリューションズ,1978年,大崎　弘吉,30-99人,東京都台東区東上野2-1-13 東上野センタービル3Ｆ,http://www.akane.co.jp/
788,株式会社凡美社,1963年,山本 裕,100-499人,大阪府羽曳野市恵我之荘3-1-1,https://www.bonbinet.jp/
789,株式会社ウイン企画,1989年,振角 ひとみ,30-99人,大阪府大阪市中央区久太郎町2-5-28　久太郎町恒和ビル7階,http://win-kikaku.co.jp/
790,株式会社巧,2007年,堀内宗樹,10-29人,愛知県名古屋市中区錦３丁目４番１３号,http://www.e-takumi.co.jp/index.html
791,株式会社ケイエスピーサービス,1997年,杉本 径子,5-9人,北海道札幌市白石区東札幌2条6丁目5-1 ターミナルハイツ白石ビル701,http://kspnet.jp/
792,株式会社アウトソーシング,1997年,土井春彦,1000人以上,東京都千代田区丸の内1-8-3 丸の内トラストタワー本館19F,https://www.outsourcing.co.jp/
793,株式会社ポロワッカ,2013年,新宮 賢治,30-99人,北海道札幌市中央区南1条西22丁目2-15シーズンビル1F,http://sakouju-guide.com/merit/company.html
794,株式会社かんきょう総研,1994年,山田裕策,5-9人,西新井本町2-22-5,http://dr-fish.co.jp/index.html
795,ニュースアンドコーヒー株式会社,2023年,申 元奎,5-9人,東京都渋谷区東2-20-14-601,https://ncar.jp/
796,有限会社クラフトワーク,1990年,吉田 文一,1-4人,神奈川県横浜市鶴見区下末吉６丁目１番１１－３０３号,http://www.craftwork-inc.jp/index.html
797,株式会社SHARE BASE,2019年,馬塲 孝輔,5-9人,東京都港区赤坂8-6-27スカイプラザ赤坂211,https://share-base.com/
798,株式会社ビジョン,2008年,大島 雅之,5-9人,東京都渋谷区千駄ヶ谷4-5-15ストークメイジュ403号,http://jp-vision.com/
799,株式会社ブシロードムーブ,2016年,中尾 祐子,5-9人,東京都中野区中央1-38-1住友中野坂上ビル6階,https://hibiki-radio.jp/company
800,株式会社エルシオン,2023年,若林　インドラワニィ,5-9人,谷塚町598-7,http://www.ercyon.co.jp/
801,株式会社MONSTAR design,2011年,加藤　学,5-9人,札幌市西区二十四軒2条4-5-29 No.24 HACO 2F,https://mon-star.net/design/
802,株式会社LearnMore,2020年,坂口 雄哉,5-9人,南本町2-2-10,https://www.learn-more.co.jp/
803,株式会社アクティング,2008年,宮下　浩,30-99人,大阪府大阪市北区堂島浜2ー1ー3 堂島クレイドビル4F,https://www.act-ing.jp/
804,株式会社クリエイターズパーク,2022年,竹山広泰,5-9人,東京都中央区晴海2-3-30-3405 ザパークハウス晴海タワーズクロノレジデンス,https://creatorspark.jp/
805,株式会社秋山工房,2020年,​秋山 大地,10-29人,北海道網走郡津別町字東二条３番地３,https://www.akiyama.design/
806,株式会社サイン,2010年,日下 尚也,5-9人,御幸本町7-6,https://www.sign-kusaka.com/
807,株式会社スコープ・インターナショナル,1983年,宮浦　嘉造,10-29人, - ,http://www.scope-int.co.jp/
808,ツナガル株式会社,2010年,金岡毅,30-99人,大阪府大阪市南堀江1-12-2 東栄ビル 201,https://www.tsunagaru.co.jp/
809,株式会社アド・プログレス,2013年,長谷川喜代治,5-9人,愛知県津島市百島字献上27-3,https://adprogress.jp/
810,株式会社アド東北,1966年,進藤 勝実, - ,秋田県秋田市大町1-3-34　ADTビル,https://www.ad-tohoku.co.jp/
811,伊藤忠インタラクティブ株式会社,1982年,野波 宏安,100-499人,東京都港区南麻布3-20-1 麻布グリーンテラス3F,http://adaptiveplanning.cloud-gateway.com/
812,株式会社ヒナタデザイン,2009年,大谷 佳弘,5-9人,六番町6-4 LH番町スクエア6階,https://www.hinatadesigns.jp/
813,株式会社日本ダイレクトプロモーション,1963年,佐久間 純一,10-29人,東京都中央区日本橋茅場町1-10-8 グリンヒルビル,http://nd-promo.co.jp/
814,株式会社日庄マーケティング・ソリューション,2004年,杉山　章,5-9人,日本橋人形町1-1-11,https://nissho-ms.co.jp/
815,株式会社コロンバスプロジェクト,2014年,緒方　文平,10-29人,東京都中央区日本橋兜町9-5 兜町平和ダイヤビル808,https://www.columbusproject.co.jp/
816,株式会社アットファンズ・マーケティング,2019年,蒔田千晴,5-9人,東京都渋谷区道玄坂1-21-1 SHIBUYA SOLASTA 3F,https://atfanz-m.co.jp/
817,株式会社未来絵,2009年,末廣 由紀子,10-29人,兵庫県西宮市笠屋町10-27,http://www.milaie.com/
818,株式会社HOUSOUBU,2021年,帖佐 順三,5-9人,広芝町4-35 新大阪江坂オフィス18号室,https://prohousoubu.com/
819,株式会社イー・ステート・オンライン,2001年,吉田 哲也,100-499人,東京都千代田区神田神保町2-4東京建物神保町ビル7階,https://www.e-state.ne.jp/
820,有限会社アズソリューションズ,2005年,佐々木政幸,5-9人,神奈川県横浜市西区みなとみらい２－２－１　横浜ランドマークタワー２０F,https://www.azsolutions.co.jp/
821,株式会社セ・ラヴィ,2024年,稲田 賢一,5-9人,東京都港区北青山2-7-13 プラセオ青山ビル３階,https://cestlavie.tokyo/
822,株式会社宣栄社,1980年,横山 強一,10-29人,広島県広島市中区中町5-1 中町長沼ビル 3F,http://seneisya.co.jp/
823,株式会社pineal,2019年,徳原 靖也,5-9人,東京都港区南青山1丁目12-3 LIFORK MINAMIAOYAMA S214,https://pineal.co.jp/
824,株式会社JVIS,2005年,細田隆太郎,100-499人,東京都八王子市叶谷町1055,http://www.cybig.net/
825,センコー商事株式会社,1965年,堤 秀樹,100-499人,東京都江東区潮見2丁目8番10号　潮見SIFビル4F,https://www.senko-shoji.co.jp/
826,streamers 株式会社,2023年,小林 拓人,5-9人,東京都港区赤坂一丁目11番44号,https://streamers.co.jp/index.html
827,ST株式会社,2011年,西畑　明信,1-4人,埼玉県さいたま市中央区上峰1-22-12-102,https://www.st24jp.com/
828,株式会社LibertyWorth,2022年,村田 一弘,5-9人,原町田4-11-13 天野ビル４F,https://libertyworth.co.jp/
829,株式会社ラディアント・リンクス,2015年, - ,1-4人,京都府長岡京市奥海印寺向イ山24-31,https://www.radiant-links.com/service/%E7%BF%BB%E8%A8%B3-%E9%80%9A%E8%A8%B3/
830,株式会社HIORYES,2019年, - ,1-4人,岐阜県美濃市常盤町2274番地,https://hioryes.jp/
831,株式会社Zインディペンデンス,2022年, - ,1-4人,宮城県仙台市青葉区柏木１丁目７番地３７号,https://www.z-idp.com/
832,株式会社KOIKOI,2013年,森本猛,30-99人,東京都豊島区北大塚1-34-2,https://koikoi.co.jp/
833,タマ・アド株式会社,2002年,八谷信彦,5-9人,東京都港区高輪3丁目19-26 SOC高輪ビル3階,https://www.tama-ad.jp/
834,株式会社アンフィニ, - ,小林玄人, - ,東京都	杉並区上高井戸1-3-25	オトオアシスビル,https://www.infini.co.jp/
835,株式会社イノベーター･ジャパン,2010年,渡辺 順也,10-29人,東京都港区南青山3-13-18　 313南青山ビル2F,https://www.innovator.jp.net/
836,Buchi,2018年,岩淵　有希夫,1-4人,横浜市港南区日野8-19-4 102,https://buchi-0909.amebaownd.com/
837,株式会社ブレインズ・ネットワーク,1987年, - , - ,東京都新宿区山吹町347番地 藤和江戸川橋ビル3階・4階,https://www.brains-network.com
838,株式会社Maro,2016年, - , - ,東京都港区赤坂一丁目12番32号,https://www.maro-inc.jp/
839,有限会社アズリアル,2004年, - , - ,東京都目黒区上目黒2-43-20中目黒高架下89/90,http://asreal.co.jp/
840,有限会社 エー企画,1977年, - , - ,神奈川県川崎市多摩区生田８-２０-６,http://www.a-kikaku.co.jp/
841,住友不動産ベルサール株式会社,2008年, - ,30-99人,東京都新宿区西新宿二丁目6番1号  新宿住友ビル33階,https://www.bellesalle.co.jp
842,株式会社ベイス,2008年, - , - ,東京都文京区目白台2-9-5-1Ｆ,http://base-burger.com/about/profile.html
843,2nd Table株式会社,2007年, - , - ,大阪府大阪市中央区南船場4-12-8 関西心斎橋ビル8階,http://2ndtable.com/aboutus.html#companyOutline
844,株式会社 シービーサービス,2000年, - , - ,東京都荒川区東日暮里2-48-8,https://www.cb-service.co.jp/
845,株式会社あどばる, - , - , - ,東京都世田谷区玉川台2-2-8,http://www.favorite.co.jp/
846,株式会社小川弁当センター,1979年, - , - ,埼玉県比企郡小川町大字飯田４００,http://mirokutei.com/
847,株式会社KRJロックトレーラー事業部, - , - , - ,埼玉県草加市柳島町850-7,http://www.rock-trailer.jp/
848,株式会社ツクルス,2011年, - , - ,東京都練馬区小竹町2-71-5-2F,http://www.eventsket.com/
849,株式会社デカナル,1999年, - , - ,大阪府大阪市北区南森町1-1-27　和田ビル4B,http://www.dekanalu.com/
850,株式会社リンクイベントプロデュース,2009年, - ,30-99人,東京都中央区銀座4丁目12−15　歌舞伎座タワー 15階,https://event.link-ep.co.jp/
851,株式会社タック2PCE 事業部,1991年, - ,10-29人,京都府八幡市上津屋石ノ塔79番地千葉県千葉市花見川区三角町55,https://www.twopeace.co.jp/
852,株式会社宝来社,1905年, - ,30-99人,南央町3 番28,http://horaisha.co.jp/
853,株式会社サンデーフォークプロモーション,2008年, - ,30-99人,愛知県名古屋市東区東桜2-12-8　TIビル,http://www.sundayfolk-p.co.jp/
854,有限会社ワーカースタジオ,1998年, - , - ,香川県高松市東ハゼ町893-1,http://workerstudio.biz/
855,株式会社 太田グリーンパレスパーティサービス, - , - , - ,群馬県太田市細谷町1番地（冠稲荷神社ティアラグリーンパレス併設）,http://party-s.com/gps/p/annai.htm
856,株式会社ティー・シー・ピー,1992年, - ,10-29人,北海道札幌市中央区南1条西20丁目1-6  コミュ120 2F/3F,http://www.tcp-sapporo.co.jp/
857,X-Border株式会社,2004年, - , - ,東京都台東区東上野4-20-1 TCCビル4F,https://x-border.co.jp/
858,株式会社サンクネット,1997年, - ,30-99人,東京都江東区木場1-3-1 MR木場ビル6F,https://www.sanku.net/
859,株式会社ナノオプト・メディア,2000年, - , - ,東京都新宿区西新宿1-6-1  新宿エルタワー12F,https://nanooptmedia.jp/
860,株式会社アオイスポーツ企画,1960年, - , - ,東京都稲城市矢野口3266-1,http://www.aoisports.com/
861,株式会社アクト・インターナショナル,1992年, - , - ,東京都港区南青山2-9-18 青山ラルゴ101,http://actinter.co.jp/
862,有限会社 企画宣伝室,1994年, - , - ,福岡県福岡市中央区今泉2丁目1-35-101,http://www.kikakusendenshitsu.com/
863,株式会社フリーライフコミュニティ,2011年, - , - ,兵庫県姫路市西駅前町51,http://www.flco.co.jp/
864,シリウスマーケティング株式会社,2008年, - , - ,大阪府柏原市旭ヶ丘2丁目15番21号,http://www.sirius-m.co.jp/
865,ユナイテッドレボリューション, - , - , - ,大阪府大阪市淀川区西中島5-1-8 日研ビル701,http://revolution.jpn.com/
866,株式会社do, - , - ,5-9人,大阪府大阪市淀川区十三元今里2-5-17,https://www.dogeco.net/
867,えんじゃ屋, - , - , - ,千葉県我孫子市本町2-4-3　西田本町ビル6階,http://enjaya.com/
868,株式会社エフ・エス・ケー, - , - ,10-29人,新潟県新潟市中央区東出来島９番８号 （県庁前センタービル）,http://www.f-s-k.co.jp/
869,株式会社新交企画,1986年, - , - ,新潟県新潟市中央区幸西3丁目5番30号,http://ad-shinko.jp/
870,株式会社 創エスピー,1987年, - , - ,新潟県新潟市中央区米山1-8-4,https://www.sosp.jp/
871,株式会社フラワーコミュニティ放送,1998年, - ,10-29人,埼玉県鴻巣市東1-1-25　フラワービル5Ｆ,https://fm767.co.jp/
872,プロキシーサービス仙台, - , - , - ,宮城県仙台市若林区飯田字屋敷８,http://www.sendai-proxy-service.com/
873,ＳＲ企画, - , - , - ,愛知県名古屋市千種区覚王山通9-2-401,http://www.srkikaku.jp/
874,株式会社旭川コンパニオン,1970年, - ,5-9人,北海道旭川市神居3条20丁目67番地119,http://www.asacom.biz/
875,eplace, - , - , - ,0,http://spo-eplace.com/
876,上海ラクトコンサルティング, - , - , - ,上海市天山路789号　天山商厦2号楼（西側）23楼2301室(×?山?路),http://www.rakuto.com.cn/
877,株式会社サキガケアドバ,1964年, - ,10-29人,秋田県秋田市八橋新川向2-19,http://www.s-adv.co.jp/profile/index.htm
878,ヒューマンデジタルコンサルタンツ株式会社,2007年,代表取締役 後藤繁樹,30-99人,東京都新宿区新宿1-8-1 大橋御苑駅ビル6階,https://human-dc.com/
879,ニッセイエブロ株式会社,1950年, - ,30-99人,東京都港区西新橋1-18-17　明産西新橋ビル,https://www.eblo.co.jp/
880,株式会社AsMama,2009年, - , - ,神奈川県横浜市中区山下町73 アクティ横浜山下町1306号,http://www.asmama.co.jp/
881,有限会社アイズ・プロダクション,2005年, - , - ,東京都墨田区両国1-10-4-201,http://www.iz-pro.com/
882,株式会社サンエイ企画,1975年, - ,10-29人,東京都新宿区四谷本塩町8-2,https://www.bus-ad-seisaku.com/
883,株式会社ラヴィコ,2005年, - , - ,東京都台東区西浅草2-9-2 浅草スカイレジテル1階,http://www.lavieco.co.jp/
884,株式会社スーパーキャスト,1995年, - , - ,東京都港区赤坂6-10-4,http://www.supercast.jp/
885,株式会社セブンスソフトハウス,1989年, - , - ,東京都新宿区四谷1-8 HIRO四谷ビル5F,http://www.sevens-softhouse.com/
886,"CINRA, Inc.",2006年, - ,30-99人,東京都千代田区平河町2-5-3,https://www.cinra.co.jp/
887,株式会社ハイライフ,2003年, - , - ,神奈川県横浜市都筑区茅ヶ崎中央9-14,http://hlf.co.jp/work/produce/03.html
888,株式会社フィックス,1997年, - , - ,広島県広島市東区牛田新町3－20－1 HDビル 201,http://www.fixcorp.co.jp/
889,株式会社サンテクニカル, - , - , - ,東京都江東区東砂４丁目７番６号,http://greens.st.wakwak.ne.jp/905727/index.html
890,HotSprings株式会社,2015年, - , - ,静岡県静岡市駿河区古宿294,http://hot-springs.jp/
891,株式会社 アットワイズ,2008年, - , - ,東京都中野区中央4-26-10-705,http://atys.jp/
892,株式会社雲母,2007年, - , - ,東京都渋谷区広尾5-17-4,http://kirara.gr.jp/access/
893,株式会社タケナカ,1958年, - , - ,東京都江東区大島2-32-8  シンユニティ東京,https://www.takenaka-co.co.jp/
894,株式会社ストーリー, - , - , - ,東京都世田谷区野沢2-14-1 雨宮ビル1階,http://catering-season.com/
895,株式会社ハンズオン・エンタテインメント,1978年, - , - ,東京都港区北青山3-5-12 青山クリスタルビル4F,http://www.handson.gr.jp/
896,有限会社マイス,1996年, - , - ,東京都渋谷区渋谷2-3-4 青山TNビル3F,http://www.mys-natsu.jp/
897,株式会社クリスタル アイ, - , - , - ,福岡県大野城市川久保1丁目17-15,http://www.crystal-i.co.jp/
898,株式会社klar,2005年, - ,5-9人,群馬県前橋市西片貝町4-23-4,https://klar.co.jp/
899,株式会社 affect（アフェクト）,2009年, - , - ,埼玉県鴻巣市登戸108番地 B-101,http://www.affect-s2.com/
900,株式会社 ギドリー, - , - , - ,千葉県八千代市村上南5丁目8-6,http://www.guidry.co.jp/
901,株式会社フリースタイルエンターテインメント, - , - , - ,岡山県倉敷市新田255-4,http://www.fstyle-e.com/
902,有限会社セルム, - , - , - ,岡山県総社市清音三因1423-1,http://www.selumu.com/
903,MKヴォレ株式会社,2006年, - , - ,大分県大分市明野東1-24 明野ガーデンテラス,http://www.mkvole.jp/
904,オフィスプラトー, - , - , - ,山形県山形市流通センター4丁目6−1,https://plateau.events/
905,株式会社PLANDO,2013年, - , - ,福岡県糟屋郡篠栗町尾仲444-1-402,http://www.plando.info/
906,株式会社ブライト,2003年, - , - ,東京都新宿区舟町6番地5号 四谷1484ビル2F,http://bright777.com/
907,株式会社大和田組,1989年, - , - ,東京都港区三田2-14-4 三田慶応ビジデンス12F,http://ohwada-gumi.co.jp/
908,株式会社PIF,2006年, - , - ,大阪府大阪市中央区南船場3丁目11-18　 郵政福祉心斎橋ビル4F,http://www.p-i-f.net/
909,有限会社テイクワンプロデュース, - , - , - ,静岡県浜松市浜北区内野台4-34-37,http://take1produce.p-kit.com/
910,一般社団法人日本ベリーペイント協会, - , - , - ,東京都杉並区桃井2-2-2-407,http://body-paint.jp/
911,合同会社こどもみらい探求社,2013年, - , - ,兵庫県神戸市中央区元町通2-9-1 元町プラザ712A,https://kodomo-mirai-tankyu.com/
912,有限会社ハマオプロ,1986年, - , - ,福岡県福岡市博多区博多駅南3丁目13-23,http://hamaopro.com/
913,株式会社フォーカス,1983年, - , - ,大阪府茨木市沢良宜東町14-16,http://focususagi.com/
914,近藤産興株式会社,1947年, - , - ,愛知県名古屋市南区浜田町一丁目10番地,http://www.kondo-sanko.jp/company/gaiyou/index.html
915,株式会社スズヤ, - , - , - ,埼玉県吉川市三輪野江1105-2,http://www.suzuya-r.jp/
916,有限会社プラスワン,1994年, - , - ,茨城県水戸市城東3-1-12,http://www.plusone310.co.jp/
917,有限会社ヘッドルーム,1988年, - ,10-29人,茨城県つくば市竹園1-12-1 シンコービル3F,https://www.headroom.jp/
918,株式会社マスターオブリコール,1992年, - , - ,石川県金沢市黒田2丁目307-1,http://www.m-recall.com/
919,有限会社マリオンプロ,2003年, - , - ,石川県金沢市間明町2-51-902,http://www.marion-pro.com/
920,株式会社ペッププランニング, - , - , - ,神奈川県横浜市中区桜木町2-2 港陽ビル9F,http://www.pep-p.co.jp/
921,株式会社南北社, - , - ,5-9人,宮城県仙台市青葉区一番町1丁目12-2 星光堂ビル4階,http://nanbokusha.jp/
922,株式会社 コマデン,1962年, - , - ,東京都港区東麻布2-22-1,https://www.komaden.co.jp/
923,株式会社ケイ・アイ・エム,1982年, - , - ,東京都港区南青山6丁目9番2号,http://www.k-i-m.co.jp/
924,イベントレンタル八戸, - , - , - ,青森県おいらせ町境田78-11,http://www.er-8.com/
925,株式会社エポックコミュニケーションズ, - , - ,10-29人,秋田県秋田市川尻大川町4番7号,https://www.epochcom.co.jp/
926,シナプテック株式会社,2008年, - , - ,山梨県甲府市大手1-2-37 シルクサンシャインC105,http://www.synaptech.jp/
927,株式会社花芳, - , - , - ,滋賀県湖南市岩根中央2丁目36番地,http://www.niwa-hanayoshi.com/
928,株式会社シーズ・ライブ, - , - , - ,佐賀県三養基郡基山町小倉1667-4,http://www.ss-live.ws/
929,株式会社マルゼン看板,1977年, - , - ,佐賀県佐賀市鍋島町大字八戸溝2169-1,http://www.maruzen-kanban.com/
930,株式会社アトリエプロモーション, - , - ,1-4人,佐賀県佐賀市大和町大字尼寺2461-23番地,http://atelier-pro.area9.jp/
931,シェア株式会社, - , - , - ,福岡県福岡市中央区薬院3-3-8カムラビル6階,http://www.office-share.jp/
932,有限会社K.A.,2005年, - , - ,宮崎県宮崎市恒久南2丁目2-9 公栄産業第二ビル,http://k-agent.com/
933,株式会社グーニーズ,2009年, - , - ,宮崎県宮崎市恒久 6748-19,http://gooneeds.com/
934,有限会社クィーン工芸, - , - , - ,宮崎県宮崎市大瀬町2591番地,http://queen-k.co.jp/
935,株式会社清友商会, - , - , - ,滋賀県彦根市安清町3番27号,https://www.kiyotomo.net/
936,株式会社エキスポインターナショナル,1984年, - ,30-99人,東京都千代田区神田和泉町1-3-1 三恵ビル9F,http://www.expo.co.jp/
937,株式会社モーフィング, - , - , - ,東京都渋谷区元代々木町22-7 村世界1F,https://m-inc.jp/
938,株式会社ステップ,1986年, - ,30-99人,神奈川県横須賀市神明町 1-50,https://www.step-japan.co.jp/
939,パドルデザインカンパニー株式会社,2000年, - , - ,東京都港区南青山2-18-2 竹中ツインビルA-3F,https://www.paddledesign.co.jp/
940,株式会社リアライブ,2012年, - , - ,東京都港区赤坂1-12-32  アーク森ビル4F,https://realive.co.jp/
941,株式会社ヒューテックジャパン, - , - , - ,福岡県福岡市博多区博多駅南4-2-10南近代ビル8階,http://www.hutec-japan.co.jp/
942,株式会社ラウンドプロジェクト,2009年, - , - ,東京都千代田区神田淡路町1-1 KANDA CREST Bldg.,http://roundproject.jp/
943,株式会社VISUALBEATS, - , - , - ,東京都千代田区神田須田町2-9-5 柴田第一ビル6F,http://asobeats.com/
