No.,会社名,設立年,代表者名,従業員数,住所,会社URL
1,株式会社ブイキューブ,1998年,間下 直晃,100-499人,東京都港区白金一丁目17番3号NBFプラチナタワー16階（受付）、17階,https://jp.vcube.com/eventdx
2,株式会社エイスリー,2008年,高橋 太一,30-99人,東京都渋谷区神宮前3-35-2　クローチェ神宮前ビル6F,https://www.a3corp.jp/
3,株式会社エレメント,2004年,岡本　鉄平,10-29人,東京都渋谷区恵比寿1-8-1　サン栄ビル9F,http://www.element-inc.jp/
4,株式会社Liderar,2023年,大久保 竜介,1-4人,千葉県千葉市花見川区花園1丁目7−15 SS小川ビル 4F,https://liderar.co.jp/index.html
5,株式会社ヴァリアス・ディメンションズ,2002年,阪柳 敏行,100-499人,東京都中央区銀座7-17-2アーク銀座ビルディング4F,https://v-dimensions.com/
6,株式会社Airz,2019年,宮崎俊行,10-29人,東京都港区東麻布3-8-2 麻布マルカビル4F,https://airz.co.jp/
7,株式会社アズムクリエイション,2011年, - ,10-29人,東京都渋谷区神宮前3-38-5 カクセンプレイス3F,https://www.azm-cr.co.jp/
8,株式会社J-Rights,2011年, - ,10-29人,兵庫県芦屋市春日町13-5-C201,https://j-rights-inc.com
9,株式会社GROOMIX,2005年,菅井浩二,5-9人,東京都目黒区上目黒2-44-3  MGフラッツ401,https://www.groomix.co.jp
10,株式会社ポマト･プロ,1983年,飯島　髙尚,30-99人,東京都千代田区麹町5-3麹町中田ビル4F,http://pomato.co.jp/
11,株式会社ハピ・ディレクション,2020年, - ,1-4人,東京都渋谷区東2-27-10TBCビル4F,https://www.hapy-direction.co.jp/
12,株式会社アノマリー,2004年,神田 勘太朗,10-29人,東京都渋谷区千駄ヶ谷1-13-3 カリスマヒルズレジデンス国立競技場前,https://www.anomaly.co.jp
13,株式会社クロノスジャパン,2001年, - ,10-29人,東京都港区新橋2-5-6大村ビル6F,http://cronosjapan.com/
14,株式会社イベック, - , - , - ,東京都港区赤坂4-15-1 赤坂ガーデンシティ 14F,https://vectorinc.co.jp/business/pr/evech
15,クリエイティブ・ファクトリー株式会社,2009年,越澤　勝好,5-9人,東京都新宿区新宿5-15-14 INBOUND LEAGUE（インバウンドリーグ）5階,https://creativefactory-co.jp
16,株式会社エス・ブイ・シー ディレクションズ,2017年, - ,10-29人,東京都中央区日本橋本町3-9-7 ARCCUBE日本橋本町6F,https://www.sv-c.jp
17,有限会社サムシング・フォー,2005年,小平 友幸,1-4人,埼玉県越谷市レイクタウン２丁目２１−６,http://www.something-four.co.jp/
18,株式会社クレスト,2021年, - ,100-499人,東京都武蔵野市中町1-19-20アソルティ三鷹５階,https://crest01.co.jp/
19,リンクストラテジー株式会社,2021年, - ,1-4人,東京都台東区台東1-12-10ロータリーパレス秋葉原2階,https://linkstrategy.jp/
20,株式会社CREA,2020年,川崎 正仁,5-9人,大阪府大阪市中央区谷町2-5-4　エフベースラドルフビル6F,https://crea-co.jp/
21,株式会社アスカ企画,1993年,佐藤　秀司,10-29人,東京都文京区本郷2-14-14 レジデンス本郷アコマ4F,https://asuka-plan.com/
22,株式会社ストラーツ,2018年, - ,10-29人,東京都港区南青山3-8-40青山センタービル2F,https://strarts-event.com/
23,株式会社スマートノート,2018年,林 裕也,30-99人,愛知県名古屋市中区錦2-2-24 いちご丸の内サウスビル5F,https://smartnote.jp/
24,株式会社ムード,2020年,安藤 愼平,1-4人,東京都文京区本郷3-3-11 IPB御茶ノ水ビル９F,https://www.moodinc.jp/
25,株式会社サピエント,2012年,湯川 智子, - ,東京都港区台場2丁目3-1 トレードピアお台場14階,https://www.sapient-inc.co.jp/
26,株式会社博展,1970年, - ,100-499人,東京都中央区築地1-13-14 NBF東銀座スクエア,https://www.hakuten.co.jp/
27,株式会社ザ・カンパニー,2009年,橘 啓介,5-9人,東京都渋谷区神宮前2-31-7 ビラ・グロリア#503,https://www.the-company.co.jp/
28,株式会社サムライズ,2005年,奥田 洋三,5-9人,大阪府大阪市高見2-10-5,https://somerise.co.jp/
29,有限会社日本産業広告社,2003年,石原　聖剛,5-9人,東京都豊島区南池袋1-16-15　ダイヤゲート池袋5階（リージャス池袋ビジネスセンター内）,https://www.jia.co.jp/
30,株式会社East Ship,2021年,寺澤　正史,5-9人,東京都世田谷区用賀2-38-10清水ビル402,https://eastship.co.jp/
31,株式会社ディモルギア,1989年,長沼　茂夫,30-99人,東京都文京区湯島3-24-11　湯島北東ビル2F,https://dimiourgia.jp/
32,株式会社グレイス,2015年,大田　徹,5-9人,大阪府大阪市中央区南久宝寺町2-6-15 中川ビル4階,https://officialgrace.com
33,株式会社アイ・オー・ワン,2001年, - ,5-9人,大阪府大阪市北区堂島2-1-2 中村屋ビル503,https://io1.co.jp/
34,株式会社サウンズグッド,2005年, - ,1-4人,東京都中央区銀座４－１３－１松戸ビル４階,http://sounds-gd.com/
35,株式会社エーディープロジェクト,1993年, - ,30-99人,東京都渋谷区代々木２-２７-４,https://www.adproject.co.jp
36,株式会社アソビズ,2016年, - ,1-4人,神奈川県横浜市旭区善部町42-35,https://www.aso-biz.jp/
37,株式会社オーエムシークリエイティブ,1984年, - ,10-29人,東京都中央区築地2-10-6　Daiwa築地駅前ビル1F,http://www.omcc.co.jp/
38,株式会社デルフィス・ドライブ,1967年, - ,30-99人,東京都千代田区神田淡路町2丁目101番地 ワテラスタワー9F,http://d-drive.co.jp/
39,株式会社TRICK,2019年, - ,1-4人,東京都新宿区新宿5-10-10 海老沢ビル202,https://trick-group.co.jp/
40,株式会社TWINKLE STARS,2019年,松川　倫子,5-9人,兵庫県神戸市磯上通8-1-29カサベラビルC＆M403,https://twinklestars.co.jp/
41,株式会社ディスタッフ・イベントス,2007年,野田　富喜由,10-29人,愛知県名古屋市中区錦1-6-38　錦エムワンビル5F,http://thistaffeventos.jp/index.html
42,株式会社ユービコーポレーション,1991年, - ,10-29人,東京都豊島区南長崎6-1-2,http://www.yubi.co.jp/
43,株式会社フジヤ,1960年, - ,100-499人,京都府京都市中京区東堀川通丸太町下ル 7-4東京都江東区豊洲5-6-36豊洲プライムスクエア 3F,http://www.fujiya-net.co.jp/
44,株式会社ムラヤマ,1958年, - ,100-499人,東京都江東区豊洲 3-2-24 豊洲フォレシア,http://www.murayama.co.jp/
45,株式会社タカヨシ,1960年,高橋佑,100-499人,愛知県名古屋市桜が丘295 第八オオタビル7階,https://www.takayoshi.co.jp/
46,株式会社 東真,1967年,飯田　仁晴,30-99人,東京都新宿区四谷4－14 TOSHIN BLDG. 3階,http://toshin-event.com/
47,株式会社ブロアジャパン,2010年, - ,10-29人,東京都千代田区神田須田町2-13-1 YKS黒田ビル5F/7F,https://broa.jp/
48,株式会社ネクサス,2022年, - ,5-9人,埼玉県川越市鴨田541-10,https://nexus-y.com/
49,合同会社イースリー,2023年,兒玉　隼, - ,東京都港区南青山3-1-36 青山丸竹ビル6F,https://ethreee.jp/
50,株式会社CCG C.REP,2020年,田中　悠,10-29人,東京都千代田区九段南2丁目3-14 日本生命靖国九段南ビル4F,https://ccg-crep.jp/
51,株式会社CeiRyu,2023年,太田　智之,5-9人,大阪府大阪市中央区南本町1-5-7　ACN堺筋本町ビル 5F,https://ceiryu.tech/
52,株式会社GROWS,2014年,島田忍,10-29人,東京都千代田区神田司町2-4 ME神田司町ビル2F,https://grows-net.com
53,有限会社ムウプロモート,2002年, - ,10-29人,東京都千代田区神田小川町2-6-12 東観小川町ビル6F,http://www.mu-promote.co.jp/
54,株式会社 テー・オー・ダブリュー,1976年, - ,100-499人,東京都港区虎ノ門四丁目3番13号 ヒューリック神谷町ビル3F,http://www.tow.co.jp/
55,橙デザイン株式会社,2020年, - ,5-9人,広島県広島市中区榎町5−14 榎町ビル2F,https://daidai-design.jp/
56,株式会社イクシム,2019年,井上 恭男, - ,兵庫県尼崎市神崎町25-8,https://ex-im.co.jp/
57,株式会社エフ・クレスト,1998年,半田　昌大,30-99人,東京都港区東麻布1-4-2　THE WORKERS & CO 2F,http://www.fcrest.co.jp/
58,株式会社ワイズインテグレーション,1998年, - , - ,東京都渋谷区千駄ヶ谷4-23-5 JPR千駄ヶ谷ビル7F,https://www.wise-int.co.jp/
59,株式会社サンケイ会館,1971年,箕輪千明,30-99人,東京都千代田区神田錦町1-19-1　神田橋パークビル2階,https://sankeikaikan.com/houjin/
60,株式会社アイ・コミューン,2005年, - ,5-9人,東京都千代田区神田小川町1-8-8 OCT KANDA Building 8F,https://www.i-comm.co.jp/
61,株式会社 NEO FLAG.,2011年, - ,30-99人,神奈川県横浜市都筑区中川1-22-14 美来空間ビル3F,http://event.neo-flag.com/
62,合同会社ギルド,2014年, - ,5-9人,東京都豊島区池袋2-62-1 PISO池袋801,https://guild-llc.com/
63,株式会社プラスワン・クリエイト,2010年, - ,1-4人,大阪府堺市北区北花田町3丁37-13,http://www.p1c-pr.co.jp/
64,株式会社スペースクリエイションズ,2016年, - ,1-4人,神奈川県川崎市麻生区上麻生4-4-3-202,http://space-creations.com/
65,株式会社シャフト,2020年, - ,5-9人,東京都品川区五反田1丁目2-41　菱和パレス島津山103号室,http://shaft-link.co.jp/
66,ワヨー株式会社,1982年, - ,100-499人,東京都台東区蔵前１丁目８－２,https://www.wayo.co.jp/
67,株式会社イベントプラス,2015年, - ,10-29人,東京都品川区西五反田8－8－16五反田高砂ビル703,https://event-plus.co.jp/
68,株式会社スピン,1970年,齊藤 康太,30-99人,東京都新宿区市谷本村町2番34号,https://www.spin-inc.co.jp/
69,株式会社イノベーションパートナーズ,2018年, - ,10-29人,東京都港区南麻布1-6-30,https://innovation-partners.jp/
70,株式会社パンスール,2008年,寺嶋　正浩,100-499人,大阪市中央区南船場3-7-27 NLC心斎橋6F,https://www.penseur.co.jp/
71,株式会社 The Light,2024年,尾崎大輔,1-4人,東京都北区豊島8-8-8,https://thelightforfilmandphoto.com/
72,株式会社TopKnock,2013年, - ,10-29人,〒150-0002 東京都渋谷区渋谷2-3-11 ラ・ネージュ青山5F,http://topknock.co.jp/
73,株式会社ALIVE,2011年, - ,1-4人,東京都港区南青山4-17-33 グランカーサ南青山2F,https://www.alive-japan.com/
74,KMC EVENT FACTORY INC.,2011年, - ,5-9人,大阪府大阪市中央区谷町2-5-4　エフベースラドルフビル6F,http://kmc72.com/
75,株式会社エイティ企画,2006年, - ,1-4人,愛知県名古屋市港区東蟹田1804,http://www.at-kikaku.co.jp/
76,アーク・フロント株式会社,2002年, - ,10-29人,東京都足立区西竹の塚2-3-1,https://www.arkfront.jp/
77,株式会社アルファ・クリエイト,2004年,山下　健治,100-499人,河内郡上三川町西汗1780,https://alpha-04.com/
78,株式会社フィールドワンプロモーション,2007年,古川　博崇,10-29人,東京都中央区新川2-6-16 馬事畜産会館704,http://www.f1p.co.jp/
79,合同会社INFY,2022年,森川 博,1-4人,埼玉県川口市東本郷1497-26,https://infyllc.wordpress.com/
80,株式会社パワーリーダー,2017年,大橋浩一,100-499人,東京都新宿区西新宿３丁目－９－3,https://powerleader.flow-g.com/
81,ファンリンク株式会社,2017年,鈴木　康仁,1-4人,渋谷区恵比寿1-15-9 日宝恵比寿ビル503,https://funlink.co.jp/
82,株式会社STUDIO誠,2021年,福田 奨,1-4人,東京都新宿区市谷台町１４番５号ＭＳビル市ヶ谷台４Ｆ,https://studiomakoto.co.jp/
83,株式会社MCクラフト,2016年, - ,30-99人,東京都中央区日本橋浜町3-23-1,http://mc-craft.net
84,有限会社ステアリング,1987年,望月悠登,5-9人,東京都目黒区目黒2-10-8　第二アトモスフィア青山10F,https://create.steering.co.jp/
85,株式会社Her's,2017年, - ,30-99人,東京都中央区京橋3-9-2　宝国ビル5F,http://hers-net.co.jp/
86,株式会社ジャストファイン,2018年,平島　孝則,100-499人,東京都新宿区西新宿8-1-2 PMO西新宿13階,https://www.justfine.co.jp/
87,株式会社ワンステップワークショップ,1988年,高橋 博,30-99人,東京都港区虎ノ門5-11-1オランダヒルズ森タワーRoP 701,https://www.onestepworkshop.co.jp/
88,WITHPROJECTS株式会社,2009年,木林 威夫,10-29人,大阪府大阪市西区京町堀2丁目3-4 SunYamatoBld. 4F,https://www.withprojects.co.jp
89,株式会社ミックスゾーン,1981年, - ,30-99人,東京都千代田区内幸町1-1-7NBF日比谷ビル16F,https://mixzone.co.jp/
90,ＴＳＰ東日本株式会社,1999年, - ,30-99人,東京都目黒区東山1-6-1　エスビル7階,https://www.tspeast.co.jp/
91,株式会社モードセンター,1953年,井上　岳,100-499人,東京都豊島区西巣鴨1-9-6,https://mode-center.co.jp/
92,グローブマーケティング株式会社,2011年,宮田泰郎,30-99人,東京都千代田区麹町3-2　麹町共同ビル4F,https://www.growb.co.jp/
93,株式会社ケンズエージェンシー,1997年, - ,10-29人,千葉県千葉市中央区末広2-13-1,https://www.kenz.ne.jp/index.html
94,株式会社サンクス,1989年,吉田謙一,30-99人,三重県津市丸之内11番10号,https://thanks-east.com
95,株式会社ライツアパートメント,2006年, - ,100-499人,東京都港区三田一丁目四番一号 住友不動産麻布十番ビル四階,https://www.rights-apartment.com/
96,LASTKEY株式会社,2020年,岩本 裕美子,1-4人,東京都世田谷区玉川台2-21-16,https://lastkey.co.jp/
97,TSP太陽株式会社,1955年,池澤　嘉悟,100-499人,東京都目黒区東山1-17-16,https://www.tsp-taiyo.co.jp/
98,株式会社Ｋ’ｓカンパニー,2020年,小里 祐介,5-9人,東京都新宿区西新宿6-10-1 新宿オークシティ日土地西新宿ビル8階,https://k-s-company.co.jp/
99,株式会社シャン・クレール,1994年, - , - ,東京都新宿区西新宿2-6-1 新宿住友ビル48F,http://www.chane-claire.jp/
100,合同会社GAIBF,2016年, - , - ,兵庫県神戸市灘区徳井町2丁目4-22-104,http://gaibf.com/toushoumen/
101,日本プロデュース合同会社, - , - , - ,東京都港区浜松町2-2-15 浜松町ダイヤビル２階,http://vjsv.com/
102,株式会社サイバーネット,1995年,遠 藤 晃 司,30-99人,東京都豊島区東池袋3-22-7　CN ビル,http://www.cyber-nt.co.jp/
103,株式会社サードライフ,2022年,中田 和寿,5-9人,兵庫県神戸市中央区磯上通7-1-5 三宮プラザEAST 9F,https://thirdlife-dc.com/
104,株式会社ベストクルーズ,1993年,髙橋　一行,30-99人,東京都渋谷区広尾1-3-18 広尾オフィスビル７階,http://www.bestcrews.co.jp/
105,株式会社グローブス,2014年, - , - ,東京都世田谷区船橋3-5-26-109,http://globes.co.jp
106,株式会社ビーンジャム,2012年, - ,1-4人,東京都新宿区高田馬場1-31-16,http://www.beanjam-japan.com/
107,株式会社ケイ・スリー・クリエーション,2006年,髙野　三千彦,10-29人,東京都港区芝大門2-1-15　羽織屋ビル5F,http://www.k3c.co.jp/
108,株式会社CLAN, - , - ,5-9人,東京都港区東新橋2-10-7中銀新橋第二ビル9F,https://clan-inc.jp
109,ジェイ・ネクスト株式会社,1985年,石田　国広,30-99人,東京都渋谷区渋谷2-12-19 東建インターナショナルビル6階,https://www.j-next.co.jp/
110,株式会社エンブレム, - , - ,10-29人,東京都港区芝2-22-15 STKビル6F,http://e-mblem.co.jp/
111,株式会社リアルプロモーション,2007年, - ,10-29人,東京都千代田区神田東紺屋町31　神田槇町トライアングルタワーズ2階,http://www.realpromotion.co.jp/
112,株式会社 アーツ&カルチャルマネジメント社,2010年,井上知佐子,5-9人,東京都港区南青山5丁目7番17号,https://www.acm2010.com/
113,株式会社neo,2022年,関 憲太郎,5-9人,愛知県名古屋市新栄2-1-25　NR新栄7F,https://neoneo.jp/
114,株式会社 ウエ・コーポレーション,1991年,上島　丈児,5-9人,東京都港区青山1-15-16　山城ビル4F,http://www.uecorp.co.jp/
115,株式会社トヨプラ,2017年,豊 圭一,10-29人,東京都品川区上大崎2-14-3 三笠ビルA棟3階,https://toyopla.co.jp/
116,株式会社ステージ・ループ,1991年,長 今田 晴義,30-99人,静岡県浜松市中島1-35-16,https://www.stageloop.co.jp
117,合同会社インプレス,2019年,宮前　智,1-4人,北海道江別市野幌若葉町30-10,https://www.impress-event.jp/
118,有限会社 サキガケサービス,2001年, - , - ,埼玉県川口市戸塚1-6-36,https://www.sakigake-s.co.jp/
119,株式会社ニューズベース,1989年, - ,10-29人,東京都中央区銀座7-16-12　G-7ビルディング9階,https://www.newsbase.co.jp/
120,株式会社ベネックス,2004年, - ,5-9人,大阪府大阪市北区堂島浜1丁目4番19号　マニュライフプレイス堂島10階,http://www.benexinc.com/
121,株式会社オージャスト,2006年, - ,10-29人,大阪府大阪市東成区深江北2-15-24東邦ビル 212,http://www.orgiast.jp/
122,株式会社 ドゥ・クリエーション,1982年,山口　信之,100-499人,東京都千代田区岩本町3-10-4 寿ビルディング　2F,https://www.do-c.com/
123,株式会社 新大阪音楽センター,1978年, - , - ,大阪府大阪市淀川区西中島6-3-24 北白石ビル西館3F,http://shinosaka-ongakucenter.co.jp/
124,株式会社トレンド・オン,2002年, - , - ,東京都千代田区岩本町1丁目8-16　アチェロビル2階,https://www.trend-on.jp/
125,株式会社ディカーナ,2008年, - ,5-9人,熊本県熊本市東区桜木3-1-26　ディカーナビル1階・2階,http://www.dicana.jp/
126,株式会社エフジー,2012年,福島 崇志,30-99人,神奈川県横浜市神奈川区鶴屋町3-29-1　木口ビル5F,http://www.fg-2012.com/
127,株式会社ブレイヴシーティーダブリュー,2006年, - ,1-4人,東京都渋谷区広尾1-9-16 広尾宮田ビル3F,https://bravectw.co.jp/
128,株式会社マックスファイブ,2001年,望月一輝,5-9人,東京都台東区浅草橋1-13-6　浅草橋STビル3階,https://max5.co.jp/
129,Lucidus stage株式会社,2023年,巽　拡光,5-9人,大阪府松原市天美南2-135-25,https://lucidus-stage.com/
130,株式会社リオエンターテイメントデザイン, - , - ,5-9人,東京都港区西麻布1-15-7 モダンフォルム西麻布ビルll5F,https://www.rio-e-design.com
131,株式会社アイワット,1956年,岩田　修平,100-499人,愛知県名古屋市中区新栄1丁目7番22号,https://www.iwat.co.jp/
132,株式会社トマトジュース,2018年,代表取締役　冨好　洋康,10-29人,東京都千代田区神田淡路町2-10-14 ばんだいビル,https://www.tomatojuice.jp
133,株式会社ソラシア・エンタテインメント,2013年, - , - ,東京都港区六本木3-16-33 青葉六本木ビル3F,http://solasiaent.co.jp/#contact
134,株式会社リベルダージ,2004年,土勢隆至,5-9人,東京都渋谷区宇田川町36-6 ワールド宇田川ビル6F,http://www.reveldage.com
135,株式会社RICOFUL,2017年, - , - ,東京都豊島区西池袋2丁目36-10 ACN池袋ビル5F,https://ricoful-paint.com/
136,有限会社depth,2005年, - ,5-9人,東京都新宿区新宿5-1-1 ローヤルマンションビル401号室,http://depth-inc.co.jp/
137,Unbel合同会社,2016年, - , - ,千葉県白井市西白井3-8-7,https://unbel.jp/
138,株式会社E4un,2023年,横山　巧,5-9人,東京都新宿区高田馬場2-17-3-810,https://e4un.jp/
139,株式会社Roots,2018年, - ,30-99人,埼玉県草加市谷塚町628,https://rootsinc.co.jp/
140,株式会社Asian Bridge,2007年,小西　広恭,30-99人,東京都港区芝3-1-15 芝ボートビル 7F,https://asianbridge.co.jp/
141,合同会社Motchme,2023年,望月美里,5-9人,大阪府大阪市西区九条2-9-14,https://motchme.com/
142,株式会社one,2010年,清水佑介,10-29人,東京都新宿区神楽坂6-42　神楽坂喜多川ビル3F,https://one-inc.co.jp/
143,株式会社産案,1954年, - , - ,東京都中央区日本橋蛎殻町1-16-8 水天宮平和ビル 2F,http://www.san-an.co.jp/
144,株式会社ウィズアス,2009年, - ,10-29人,東京都中央区銀座7-16-12 G-7ビルディング9階,http://www.withus-inc.co.jp/
145,株式会社fosbury,2008年, - , - ,"東京都新宿区西新宿6-12-1 パークウエストビル5,6F",http://fosbury.co.jp/
146,株式会社ノビテク,2005年,大林　伸安,10-29人,東京都文京区小石川2-1-12 小石川トーセイビル10階,https://www.nobetech.co.jp/
147,株式会社カケハシスカイソリューションズ,2011年, - ,100-499人,東京都新宿区神楽河岸1-1 セントラルプラザ7F,https://www.kakehashi-skysol.co.jp/
148,株式会社文化放送開発センター,1967年,渡邊能秀,30-99人,東京都港区浜松町１丁目31番,https://www.joqr-bkc.co.jp/
149,株式会社IPシンフォニー,2009年, - , - ,東京都中央区日本橋室町 1-10-10 LXS室町1002,http://ip-s.jp/
150,株式会社ハーツクリエーション,2006年,鷲尾まり子,10-29人,東京都渋谷区恵比寿西1-33-15 EN代官山ビル801号,http://www.heartscreation.co.jp/
151,サクラインターナショナル株式会社,1980年, - ,100-499人,大阪府大阪市中央区備後町1-7-3 ENDO堺筋ビル3F・4F,https://www.sakurain.co.jp/
152,株式会社DI Palette,1947年, - ,100-499人,新潟県新潟市中央区和合町2-4-18,https://www.dip.co.jp/
153,株式会社セレブリックス,1998年,江川　利彦,1000人以上,東京都江東区有明3-7-18有明セントラルタワー7階,https://www.cerebrix.jp/
154,南海ケータリングサービス株式会社,1989年, - , - ,大阪府高石市取石5丁目2-40,https://nankai-cs.co.jp/
155,株式会社イベント・コミュニケーションズ,1992年, - ,30-99人,千葉県木更津市潮浜1丁目17番地21号,http://www.eventcom.jp/
156,株式会社ビジネス・フォーラム事務局,2001年, - , - ,東京都千代田区神田小川町2-2 センタークレストビル9F,https://www.b-forum.net/
157,NETWORK,1990年, - , - ,新潟県新潟市中央区東大通1-7-10　新潟セントラルビル4階,http://www.network-sp.com/
158,株式会社新宣,1986年, - ,30-99人,新潟県新潟市中央区神道寺2丁目3番23,http://shinsen.biz/
159,株式会社新潟コンベンションサービス,2001年, - , - ,新潟県新潟市北区太夫浜新町1-19-25,http://www.niicon.jp/
160,株式会社YUUKI JAPAN,2004年, - , - ,三重県鈴鹿市郡山町2077番地1,https://www.yuukijapan.co.jp/
161,株式会社　エープランニング京都,1983年, - , - ,京都府京都市東山区今熊野本瓦町658-7,http://www.ap-kyoto.co.jp/
162,株式会社 常創,1998年, - ,30-99人,茨城県水戸市住吉町2番地25,https://joso.cc/
163,株式会社フィールド,1995年, - ,10-29人,愛知県名古屋市中区大須4-1-21NOVAビル10F,http://www.field-1.com/
164,有限会社イグジットオーガニゼイション,1999年, - ,10-29人,高知県高知市鷹匠町1-3-22 スクエアフロント1F,http://www.exit-group.jp/
165,ビィズ・クロコ株式会社,1989年, - , - ,東京都港区南青山2-24-15　青山タワービル13F,https://www.bizgroup.co.jp/
166,アコーダー株式会社,1959年, - ,10-29人,大阪府大阪市中央区内本町2-4-16,https://www.accorder.co.jp/
167,株式会社bloss,2012年, - ,1-4人,宮崎県延岡市塩浜町2丁目1869-1,http://smile-blossom.com/
168,株式会社アイモ,2003年, - ,10-29人,東京都港区西新橋1-24-16 平和ビル4階,https://imo-inc.co.jp/
169,株式会社ふわふわ,2000年, - , - ,大阪府茨木市清水1-34-12,http://www.fuwafuwa.net/
170,株式会社カクタス,1996年, - ,30-99人,大阪府大阪市西区新町1-28-11 安川ビル5F,http://cactus7.co.jp/
171,株式会社アステム,1974年, - ,30-99人,大阪府大阪市北区東天満2-7-12,https://www.astem-co.co.jp/
172,株式会社マッシュ,1981年, - ,30-99人,大阪府大阪市北区豊崎5-6-10 商業ビル7F,https://www.mash-japan.com/
173,株式会社福岡パーティ企画,1985年, - , - ,福岡県福岡市博多区浦田2丁目1-18,http://theparty.jp/
174,株式会社シナジーワークス,2010年, - , - ,福岡県福岡市中央区警固1-1-24 KEGO124テラス 4B,https://www.synergy-works.jp/
175,株式会社サヴィー,1990年, - , - ,福岡県福岡市中央区大手門2丁目1-32 フェニックス大手門ビルディング 2F,http://www.thavi.co.jp/
176,株式会社オオガプロモーション,2007年, - , - ,福岡県福岡市博多区博多駅中央街5-11 第13泰平ビル10階,http://ohga-pro.com/
177,株式会社アム・トゥーワン,1985年, - ,30-99人,福岡県福岡市博多区冷泉町2番17号　神世第2ビル,http://www.am21.co.jp/
178,株式会社イベントプロデュースガッツ,1993年, - , - ,山形県山形市松波1-7-1新潟県新潟市中央区南笹口1丁目8番52号東京都中野区新井1-15-12,http://www.gutspro.com/
179,山新建装株式会社,1968年, - ,10-29人,山形県山形市富神台28番地,http://www.yamashin-kenso.co.jp/
180,株式会社いまじん,2016年, - ,1-4人,山形県鶴岡市友江字水尻50-13,https://imagine-shonai.jp/
181,株式会社ステージアンサンブル東北,2015年, - , - ,山形県山形市桧町1丁目3-32,http://www.ensemble-tohoku.jp/
