No.,会社名,設立年,代表者名,従業員数,住所,会社URL
944,株式会社いろはにほへと, - , - , - ,大阪府大阪市西区北堀江1丁目6-5 大輪ビル6階B号,https://deli-cook.com/
945,ファーストケータリング株式会社, - , - ,10-29人,大阪府大阪市中央区森ノ宮中央1-14-1,https://first-catering.jp/
946,株式会社DCF,2003年, - , - ,埼玉県羽生市南6-17-6,https://www.dcf-communication.com/
947,株式会社stand up A guy's, - , - , - ,東京都墨田区東向島3-38-4-1F,http://www.event-suguys.com/
948,株式会社ダークホース, - , - , - ,大阪府大阪市浪速区日本橋西1-2-5 AIビル2F,http://www.dark.co.jp/
949,株式会社タカオカ, - , - , - ,神奈川県横浜市西区平沼１丁目３９番３号 三石ヨコハマビル４階,http://www.takaoka-pro.co.jp/
950,株式会社 ビークス,2003年, - , - ,大阪府大阪市西区京町堀2-8-23,https://www.beaks.jp/
951,株式会社 クラッチ．, - , - , - ,大阪府大阪市北区西天満3-6-28 オクタス西天満ビル5F,http://clutch-sp.com/
952,株式会社ディヴォーション,1996年, - ,10-29人,大阪府大阪市北区東天満1-12-13 IAG天満ビル7Ｆ,http://www.devotion-japan.com/
953,アシスト・ジャパン株式会社, - , - , - ,東京都渋谷区道玄坂2-16-4 野村不動産渋谷道玄坂ビル4F,https://ssl.assist-j.com/
954,株式会社シグマコミュニケーションズ,1986年, - ,500-999人,東京都港区芝4-1-23 三田NNビル 3F,http://www.sigma-com.co.jp/
955,株式会社ゼロイン,1998年, - ,100-499人,東京都中央区銀座7-4-12 銀座メディカルビル4階,http://www.zeroin.co.jp/
956,グローバルプランニング株式会社, - , - , - ,岡山県倉敷市四十瀬331-7,https://www.globalp.co.jp/
957,株式会社ＫＩＮＧＢＥＡＴ, - , - , - ,東京都港区六本木3-3-28 　マノア六本木201,http://www.king-beat.com
958,株式会社クロト,2008年,亀田　美沙,5-9人,東京都港区南麻布2-8-21 SNUG MINAMI-AZABU 401,https://clo-tho.com/
959,株式会社ディーフレックス,1988年, - , - ,東京都港区赤坂2-17-44 福吉坂ビル3F、B1F,https://www.deeflex.jp/
960,株式会社アビ（AVI inc.）,1990年, - , - ,大阪府大阪市北区東天満1-11-13 AXIS大森町ビル2F,http://www.n-avi.co.jp/
961,株式会社リード・2001,1990年, - ,10-29人,東京都渋谷区恵比寿南1-2-10　エビスユニオンビル,http://www.lead2001.co.jp/company/
962,株式会社ケーズ・クルー, - , - ,10-29人,東京都新宿区四谷三栄町12番5号 ライラック三栄ビル4階,http://kscrew.co.jp/
963,株式会社ベースオントップ,1989年, - , - ,大阪府大阪市中央区南船場4-4-3 心斎橋東急ビル5F,https://www.bassontop.co.jp/
964,株式会社 エイトプランニング, - , - , - ,神奈川県横浜市中区相生町 1-1-5-4F,http://www.epinc.co.jp
965,株式会社オー・アール・ビー,2007年, - , - ,東京都渋谷区渋谷1丁目11-8  渋谷パークプラザ,http://orb-inc.jp/index.html
966,株式会社アブラプロ, - , - , - ,大阪府大阪市中央区谷町5丁目6-12新野村ビル3F,http://abra-inc.com/
967,関西ビジネスインフォメーション株式会社,1985年, - ,100-499人,大阪府大阪市北区中之島3-2-18 住友中之島ビル7F,https://www.kbinfo.co.jp/
968,有限会社イマージュ, - , - , - ,福岡県福岡市中央区大名2-9-35 トウセン天神ビル9F,http://www.image-ltd.jp/index.html
969,株式会社SSKエンタープライズ, - , - , - ,大阪府大阪市中央区上本町西1丁目2-19,https://www.ssksports.com/event/
970,株式会社 ベン, - , - , - ,東京都千代田区岩本町2-13-8,http://www.k-ben.com/
971,株式会社東京ステップ,1994年, - ,5-9人,東京都港区新橋2-9-16 萬楽庵ビル6階（旧愛媛新聞ビル）,http://www.tokyo-step.com/
972,株式会社ニックス, - , - , - ,埼玉県狭山市鵜の木１０－４２,https://www.nicks-net.co.jp/
973,株式会社アクセスメイク,1983年, - , - ,永森町297番地,http://www.accessmake.co.jp/
974,株式会社ラプレ,2002年, - , - ,大阪府大阪市中央区平野町3-3-10 浅野ビル4F,http://www.raple.co.jp/
975,株式会社テイクオフ, - , - , - ,千葉県柏市若柴1番地411,http://www.take-off.co.jp/index.html
976,株式会社サマンサハート, - , - , - ,新潟県燕市吉田下中野703-4,http://www.samanthaheart.com/
977,東京広告工業株式会社,1950年, - , - ,東京都文京区 春日1-6-6,http://bigpop.jp/
978,株式会社ソーゴー,1967年, - ,100-499人,愛知県稲沢市北麻績町沼23番地,http://www.sogo-aichi.co.jp/
979,株式会社クリエイティヴ・ヴィジョン,2013年, - , - ,大阪府大阪市西区江の子島1-7-3 奥内阿波座駅前ビル1103,https://www.creativevisionworld.com/
980,"株式会社サイコー舎（saiko-sha co,.ltd)", - , - , - ,福岡県糟屋郡粕屋町仲原2625-3,http://saiko-sha.com/
981,レプラスデザイン株式会社, - , - , - ,東京都中央区銀座8-10-7 東成ビル6階A室,http://replus-d.co.jp/
982,株式会社 ワークス･クリエイティブ, - , - , - ,東京都新宿区西新宿7-19-11 小玉ビル302号,http://wks.co.jp/
983,アソック株式会社, - , - , - ,東京都練馬区南大泉 5-31-27,http://www.assoc.co.jp/
984,株式会社大和工芸,1965年, - ,30-99人,押元町1-87,https://www.daiwa-web.co.jp/
985,株式会社 東名装飾, - , - ,10-29人,愛知県名古屋市天白区焼山1丁目504,http://www.tomeisoshoku.co.jp/
986,株式会社中京アドサイン, - , - , - ,愛知県名古屋市熱田区桜田町17-10,http://www.chukyo-ad.co.jp/index.html
987,有限会社 ケイ・デザイン, - , - , - ,福岡県北九州市小倉北区中井5-14-11,http://www.keidesign.jp/
988,株式会社コンベンションリンケージ,1996年, - ,1000人以上,東京都千代田区三番町2 大阪府大阪市北区豊崎3-19-3 PIAS TOWER 11F,http://www.c-linkage.co.jp/ja/index.html
989,株式会社ジオブレイン, - , - , - ,東京都品川区東五反田5-25-19 東京デザインセンター３F,http://www.geo-brain.com/index.html
990,有限会社デジログ工房, - , - , - ,京都府京都市北区上賀茂御薗口町57-21,https://www.tenjikai.net/
991,株式会社アイ・フロント,2001年, - , - ,東京都千代田区神田猿楽町2-4-11 犬塚ﾋﾞﾙ2F,https://www.eye-front.com/
992,株式会社オフィスNOEL, - , - , - ,東京都中野区本町4-47-3-305,https://www.noel-e.jp
993,株式会社廣済堂,1954年,根岸 千尋,1000人以上,東京都港区芝浦1-2-3　シーバンスS館13F,https://www.kosaido.co.jp/
994,株式会社アイビーインターナショナル,1984年, - , - ,京都府京都市中京区六角通烏丸東入堂ノ前町245番地,http://ivyintl.com/
995,有限会社神祭サービス, - , - , - ,岐阜県岐阜市西荘４丁目１８番２号,http://shinsai-s.net/
996,株式会社インフィールド,1995年, - ,10-29人,東京都千代田区神田駿河台4-2-5 御茶ノ水NKビル（トライエッジ御茶ノ水）11階,https://infield95.com/
997,株式会社エイチ,2013年, - , - ,東京都品川区東五反田１丁目１０−４　エムアイビル１階,https://eichiii.com/
998,株式会社アドトップ, - , - , - ,東京都武蔵野市吉祥寺本町２丁目４－１４ メディ・コープビル8 602号,http://adtop1.jp
999,株式会社イベント・レンジャーズ, - , - , - ,東京都港区芝2-29-10 ユニゾ芝二丁目ビル7F,http://www.craft-one.co.jp
1000,株式会社コスモスエンタープライズ, - , - , - ,大阪府東大阪市新家中町１－２０,http://cosmosenterprise.com/
1001,ヒビノメディアテクニカル株式会社,1984年, - , - ,東京都江東区東雲2-9-23 6階,https://www.media-t.co.jp/
1002,協愛株式会社,1966年, - , - ,大阪府大阪市北区西天満3丁目8番20号　協愛ビル,https://www.kyoai-web.com/index.php
1003,株式会社ティアスエンド, - , - , - ,東京都新宿区若葉1-8-4 ウィントンベリーハウス四谷22,https://www.tyath.com/
1004,株式会社ワンスイン, - , - , - ,東京都千代田区九段北1丁目11番4号 新光ビル6F,https://once-in.com/
1005,ホテルクエスト清水, - , - , - ,静岡県静岡市清水区真砂町3-27,http://hotelquest.co.jp/
1006,株式会社プロジェクトデザイン,2010年, - , - ,富山県滑川市田中新町25番地東京都千代田区西神田2-5-9HIビル4階京都府京都市下京区柿本町669-607福岡県春日市若葉台西1-12,https://www.projectdesign.co.jp/
1007,株式会社IKUSA,2012年, - , - ,東京都豊島区東池袋2-39-2 大住ビル1001大阪府大阪市淀川区十三東1-20-3 ザ・グランドビューオオサカ804,https://ikusa.co.jp/
1008,株式会社ザムザ,1986年, - , - ,東京都中野区新井2-1-16,http://www.zamza.jp/
1009,株式会社きっちんカンパニー, - , - , - ,京都府京都市上京区河原町丸太町上る桝屋町369,http://catering-kyoto.com/
1010,株式会社ダイナックホールディングス,1958年, - , - ,東京都港区台場2-3-3 サントリーワールドヘッドクォーターズ内,https://www.dynac.co.jp/
1011,FUORICLASSE,2012年, - ,30-99人,東京都足立区千住1-4-1 東京芸術センター1801,http://fuoriclasse.pointworld.net/
1012,株式会社 プラチナスタイル, - , - , - ,東京都港区北青山2-7-26 Landwork青山ビル B1F,https://www.platinumstyle.co.jp/
1013,株式会社あひる工芸,2011年, - , - ,福岡県糟屋郡宇美町宇美３丁目18-7,http://www.ahiru-k.sakura.ne.jp/
1014,株式会社フジテックス,1986年, - ,100-499人,東京都新宿区大久保 3-8-2 住友不動産新宿 ガーデンタワー 13F,https://www.fjtex.co.jp/
1015,ハウスグランプ広島, - , - , - ,広島県広島市西区横川町3-1-29,https://hghiroshima.jp/
1016,ひろしま国際ホテル, - , - , - ,広島県広島市中区立町3-13,http://www.kokusai.gr.jp/
1017,株式会社中央工芸, - , - , - ,愛知県名古屋市北区西味鋺1丁目847番地,http://www.chuo-kogei.co.jp/
1018,株式会社アイビーネット,2001年,伊藤公一,5-9人,愛知県名古屋市北区東水切町3-40,http://www.ibnet.ne.jp/
1019,株式会社キヌガワ,1971年, - ,100-499人,大阪府大阪市住之江区西加賀屋2丁目4-9,http://www.kinugawa.com/
1020,株式会社ウエムラ, - , - , - ,大阪府大阪市此花区島屋3-1-10,http://uemuradsp.com/
1021,株式会社OMOIDE FACTORY, - , - , - ,兵庫県神戸市東灘区向洋町中6-9 神戸ファッションマート8F,https://www.omoidefactory.co.jp/
1022,C’Sケータリングサービス株式会社, - , - , - ,大阪府大阪市中央区南船場4-10-5 南船場SOHOビル702​,https://www.kinari-catering.com/
1023,株式会社イオンイーハート,1964年, - , - ,千葉県千葉市美浜区中瀬1-3幕張テクノガーデン(MTG)B棟10階,https://www.aeoneaheart.co.jp/
1024,株式会社アポルテフードファクトリー, - , - , - ,神奈川県川崎市高津区北見方1-21-10,https://www.aporte.net/
1025,オーカフェ, - , - , - ,神奈川県横浜市中区吉田町6-1 第三共同ビル1F,https://www.o-cafe.jp/
1026,株式会社オーキッドテーブル, - , - , - ,神奈川県川崎市川崎区川中島1-5-4 ノブハラビル1F,http://www.orchidtable.com/
1027,株式会社ホーラク,2002年, - ,100-499人,京都府京都市右京区西京極町ノ坪町2番地,http://gohanbiyori.com/
1028,株式会社BCG.Deli,2015年, - , - ,東京都港区芝大門2丁目1-6BCGビル3階,http://www.bcg.jp/deli/
1029,ジェイ・シー・コンサルティング有限会社, - , - , - ,愛知県尾張旭市桜ヶ丘町1-124,http://urchin.moon.bindcloud.jp/
1030,エスティーシー株式会社,1999年, - ,100-499人,愛知県名古屋市中村区名駅南2-11-44　GS名駅南ビル6階,http://stc-jp.net/
1031,一般社団法人　日本イベント＆コンベンション・ケータリング協会, - , - , - ,愛知県名古屋市千種区覚王山通9-18,https://party-grandchef.jp/
1032,株式会社 総合企画 新和,1971年, - , - ,岩手県盛岡市志家町5-33,http://www.shinwakikaku.com/
1033,有限会社 サウンドプロモーション, - , - , - ,愛媛県今治市東門町１−１−３,http://www.sound-pro.jp/
1034,山口待機株式会社, - , - , - ,山口県防府市天神１丁目６－２７ １F,http://www.gunroom.jp/
1035,株式会社トゥー・ワンプロモーション, - , - , - ,静岡県静岡市駿河区稲川3-1-24 内山ビル4F,https://www.21pro.co.jp/
1036,株式会社ソーレ,2003年, - , - ,東京都港区西新橋1-18-14　第2須賀ビル4F,http://www.sole.co.jp/
1037,株式会社サークランド,1984年, - , - ,東京都港区東麻布2-32-10東麻布SSビル2F,https://www.sarkland.co.jp/
1038,山王スペース＆レンタル株式会社,1996年, - ,30-99人,東京都中央区銀座3-10-6  マルイト銀座第3ビル,http://www.sanno-sr.co.jp/
1039,エイトレント株式会社,1971年, - ,100-499人,東京都品川区北品川5丁目1-18 大崎ツインビル東館 8F,https://eightrent.co.jp/
1040,株式会社カントール シガ,1991年, - , - ,東京都世田谷区若林4-30-5,http://www.kantor-shiga.co.jp/
1041,株式会社P-POP, - , - , - ,大阪府大阪市西成区太子 1-1-20 南霞町ビル2F,https://booth.p-pop.com/
1042,株式会社イタミアート,1999年, - ,100-499人,岡山県岡山市南区新保660-15,https://www.itamiarts.co.jp
1043,エンドライン株式会社, - , - ,30-99人,福岡県福岡市中央区天神2-3-36 ibb fukuokaビル4F,http://www.endline.co.jp/
1044,株式会社ホーコーズ,1973年, - ,30-99人,福井県福井市光陽2丁目11-4,http://www.good-hoko.com/
1045,株式会社ジャストコーポレーション,1988年, - ,100-499人,福井県福井市殿下町46-3,http://just-j.com/
1046,株式会社ラブ・ラボ,1994年, - ,30-99人,香川県高松市亀田町90-1,https://www.rub-entertainment.com/
1047,株式会社Decorations,2005年, - , - ,東京都目黒区緑が丘2-25-7 スイーツフォレスト2F・3F,https://www.decorations.co.jp/
1048,株式会社ポイントラグ, - , - , - ,東京都渋谷区渋谷2-10-9　野村ビルB1,http://www.pointrag.co.jp/
1049,株式会社パートナースケッチ, - , - , - ,愛知県知多市新知字樋之口5-1  イベントパートナービル2F,https://www.event-partners.net/
1050,株式会社ウィット,2007年, - ,10-29人,北海道札幌市北区屯田9条1丁目,http://w-i-t.jp/
1051,株式会社プロネクサス,1930年, - ,10-29人,東京都港区海岸一丁目2番20号 汐留ビルディング5階,https://www.pronexus.co.jp/
1052,株式会社スーパービュー・コム, - , - , - ,東京都文京区白山1-30-10　赤池ビル3階,http://svc.tokyo/event/
1053,株式会社GOLD CAST,2006年, - , - ,東京都港区南青山4-17-11　青山アンドービル2F,https://goldcast.jp/
1054,ユー・アンド・アース株式会社,2006年, - , - ,東京都江東区青海2-4-32  TIME24ビル10F東1,https://hotmobily.jp
1055,チャンスメーカー株式会社,1910年, - ,100-499人,福井県坂井市坂井町福島8,https://www.ch-mk.jp/
1056,株式会社トランス,1987年, - ,100-499人,東京都渋谷区渋谷3-28-13 渋谷新南口ビル9階,https://www.trans.co.jp
1057,株式会社エヌエイチケイプロモーション, - , - , - ,東京都渋谷区神山町5-5,https://www.nhk-p.co.jp/
1058,株式会社ユーリンク, - , - , - ,東京都江東区新砂一丁目１番１９号,http://www.u-link.co.jp/index.html
1059,アイソトープス株式会社,2006年, - , - ,沖縄県国頭郡金武町金武635番地,https://www.isotopes.jp/
1060,リサーラ東京有限会社, - , - , - ,東京都文京区弥生2-4-22,http://www.risaalah-tokyo.com/
1061,有限会社インプレスト, - , - , - ,沖縄県那覇市港町2丁目8番地1号 2階,http://www.impressed.co.jp/
1062,株式会社スリー企画, - , - , - ,東京都中央区銀座1-19-14　ホーメスト木箱銀座ビル6F,http://www.threek.co.jp/
1063,株式会社シーピーファイン, - , - , - ,東京都千代田区神田錦町１丁目８番地１１錦町ビルディング,http://www.cpfine.com/
1064,有限会社ハートフルクリエーション, - , - , - ,東京都中央区日本橋小伝馬町20-3 W2 KODENMACHO 2F,http://heartfulcreation.jp/
1065,有限会社アディットプラス,2004年, - , - ,静岡県静岡市駿河区東新田4-4-16,http://www.added-plus.com/
1066,株式会社CRAZY KITCHEN, - , - , - ,東京都品川区中延6-3-17,https://crazykitchen.jp/
1067,STACK株式会社, - , - , - ,埼玉県春日部市大場1158,https://www.stack-grp.com/
1068,株式会社ニューフジフーズサービス, - , - , - ,埼玉県川越市砂新田129,http://www.ext-fed.com/newfujifoodsservice/
1069,有限会社味衛門, - , - , - ,埼玉県上尾市原市3206-3,http://www.ajiemon.com/
1070,株式会社 E-st, - , - , - ,神奈川県横浜市中区石川町1-15-6　東源元町ビル6F,http://www.e-st-group.co.jp/
1071,有限会社エスピーボックス, - , - , - ,北海道札幌市東区栄町913-1,http://sp-box.co.jp/
1072,株式会社東海トラベル, - , - , - ,静岡県浜松市中区東伊場2-9-16,https://www.tokaitravel.co.jp/
1073,株式会社 イベント企画・装飾, - , - , - ,千葉県千葉市稲毛区長沼原町81-1,https://www.eventkikaku-sousyoku.co.jp/
1074,株式会社グレス, - , - , - ,東京都港区芝大門１丁目１６番４号 第二高山ビル６階,http://gressco.jp/index.html
1075,株式会社　フロンティア・エンタープライズ,2002年, - , - ,東京都港区三田3-4-3　RIPL9　605,http://www.frontier-e.co.jp/
1076,株式会社コミュニケーションデザイン,2003年, - , - ,東京都港区六本木3-5-27六本木山田ビル1F,https://www.cd-j.net/
1077,プレンティグローバルリンクス株式会社,1996年, - ,30-99人,上植野町伴田10,http://global-linx.jp/index.html
1078,株式会社リグリード, - , - , - ,京都府京都市中京区錦堀川町659 京都松田ビル7F,https://liglead.co.jp/
1079,ルーデンス株式会社, - , - , - ,神奈川県横浜市西区みなとみらい2-3-1 クイーンズタワーA403B,http://www.ludens.be/
1080,株式会社アルティメイトケータリング, - , - , - ,神奈川県横浜市中区山下町50-1,https://www.ultimatecatering.jp/
1081,株式会社ラピコーポレーション,2018年, - , - ,東京都渋谷区本町3-38-9 小沼ビル1階,https://lapi.co.jp/
1082,パーク ハイアット 東京, - , - , - ,東京都新宿区西新宿3-7-1-2,http://tokyo.park.hyatt.jp/
1083,ユザワヤ商事株式会社,1955年, - , - ,東京都大田区西蒲田8-23-5,https://www.yuzawaya.co.jp/
1084,株式会社アクセルテック, - , - , - ,東京都港区北青山一丁目2番3号 青山ビル12階,https://acceltech.co.jp/
1085,株式会社GaGa, - , - , - ,東京都墨田区石原4-13-7 1階,https://www.g-gaga.co.jp/
1086,株式会社トラストリンクコーポレーション,2017年, - , - ,岡山県岡山市北区幸町 8-13 ONISHIビル3F,https://e-trustlink.com/
1087,有限会社ライフクリエーション,1996年, - , - ,大阪府大阪市平野区西脇1-1-2ミヤコ三愛ビル3階,http://www.led-art.jp/
1088,株式会社タットム, - , - , - ,東京都荒川区西日暮里2-31-5 根木ビル3F,https://www.tattomu.com/
1089,株式会社コックス,1951年, - ,10-29人,長野県佐久市根岸4051-11,http://www.coxltd.co.jp/
1090,株式会社ジョイプランニング, - , - , - ,東京都千代田区二番町9-3 The BASE麹町 W-221,https://2jikai-p.net/
1091,株式会社ティースケール, - , - , - ,埼玉県草加市栄町２－８－２７　松波ビル４Ｆ,http://www.t-scale.co.jp/
1092,トライト株式会社, - , - , - ,大阪府守口市梅園町８－１,https://tlight.jp/
1093,株式会社サンコー造型,1976年, - , - ,宮城県仙台市若林区蒲町東10-15,http://sanko-zoukei.com/
1094,株式会社プライムインターナショナル, - , - , - ,東京都品川区東五反田4-7-27 フィンチビル2F,http://www.prime-intl.co.jp/
1095,株式会社きびだんご,2013年, - , - ,岡山県岡山市北区吉備津1474番地,https://kibidan-go.co.jp/
1096,太陽工業株式会社,1947年, - , - ,広島県広島市中区江波南2丁目15番17号,http://www.the-taiyo.com/information/outline.html
1097,株式会社J・Gripマーケティング,2020年,奥窪　二郎,30-99人,東京都世田谷区松原1丁目36番9号 白川ビル4階,https://www.jgrip-marketing.co.jp/
1098,ジャンプ株式会社,2008年, - ,1-4人,東京都新宿区市谷本村町3-19 千代田ビル4階,https://jumpers.jp/
1099,ゲットユニバーサル株式会社, - , - , - ,東京都新宿区高田馬場1-32-13,https://getuniversal.co.jp/
1100,アーガイル株式会社,2009年, - ,10-29人,東京都新宿区新小川町9-7 第三服部ビル3F,http://argyle.jp/
1101,株式会社ガイアックス,1999年,上田　祐司,100-499人,東京都千代田区平河町2-5-3  Nagatacho GRiD,https://www.gaiax.co.jp/
1102,株式会社ジーズコンサルティング,2008年, - , - ,東京都渋谷区神宮前6-19-13　J-6ビル7階,https://www.gsc-japan.com/
1103,株式会社JBE, - , - , - ,東京都品川区南品川3丁目6-51 NK南品川301,https://www.jbe.co.jp/
1104,株式会社サンプラネット, - , - , - ,東京都文京区大塚3-5-10 住友成泉小石川ビル8階,https://www.sunplanet.co.jp/
1105,株式会社スコープ,1989年, - ,100-499人,東京都千代田区富士見2丁目10番2号 飯田橋グラン・ブルーム 28階,https://www.scope-inc.co.jp/
1106,アイティメディア株式会社, - , - , - ,東京都千代田区紀尾井町3-12,https://corp.itmedia.co.jp/
1107,株式会社ファンファ, - , - , - ,愛知県名古屋市東区泉1-7-7メゾンパール泉1F,https://undoukai-style-nagoya.fanfa.co.jp/
1108,株式会社ベスメモ, - , - , - ,大阪府大阪市北区梅田1-1-3-500 大阪駅前第3ビル5F10号,http://yoriai-undokai.com/
1109,高木塩化株式会社,1921年, - , - ,岐阜県大垣市長松町７０４番地,http://www.enka.co.jp/
1110,株式会社イケブン,1904年, - , - ,静岡県藤枝市寺島46,https://www.ikebun.com/
1111,株式会社FIVESTARFOODS, - , - , - ,大阪府柏原市清州1-1-24,https://www.5-star.jp/
1112,株式会社カムロワークス, - , - , - ,大阪府大阪市中央区大手前１丁目４番２号,http://www.kamuroworks.co.jp/
1113,共同ピーアール株式会社,1964年, - ,100-499人,東京都中央区築地1-13-1銀座松竹スクエア10F,https://www.kyodo-pr.co.jp/
1114,株式会社カーツメディアワークス, - , - , - ,東京都渋谷区千駄ヶ谷5丁目27-5 リンクスクエア新宿 16階,http://www.kartz.co.jp/
1115,株式会社YRK and,1896年, - , - ,大阪府大阪市中央区瓦町2丁目6番6号,https://www.yrk.co.jp/
1116,青森花火株式会社, - , - , - ,青森県十和田市稲生町11-3,https://www.aomori-fireworks.com/
1117,有限会社糸井火工, - , - , - ,福島県須賀川市矢沢字和久 21,https://www.itoikako.com/
1118,株式会社小山煙火製作所, - , - , - ,奈良県葛城市辨之庄２４６−３,https://www.koyamahanabi.com/
1119,株式会社丸富, - , - , - ,山梨県西八代郡市川三郷町市川大門191-1,https://www.marutomi-y.co.jp/maruya/
1120,株式会社シプード,2011年, - , - ,東京都港区高輪3-25-29 THE SITE ROOM3,https://shipood.com/
1121,西日本花火有限会社, - , - , - ,福岡県糟屋郡篠栗町乙犬694-19,https://nishinihon-hanabi.jp/
1122,park & port株式会社, - , - , - ,東京都渋谷区渋谷3丁目13-7 五常ビル 4F,https://parknport.com/
1123,アウル株式会社, - , - , - ,石川県金沢市西念3丁目32-28,http://anowl.co.jp/
1124,株式会社オマツリジャパン, - , - , - ,東京都千代田区九段南1-6-5 九段会館テラス 1階,https://company.omatsurijapan.com/
1125,株式会社グラムリンク, - , - , - ,東京都千代田区平河町2-2-1 平河町共和ビル5F,https://www.glamlink.co.jp/index.html
1126,株式会社大伸社, - , - ,100-499人,大阪府大阪市中央区難波五丁目1番60号　なんばスカイオ17階,https://www.daishinsha.co.jp/
1127,株式会社 JTB,1963年, - , - ,東京都品川区東品川二丁目3番11号,http://jtb.com
1128,bravesoft株式会社,2005年, - ,30-99人,東京都港区芝4-13-2 田町フロントビル6F,https://www.bravesoft.co.jp/
1129,株式会社エムエム総研,1989年, - ,100-499人,東京都新宿区新宿6-27-56　新宿スクエア5F,https://www.mmsouken.co.jp/
1130,株式会社PLUS,2008年, - ,10-29人,東京都世田谷区三軒茶屋2-9-20,https://plusweb.jp/
1131,株式会社 東真,1967年, - , - ,東京都新宿区四谷4-14,http://toshin-event.com/
1132,有限会社ゼン・コミュニケーションズ, - , - , - ,東京都中央区月島3-1-1-303,https://www.zencom-inc.co.jp/
1133,株式会社herstyle （ハースタイル）,2013年, - , - ,愛知県名古屋市緑区鳴海町上汐田172-1,https://herstyle.co.jp/
1134,株式会社プロセスユニーク,1972年, - , - ,愛知県名古屋市北区志賀町一丁目29番地,https://www.p-unique.co.jp/hp/index.html
1135,株式会社店研創意,1900年, - ,100-499人,大阪府大阪市中央区久太郎町3-4-20,http://www.tenken.co.jp/
