No.,会社名,設立年,代表者名,従業員数,住所,会社URL
1,株式会社Rit（リット）,2013年,高橋 朋也,5-9人,埼玉県さいたま市北区本郷町305　R-Space,https://rit.jp/
2,株式会社エスグロー,2002年,瀬川　雅矢,30-99人,琴ノ緒町２丁目２番１号 三経イーストビル ３階,http://www.s-grow.co.jp/
3,株式会社Manent,2022年,久世大貴,100-499人,七条通油小路東入大黒町227番地 第2キョートビル402,https://manent.net/
4,株式会社リブクリエイション,2007年, - ,30-99人,千葉県柏市箕輪758-3,https://www.livcreation.jp
5,株式会社ロジ・クム,2024年,阿部直仁,10-29人,築港八幡町1-171 MFLP堺 401,https://logi-kumu.co.jp/
6,アシストライン株式会社,2014年, - ,10-29人,大阪府東大阪市吉原２丁目６番１１号,https://www.osaka-line.com/
7,株式会社富士ロジテックホールディングス　浜松事業部,1918年,鈴木　庸介,500-999人,静岡県浜松市東区上石田町956-1,http://www.fujilogi.co.jp
8,株式会社LOGI・フロー,2016年, - ,30-99人,福岡県糟屋郡篠栗町和田東浦550-1,https://logi-flow.co.jp/
9,公徳運輸株式会社, - , - ,30-99人,東京都練馬区谷原4-7-20,https://www.koutoku-tr.co.jp
10,株式会社ＡＺプランニング,2010年, - ,1-4人,東京都江戸川区臨海町4-3-1　葛西トラックターミナル11号棟,http://www.azplanning.jp/
11,株式会社ウィズリンクス,2015年, - ,30-99人,大阪府大阪市中央区西心斎橋1丁目13-18 6F,https://hanro-plus.jp/
12,SBSロジコム株式会社,1940年,鎌田 正彦,1000人以上,東京都新宿区西新宿8-17-1 住友不動産新宿グランドタワー25階,https://www.sbs-logicom.co.jp/
13,株式会社 三鷹倉庫,1964年, - ,100-499人,大阪市生野区巽西1丁目9番26号,http://www.mitaka-soko.co.jp/
14,株式会社 シンワ・アクティブ,1972年,澤田　一,30-99人,大阪府茨木市松ヶ本町2-30,https://www.shinwa-active.co.jp/
15,TOPPANロジスティクス株式会社,1988年,山野 泰彦,500-999人,東京都板橋区小豆沢1丁目16番5号,https://www.logi.toppan.com/
16,株式会社ムービングサポート,2006年, - ,30-99人,福岡県糟屋郡新宮町立花口405-1,http://www.moving-support.co.jp/
17,VALT JAPAN株式会社,2014年,小野 貴也,30-99人,東京都千代田区丸の内2-2-1 岸本ビル7F xLINKパレスフロント丸の内,https://www.valt-japan.com/
18,株式会社サーガ,1984年,深澤　一紀,100-499人,大阪府大阪市中央区南本町1-2-7,http://www.rg-saga.co.jp/company/outline/
19,ナガセテクノサービス株式会社,1991年, - ,100-499人,千葉県流山市駒木529,https://group.nagase.com/nagase-techno-service/
20,鈴与株式会社,1936年, - ,1000人以上,静岡県静岡市清水区入船町11-1,https://www.suzuyo.co.jp/
21,アイシーエクスプレス株式会社,1960年,谷口　亮,100-499人,東京都大田区昭和島2丁目4番1号,https://www.iec-exp.co.jp
22,株式会社タスコ,2009年,恒川敦郎,30-99人,愛知県名古屋市港区３－１－１,http://www.tasjp.net/
23,株式会社後藤回漕店,1921年,後藤　平八郎,100-499人,兵庫県神戸市海岸通3丁目2番1号,https://www.kaisoten.co.jp/
24,株式会社エーケーカンパニー,2013年,椿　淳,10-29人,福岡県古賀市⽞望園14-1 ロジフラッグ古賀,https://akcompany.info/
25,株式会社イー・ロジット,2000年, - ,1000人以上,東京都千代田区神田練塀町68番地ムラタヤビル5階,https://ec-bpo.e-logit.com
26,株式会社クボモト,1971年,久保本 篤,30-99人,神奈川県横浜市中区太田町6-86　オーパリヴァージュ701,https://www.kubomoto.co.jp/
27,大阪デリバリー株式会社,1978年, - ,100-499人,大阪府箕面市船場東2丁目1番20号　ABCビル7階,https://shop-logi.com/
28,株式会社3Qパック＆ヒューマン,2007年,江里口利博,30-99人,群馬県太田市新田下江田町355-1,https://www.3qpack.com/
29,株式会社タナカ流通企画,1996年,田中　繁,10-29人,神奈川県厚木市戸室1-33-7,https://www.tanakaryuutsuu.co.jp/
30,株式会社地区宅便,1980年,鎌田　光男,500-999人,千葉県千葉市大野台2-6-15,https://www.tikutakubin.co.jp/
31,株式会社清長, - , - , - ,東京都千代田区神田駿河台2-1-20お茶の水ユニオンビル3F,https://www.seicho-inc.jp/
32,株式会社グロップ,1975年, - ,500-999人,岡山県岡山市中区さい東町2-2-5,https://www.grop.co.jp/
33,ＪＢサービス株式会社,2007年, - ,100-499人,東京都中央区八重洲二丁目２番１号　東京ミッドタウン八重洲　八重洲セントラルタワー13階,https://www.jbsvc.co.jp/
34,株式会社関根エンタープライズEXT,2011年, - ,10-29人,神奈川県綾瀬市深谷中８－９－３,https://www.sep1996.co.jp/company/ext/
35,興菱梱包運輸株式会社,1949年,小髙　正樹,100-499人,神奈川県川崎市幸区北加瀬1-15-5,http://www.koryo-ds.co.jp/
36,株式会社メガ・ワールド,2000年, - ,30-99人,篠崎町1-14-5,https://www.megalo.co.jp/about/
37,ディーエムソリューションズ株式会社,2004年,花矢卓司,100-499人,東京都武蔵野市御殿山1-1-3 クリスタルパークビル2F,https://ul-logi.jp/service/ec-logistics/
38,日本自動車ターミナル株式会社,1965年,藤田　裕司,30-99人,東京都千代田区平河町二丁目7番9号JA共済ビル11階,https://www.j-m-t.co.jp/
39,メールセンター株式会社,2011年, - ,30-99人,千葉県流山市駒木569-1,http://mailcenter.co.jp
40,株式会社STOCKCREW,2018年, - ,30-99人,神田小川町3-7-15ボナ神田小川町ビル７階,https://stockcrew.co.jp/
41,株式会社ミドルエイト,2022年, - ,1-4人,埼玉県狭山市水野392-1,http://www.middle-eight.jp/
42,船井総研ロジ株式会社,2000年, - ,100-499人,東京都千代田区丸の内1-6-6　日本生命丸の内ビル22階,https://www.f-logi.com/
43,MDL株式会社, - , - ,30-99人,茨城県石岡市府中1丁目5-12 カーニープレイス石岡5階,https://mdlogi.co.jp/
44,株式会社redect,2006年, - ,30-99人,東京都羽村市神明台３丁目１番地８,http://www.redect.jp/
45,株式会社大森廻漕店,1921年,須藤　明彦,100-499人,兵庫県神戸市中央区東町123番地の1,http://www.omori-kaisoten.jp/
46,株式会社フレイトリンクスジャパン,2011年, - ,30-99人,大阪府大阪市中央区南船場4-7-21-303,http://www.freightlinks.jp/index.html
47,ノース・モール株式会社,1986年, - , - ,東京都中央区東日本橋3-4-18　東日本橋EXビル 8F,https://www.northmall.com/
48,株式会社ゲートオンロジスティクス,2006年,小笠原 伸恭,100-499人,埼玉県戸田市新曽1662,http://www.gate-on.co.jp
49,ディーエムソリューションズ株式会社,2004年,花矢　卓司,500-999人,本社 東京都武蔵野市御殿山1-1-3  クリスタルパークビル2F,http://www.dm-s.co.jp/
50,トーヨーエキスプレス株式会社,1953年,佐藤 雄平,100-499人,東京都大田区矢口3-7-13,http://www.toyo-express.jp/
51,VSM PARTNERS合同会社,2021年, - ,1-4人,神奈川県相模原市緑区上九沢350-8 上九沢ビル3階,https://www.vsmpartners.com/
52,株式会社オーティーエス,1986年, - ,500-999人,東京都江戸川区南葛西5丁目16番1号,http://www.e-ots.jp/
53,国立倉庫株式会社,1969年, - ,30-99人,東京都国立市谷保6丁目22番地の1,http://www.kunilogi.jp/
54,KTコントラクト株式会社,2000年, - ,30-99人,東京都江戸川区臨海町3-6-1,http://www.kt-logi.com/
55,中央株式会社,1948年, - ,100-499人,東京都墨田区東向島4-1-5,https://www.chuoh-logistics.com
56,株式会社バリュー・ロジスティクス,1996年, - ,30-99人,東京都江戸川区篠崎町5-14-23,https://www.value-logistics.jp/
57,株式会社アクセストレードセンター,2010年,古谷　彰則,30-99人,東京都練馬区高野台二丁目16番28号,https://a-tradecenter.co.jp/
58,ジェイカス株式会社,1992年, - ,30-99人,兵庫県西宮市戸田町5-16　西宮ビル5階,http://www.j-cas.co.jp
59,長島梱包株式会社,1926年, - ,100-499人,東京都渋谷区恵比寿1-22-21,http://nagashima.co.jp/
60,株式会社丸祐運送,1982年, - ,100-499人,青森県弘前市高田3-6-11,http://www.maruyu-un.jp
61,株式会社フリーセル,2009年, - ,30-99人,大阪府東大阪市加納5-15-21,http://www.freecell.co.jp/
62,コマースバリュー株式会社,2017年,金田 浩邦,10-29人,埼玉県八潮市大瀬5-6-1,https://www.cvalue.co.jp/
63,株式会社鶴見,1968年, - , - ,大分県別府市鶴見67番地の2,http://tsurumi-logi.com/
64,SBSフレイトサービス株式会社,1944年, - ,100-499人,神奈川県横浜市磯子区杉田5-32-50,https://www.sbs-freight.co.jp
65,有限会社山七商店,1952年, - ,1-4人,新潟県三条市島田３−１−１,http://ds-life.jp/
66,ワヨー株式会社,1982年, - ,100-499人,東京都台東区蔵前１丁目８－２,https://www.wayo.co.jp/
67,株式会社UNITY,2019年, - ,1-4人,大阪府堺市堺区北清水町1丁2番15号2F,http://www.e-ksfactory.jp/
68,SBSホールディングス株式会社,1987年,鎌田　正彦,100-499人,東京都新宿区西新宿8-17-1住友不動産新宿グランドタワー25階,https://www.sbs-group.co.jp/
69,株式会社ディーエムエス,1961年, - ,100-499人,東京都千代田区神田小川町1-11千代田小川町クロスタ10階,http://www.dmsjp.co.jp/
70,ALLX株式会社,2015年, - ,30-99人,兵庫県加西市鶉野町1074-8,http://www.allx.jp
71,株式会社スーパーレックス,1993年, - ,1000人以上,神奈川県相模原市中央区清新8-20-52,https://www.superex.co.jp/
72,東京メールサービス株式会社,1974年, - ,100-499人,埼玉県朝霞市膝折町4-22-60,http://www.tm-service.co.jp/
73,後藤運輸株式会社,1949年,牧正康,100-499人,長崎市出島町2-16,http://www.gotounyu.co.jp/index.html
74,株式会社学研ロジスティクス,1992年,山村優,30-99人,東京都品川区西五反田3-6-20,https://logi.gakken.jp/
75,株式会社ハセガワロジスティクス,2000年, - ,10-29人,東京都大田区東海4-2-10コクサイエアロマリン２Ｆ,https://freejob.work/FJAC33030002298/#LBLTOP
76,株式会社YAMATE,1957年, - ,100-499人,東京都板橋区志村3-30-4,https://www.yamate-unsou.com/
77,株式会社トワード,1951年, - ,500-999人,佐賀県神埼郡吉野ヶ里町三津166-13,http://www.towardls.co.jp/outline/index.html
78,株式会社天野回漕店,1923年, - , - ,静岡県静岡市清水区港町二丁目9番5号,http://www.amanok.co.jp/
79,株式会社MPS,1991年,石井 智幸,30-99人,千葉県千葉市美浜区浜田2-19,https://www.mpsco.jp/
80,ウレルロジスティクス株式会社,2006年, - ,5-9人,埼玉県三郷市泉2-14-3,http://www.urelogi.co.jp/
81,株式会社共栄物流サービス, - , - , - ,東京都大田区大森北1-32-1　ウェリスシティ大森タワー25F,http://www.kyoei-butsuryu.com/
82,株式会社ポスコム,1999年,山村　勝彦,5-9人,東京都中央区日本橋小伝馬町18-12 増田ビル3F,http://www.pos-com.co.jp/
83,株式会社ターボ商事,1987年, - ,30-99人,埼玉県越谷市流通団地3-3-6,http://turboshoji.co.jp/
84,トランスコスモス株式会社,1985年,奥田　耕己,1000人以上,東京都豊島区東池袋3-1-1 サンシャイン60,https://www.trans-cosmos.co.jp/
85,株式会社マキシマム＆アドバンテージ,2007年, - ,30-99人,神奈川県鎌倉市大船5-12-18　湘南流通センター,http://eco-taku.jp
86,株式会社MOTOMURA,1967年,本村　真作,100-499人,埼玉県朝霞市上内間木713-1,https://motomuralog.com/
87,株式会社O.D.A, - , - , - ,兵庫県姫路市南町76　姫路城陽ビル6F,https://ki-logi.com
88,株式会社コーリング,2000年, - ,30-99人,千葉県市川市塩浜2-30,https://calling.jp/
89,上昇運輸株式会社,1981年, - ,30-99人,東京都足立区南花畑4-3-22,http://www.josho-express.co.jp/
90,株式会社河村物流,2020年, - ,30-99人,大阪府大阪市住之江区御崎6-1-3 4F,https://kawamura-buturyu.jp/
91,株式会社オーバルネットワーク,2002年,河野　昇,30-99人,東京都品川区勝島1-2-1 SGH勝島A棟2階,http://www.ovalnetwork.co.jp/
92,株式会社結い人, - , - , - ,東京都中央区京橋1-1-5　セントラルビル２F,https://yuibito.gifts/
93,株式会社シンメイ,1989年, - ,100-499人,神奈川県鎌倉市常盤35-4　明治牛乳湘南宅配センター2F,http://www.shinmei-log.co.jp/
94,藤阪倉庫運送株式会社,1947年, - ,30-99人,大阪府高槻市三島江1-5-32,https://fujisaka-soko.com/
95,株式会社沖縄トータルロジスティクス,2011年, - ,10-29人,沖縄県うるま市勝連南風原5194番地68,https://www.okinawatl.com
96,株式会社souco,2016年, - , - ,東京都千代田区麹町 1-4-4 LIFULL HUB,https://www.souco.space/
97,ツカサ物流株式会社,2010年, - ,30-99人,埼玉県北葛飾郡松伏町田中3-25-28,http://www.tsukasa-logi.com
98,南和運送株式会社,1953年, - ,30-99人,奈良県五條市二見4-4-43,http://n-carry.co.jp/
99,日本トランスシティ株式会社,1942年,安藤 仁,1000人以上,三重県四日市市霞二丁目1番地の1,https://www.trancy.co.jp/
100,株式会社 東配,1964年,熊井 大遊,30-99人,埼玉県川口市峯1302,https://www.tohai.co.jp/
101,株式会社 ピーアンドディーヒロサワ,1965年, - ,100-499人,東京都北区浮間５丁目１５番１４号,http://www.panddhirosawa.co.jp/
102,有限会社大野運送,1989年, - ,10-29人,兵庫県神戸市中央区東川崎町7-12-8,http://www.oonounso.com/
103,株式会社エヌ・ティ・ティ・ロジスコ,1991年, - ,1000人以上,東京都大田区平和島一丁目1番2号　平和島物流センター７階,https://www.nttlogisco.com/
104,株式会社ニッセン,2007年,羽渕 淳,100-499人,京都府京都市南区西九条院町26番地,http://www.nissen.biz/
105,合同会社 黒船,2014年, - , - ,埼玉県草加市瀬崎5-5-22,https://xn--3d1aq99c.jp/
106,日立物流ファインネクスト株式会社,2011年, - ,500-999人,東京都中央区京橋2丁目9番2号 日立物流ビル3F,https://www.hitachi-transportsystem.com/jp/finenext/
107,株式会社明和サービス,2007年, - ,30-99人,埼玉県戸田市氷川町3-9-20,https://meiwa-s.com
108,株式会社山中運輸,1953年, - ,100-499人,大阪府大阪市城東区永田2-8-2,http://www.yamanaka-unyu.co.jp/
109,富士物流株式会社,1975年, - ,1000人以上,東京都港区三田三丁目10番1号,https://www.fujibuturyu.co.jp/
110,吉村運送株式会社, - , - , - ,大阪府東大阪市加納4丁目4番5号,http://www.cityliner.co.jp/yoshimura/
111,ミナモト倉庫株式会社,1970年,押田大介,30-99人,埼玉県川口市峯460番地,https://www.minamoto-logistics.co.jp/
112,株式会社ジャンボ,1988年, - ,30-99人,大阪府泉佐野市鶴原1406-1,http://j-mb.co.jp/
113,カトーレック株式会社,1967年, - ,1000人以上,東京都江東区枝川2-8-7,https://www.katolec.com/
114,株式会社カネコ,1977年, - , - ,埼玉県八潮市八潮4-1-1,https://www.kaneko.vc/
115,弘立倉庫株式会社,1967年, - ,100-499人,東京都葛飾区新宿２丁目８番２０号,http://www.kouritsu-gr.co.jp/
116,株式会社アルファ・クリエイト,2004年,山下　健治,100-499人,河内郡上三川町西汗1780,https://alpha-04.com/
117,マルソー株式会社,1913年, - ,100-499人,新潟県三条市月岡字綾ﾉ前2783-1,https://www.maruso.co.jp/
118,株式会社関通,1986年, - ,500-999人,兵庫県尼崎市西向島町111-4,https://www.kantsu.com/
119,株式会社フェイバリット,2007年, - ,1000人以上,東京都昭島市武蔵野２丁目２１－１,https://fv-tmlc.com/
120,メールカスタマーセンター株式会社,1999年, - ,10-29人,東京都港区海岸1丁目2番20号 汐留ビルディング21階,https://www.mail-cc.com/
121,株式会社 ロジ・ウエイズ,2007年, - ,100-499人,滋賀県大津市御殿浜19-10,https://www.omotenashi-logi.jp/
122,ロジストン株式会社,2018年, - ,10-29人,埼玉県川口市戸塚東3-33-1,https://logistone.jp/
123,ヤマトロジスティクス株式会社,1999年, - ,1000人以上,東京都中央区銀座2丁目12番18号　ヤマト銀座ビル5F,http://www.y-logi.com/
124,株式会社ソネッティーク,1997年, - , - ,栃木県河内郡上三川町西汗1662-1  不二ロジカーゴ3F,https://www.sonettique.com/
125,ヤマトパッキングサービス株式会社,1947年, - ,1000人以上,東京都江東区海辺8-4,https://www.y-logi.com/ypc/
126,株式会社関根エンタープライズ,1996年, - ,1000人以上,埼玉県越谷市増森207-12 関根ビル2F, - 
127,gf.K株式会社,1974年,長屋 聡,100-499人,東京都江戸川区臨海町3-6-4　ヒューリック葛西臨海ビル,https://www.gf-k.co.jp/
128,株式会社LinkStructure,2019年, - , - ,埼玉県川越市小堤６４７－３,https://linkstructure.biz/
129,アクロストランスポート株式会社,1972年, - ,1000人以上,東京都江東区新木場2-14-11,https://www.across-tr.co.jp/
130,八光社梱包運輸株式会社,1970年, - ,30-99人,東京都中央区日本橋茅場町2-8-1,https://www.hakkosha.co.jp/
131,株式会社テスココンポ,1965年, - ,1000人以上,埼玉県行田市持田2165,https://www.tescompo.co.jp/profile.html
132,株式会社Transport Wunder,2021年,佐々木桂一郎,10-29人,嘉穂郡桂川町吉隈430-42,https://transportwunder.com/
133,株式会社For needs,2006年,谷沢　潤一,100-499人,東京都江戸川区松江4-4-1,http://www.for-needs.co.jp/
134,株式会社 蓑島ロジスティックス,2009年,蓑島美家雄,30-99人,岐阜県瑞穂市野白新田320番地3,https://minoshima.jp/
135,沼尻産業株式会社,1964年, - ,100-499人,茨城県つくば市榎戸783-12,http://www.numajiri.co.jp/
136,株式会社エスライン,1947年, - , - ,岐阜県羽島郡岐南町平成4丁目68番地,http://sline.co.jp/
137,アドレス通商株式会社,1959年,竹尾　正,1000人以上,東京都江戸川区臨海町3-6-3,http://www.adotsu.co.jp/
138,株式会社エムワン,2002年, - ,100-499人,福岡県糟屋郡宇美町大字井野221番地1,http://www.m-one-0551.com/
139,株式会社物研,1983年, - , - ,大阪府堺市中区田園685-1,https://www.bukken-logi.co.jp/
140,名古屋貨物運輸倉庫株式会社,1964年, - ,100-499人,愛知県小牧市多気西町18番地,http://www.nagoyakamotsu.com/
141,株式会社岡商店,1964年,代表取締役　岡秀太郎,100-499人,熊本県合志市幾久富1909-1398,http://www.okashoten.co.jp/
142,株式会社アラウン,1953年, - ,100-499人,東京都港区西新橋２丁目３５−５ 荒川ビル,https://araun.co.jp/
143,東神倉庫株式会社,1953年, - ,100-499人,東京都品川区勝島1丁目5番21号,http://www.toshin-soko.co.jp/
144,ダイハート物流株式会社,2001年, - ,100-499人,大阪府大阪市都島区東野田町2丁目9番12号松和京橋第2ビル7階,http://www.daiheart.co.jp/
145,株式会社データセレクト,1992年, - ,10-29人,愛知県豊明市阿野町昭和5-1,https://www.d-select.co.jp/
146,株式会社ハマキョウレックス,1971年, - ,500-999人,静岡県浜松市南区寺脇町1701-1,http://www.hamakyorex.co.jp/
147,株式会社アスト中本,1968年, - ,100-499人,大阪府堺市中区小阪西町1番1号,https://www.asuto-iza.co.jp/
148,有限会社DCネットワークス,1997年, - , - ,静岡県三島市市山新田6-1,http://www.dcnetworks.co.jp/
149,共栄産業株式会社,1969年, - ,30-99人,東京都日野市東豊田4-21-2,http://www.kyoei-s.co.jp/
150,株式会社グローバル,1998年, - ,10-29人,神奈川県厚木市関口115-1 ダイアパレス本厚木413,http://www.global-117.co.jp/
151,株式会社ワタナベ流通,1978年, - ,100-499人,東京都新宿区西早稲田2-12-5　ワタナベビル,http://www.wataryu.co.jp/
152,株式会社若洲,1950年, - ,30-99人,東京都江東区若洲二丁目3番7号,https://www.wakasu.co.jp/
153,株式会社東京ロジマッチ,2000年, - ,1000人以上,東京都港区浜松町1-29-10 東京ラインビル9階,https://logimatch.co.jp/
154,株式会社 美空海, - , - , - ,福岡県福岡市中央区笹丘1-17-29 MJR5F-1,http://www.hassoudaiko.com/
155,株式会社ラシスコ,1994年, - ,100-499人,埼玉県朝霞市根岸台1-8-23,http://www.rasisco.co.jp/index.html
156,株式会社根本運送,1980年, - ,1000人以上,千葉県香取市本矢作1122-3,http://www.nemoto-trs.co.jp/
157,関空運輸株式会社,1991年, - ,100-499人,大阪府泉佐野市中庄102番地-1,https://www.kanku-unyu.com/
158,株式会社インターコード,2009年,広瀬　裕,30-99人,沖縄県那覇市辻1-16-9 サングリーンビル1階,https://www.i-chord.com/
159,有限会社三恵ピーアール,1967年,吉田 寛,10-29人,東京都世田谷区北烏山1-50-20,http://www.sankeipr.co.jp
160,奥田数株式会社,1948年, - ,30-99人,大阪府大阪市福島区福島3丁目1番53号,http://okudakazu.co.jp/
161,BOND’s株式会社,2015年,澁井拓也,30-99人,埼玉県さいたま市内谷2-7-17,http://bonds.jp.net/
162,株式会社エコ配,2007年, - ,100-499人,東京都港区西新橋2-8-12 第二土井ビル5F,http://www.ecohai.co.jp/
163,安田倉庫株式会社, - , - ,100-499人,東京都港区芝浦三丁目1番1号 msb Tamachi 田町ステーションタワーN 29階,http://www.yasuda-soko.co.jp/
164,ホンダロジコム株式会社,1963年, - ,1000人以上,愛知県春日井市八田町5丁目16番6,http://honda-logi.com/
165,株式会社S‐PAL,2003年, - ,30-99人,千葉県船橋市日の出2-20-2 SHOWAビル4F,https://www.s-pal.info/
166,鴻池運輸株式会社,1945年, - ,1000人以上,大阪府大阪市中央区伏見町4-3-9,https://www.konoike.net/
167,一宮運輸株式会社,1961年, - ,1000人以上,愛媛県新居浜市西原町2丁目4-36,http://www.ichimiya.co.jp/tran/
168,埼九運輸株式会社,1979年, - ,100-499人,埼玉県狭山市広瀬東一丁目10番2号,http://www.saikyu-trp.com/
169,京都通運　株式会社,1949年, - ,100-499人,京都府京都市下京区大宮通七条下る上之町438番地,http://www.kyoto-tsuun.com/
170,扇町運送株式会社,1953年, - ,100-499人,大阪府大阪市住之江区南港南4丁目1番7号,https://ogimachi.co.jp/
171,株式会社アドバンスサポート・ジャパン,2018年,島崎　範昭,10-29人,東京都文京区湯島3-13-8湯島不二ビル7F,https://a-s-j.jp/
172,山九株式会社, - , - ,1000人以上,東京都中央区勝どき6丁目5番23号,https://www.sankyu.co.jp/
173,株式会社イマージュソリューションズ,2007年, - ,10-29人,東京都港区芝大門1-10-11　芝大門センタービル10F,http://www.image-sol.com/
174,株式会社エスプールロジスティクス,2013年, - ,100-499人,東京都千代田区外神田1-18-13 秋葉原ダイビル6階,https://www.spool.co.jp/service/logi/
175,エス・アイ・ロジ株式会社,2007年, - , - ,宮城県仙台市泉区黒松1丁目1番27号,http://si-logi.com/
176,共通運送株式会社,1959年,永原 敏雅,500-999人,北海道札幌市白石区平和通11丁目北6番19号,http://www.kyotsu.co.jp/
177,茨城乳配株式会社,1965年, - ,100-499人,茨城県水戸市千波町1821番地の1,http://nyuhai.net/company/outline
178,グロリアス・ジャパン株式会社,1968年, - , - ,長野県安曇野市三郷温3868番地,https://www.glorious-japan.net/
179,遠州トラック株式会社,1965年, - ,1000人以上,静岡県袋井市木原627-3,https://www.enshu-truck.co.jp/
180,大塚倉庫株式会社,1961年, - , - ,大阪府大阪市港区石田1-3-16,http://www.otsukawh.co.jp/
181,株式会社データビジネスサプライ,1976年, - ,30-99人,東京都渋谷区代々木3-28-6いちご西参道ビル別館,https://www.dbs.jp/
182,株式会社アート･プラ,1988年, - , - ,東京都江戸川区南小岩5-18-13　Aozoraビル2F,https://www.art-pla.co.jp/
183,佐川急便株式会社,1965年, - ,1000人以上,京都府京都市南区上鳥羽角田町68番地,https://www.sagawa-exp.co.jp/
184,日本ロジテム株式会社,1944年, - ,1000人以上,東京都港区新橋5-11-3　新橋住友ビル,http://www.logitem.co.jp/
185,株式会社アイティエス,2000年, - , - ,東京都港区港南二丁目13番31号品川NSSビル8階,http://www.its-butsuryu.co.jp/
186,株式会社イワタ輸送センター,1971年, - ,10-29人,静岡県袋井市堀越 438-1,http://www.exp-iwata.jp/
187,株式会社ヒロジ,2005年, - ,30-99人,沖縄県糸満市字糸満2277番2,http://hilogi.com/company.html
188,丸全昭和運輸株式会社,1931年, - ,1000人以上,神奈川県横浜市中区南仲通　2-15,https://www.maruzenshowa.co.jp/
189,相良運輸株式会社,1988年, - ,30-99人,栃木県宇都宮市今宮4-5-36,http://www.j-sagara.com/
190,月島倉庫株式会社,1946年, - ,100-499人,東京都中央区勝どき4-6-2 パークタワー勝どきミッド6階,https://www.tsukiso.co.jp/
191,アサヒロジスティクス株式会社,1955年, - ,1000人以上,埼玉県さいたま市大宮区桜木町1丁目10-17シーノ大宮サウスウィング16階,http://www.asahilogistics.co.jp
192,信州名鉄運輸株式会社,1946年, - ,500-999人,長野県松本市和田4861,https://www.shinmei-net.co.jp/
