No.,会社名,設立年,代表者名,従業員数,住所,会社URL
1564,コフジ物流株式会社,1975年, - ,100-499人,大阪府枚方市春日西町3-45-1,https://www.kofuji.co.jp/
1565,渡部物産株式会社,1985年, - ,100-499人,愛媛県新居浜市黒島一丁目6番17号,https://www.wbcom.co.jp/
1566,株式会社エスシーエヌ, - , - , - ,神奈川県川崎市宮前区宮崎175－21,https://scn1001.co.jp/
1567,朝日海運株式会社,1956年, - ,30-99人,大阪府泉大津市新港町3番地,http://www.asahikaiun.com/
1568,ストレージプラス株式会社,2006年, - , - ,東京都千代田区九段南2丁目3-10 BCプラザ,https://www.storageplus.co.jp/
1569,有限会社アクセル,2004年, - , - ,山梨県甲府市下鍛冶屋町35-13,https://accelhb.com/so
1570,株式会社アルタ,1991年, - , - ,大阪府東大阪市楠根1丁目10-4,http://www.alta-net.jp/
1571,株式会社日立物流西日本,1955年, - ,1000人以上,大阪府大阪市此花区西九条一丁目28番13号,https://www.hitachi-transportsystem.com/jp/westjapan/
1572,ポーターズ株式会社,2007年, - ,30-99人,大阪府大阪市中央区島之内1-4-7,https://porters-corp.jp/
1573,米澤運送株式会社,1951年, - ,30-99人,大阪府大阪市東住吉区桑津1丁目6番3号,https://yonezawa-unsou.co.jp/
1574,株式会社北急物流サービス,1996年, - , - ,大阪府大阪市西淀川区大野1-7-22,http://kitakyu.co.jp/
1575,文正物流株式会社,2020年, - , - ,大阪府大阪市東成区大今里南1-22-14 今里ビル4F,https://www.fumimasa-int-trade.com/
1576,株式会社ハーリードットエル,1995年, - ,10-29人,大阪府大阪市生野区巽中1-19-27,https://www.hurry.co.jp/
1577,株式会社京豊運輸,1973年, - ,10-29人,大阪府大阪市東住吉区今林2-3-2,https://kyoho.co.jp/
1578,株式会社居内運送,1992年, - , - ,大阪府大阪市淀川区野中北2丁目9-22,https://www.iuchi-unsou.jp/
1579,トナミ近畿物流株式会社,1962年, - ,100-499人,大阪府松原市天美北4-1-8,http://www.tkb1073.co.jp/
1580,株式会社ジャスト,1999年, - , - ,大阪府東大阪市楠根2丁目6番30号,http://www.just-pro.com/
1581,アオキ物流株式会社,1992年, - ,30-99人,大阪府堺市堺区海山町5丁目197,http://aoki-abc.co.jp/
1582,オーティーティーロジスティクス株式会社,1989年, - ,500-999人,大阪府高槻市西冠3-34-3,https://www.ott.co.jp/
1583,株式会社スリーエス物流,1990年, - ,100-499人,愛知県一宮市丹陽町九日市場字中田63-1,http://sline.co.jp/three-s_butsuryu/index.html
1584,TBロジスティクス株式会社,1995年, - ,500-999人,愛知県豊田市生駒町切戸17-1,https://www.tb-logistics.co.jp/
1585,一関糧運株式会社,1973年, - ,30-99人,岩手県一関市萩荘字鍋倉19番地2,https://www.ginga.or.jp/ryoun/
1586,有限会社T-LINE,2003年, - ,10-29人,群馬県太田市大原町2423-1,http://www.tline.co.jp/
1587,山村ロジスティクス株式会社,2015年, - ,1000人以上,兵庫県尼崎市西向島町15番1,https://www.yamalogi.co.jp/
1588,江坂運輸株式会社,1976年, - ,100-499人,兵庫県西宮市鳴尾浜1丁目2-5,https://www.senko.co.jp/esaka/
1589,株式会社共進工業,1968年, - , - ,高知県南国市十市4465-1（高知みなみ流通団地）,https://kyoushin-kougyo.jp/
1590,株式会社九倉,1972年, - ,100-499人,福岡県北九州市門司区新門司1丁目7番14号,https://zero-kyuso.com/
1591,佐賀運輸株式会社,1966年, - ,100-499人,佐賀県神埼市神埼町竹3277-3,http://www.sagaunyu.co.jp/
1592,日鉄物流株式会社,2006年, - ,1000人以上,東京都中央区日本橋一丁目13番1号　日鉄日本橋ビル, - 
1593,親和物流株式会社,1990年, - ,1000人以上,埼玉県川口市領家５丁目８番１３号,https://www.shinwa-gds.co.jp/page1
1594,名正運輸株式会社,1969年, - ,1000人以上,愛知県海部郡飛島村大宝7丁目60番地,https://www.meisho-unyu.co.jp/
1595,丸協運輸株式会社,1968年, - ,100-499人,大阪府東大阪市長田3-6-10,https://www.marukyo.jp/
1596,中国陸運株式会社,1954年, - ,100-499人,広島県廿日市市串戸1丁目8番10号,https://chu-riku.co.jp/
1597,大阪東部冷蔵株式会社,1963年, - ,100-499人,大阪府大阪市東住吉区今林3丁目1番50号,http://www.daisui.co.jp/company/subsidiary/tobureizou/
1598,株式会社 阪急阪神エクスプレス,1999年, - ,1000人以上,大阪府大阪市北区梅田二丁目5番25号,https://www.hh-express.com/jp/
1599,株式会社エスプール,1999年, - ,1000人以上,東京都千代田区外神田1-18-13　秋葉原ダイビル6階,https://www.spool.co.jp
1600,株式会社辰巳商会,1920年, - ,500-999人,大阪府大阪市港区築港4丁目1番1号,https://www.tatsumi-cs.co.jp/
1601,愛知陸運株式会社,1942年, - ,1000人以上,愛知県小牧市新小木三丁目20番地,https://www.airiku.co.jp/
1602,プリントネット株式会社,1987年, - ,100-499人,鹿児島県鹿児島市城南町10番7号,https://printnet.jp/
1603,株式会社アヤセ物流倉庫,1996年, - ,30-99人,埼玉県草加市弁天4-6-11,http://www.ayaselogi.co.jp/
1604,株式会社五色,2004年, - ,10-29人,東京都台東区台東2-9-1ミトベビル1-2階,https://www.bestprints.biz/
1605,有限会社 アルプスPPS,2011年, - ,30-99人,東京都江東区南砂1-10-5,http://alps-pps.co.jp/
1606,株式会社オータム,1992年, - , - ,大阪府大阪市西淀川区大和田6丁目16-3,http://www.autumn.co.jp/
1607,株式会社紀文フレッシュシステム,1984年, - ,100-499人,東京都大田区平和島6－1－1 東京流通センター,http://www.kibun-fs.com/
1608,大阪サンヱー物流株式会社,1986年, - ,1000人以上,大阪府枚方市長尾家具町2-1-1,http://osaka-3a.co.jp/
1609,協和運送株式会社,1975年, - ,30-99人,大阪府門真市沖町32,http://www.kyowa-u.com/
1610,日発運輸株式会社,1963年, - ,100-499人,神奈川県横浜市金沢区福浦3丁目10番地,http://www.nhktrs.com/
1611,魚津海陸運輸倉庫株式会社,1951年, - ,30-99人,富山県魚津市三ヶ227-73,http://uodukairiku.co.jp/
1612,Ｆ－ＬＩＮＥ株式会社,1952年, - ,1000人以上,東京都中央区八丁堀三丁目３番５号,https://www.f-line.tokyo.jp/
1613,株式会社トランスネットワーク,2000年, - ,30-99人,大分県大分市廻栖野2188番地,http://transnetwork.co.jp/
1614,丸永運送株式会社,1967年, - ,30-99人,福島県西白河郡矢吹町北町68-1,https://www.marunagaunso.com/
1615,新潟運輸株式会社,1943年, - ,1000人以上,新潟県新潟市中央区女池北1-1-1,http://www.niigataunyu.co.jp/
1616,福山通運株式会社,1948年, - , - ,広島県福山市東深津町4丁目20番1号,https://corp.fukutsu.co.jp/
1617,真藤急便株式会社,2001年, - , - ,宮城県仙台市宮城野区港3丁目2‐12 ㈱辻野2F,https://shindou-express.com/
1618,株式会社東北丸和ロジスティクス,1977年,平野 健治,100-499人,宮城県仙台市太白区郡山6丁目7-20,https://tohokumaruwa.co.jp/
1619,岩手雪運株式会社,1968年, - ,100-499人,岩手県花巻市石神町77-3,http://yukiun.co.jp/
1620,福岡シティ物流株式会社,1968年, - ,30-99人,福岡県福岡市東区松田1-7-16,https://www.fukuokacity.co.jp/
1621,エムケー物流株式会社,1991年, - ,100-499人,大阪府門真市岸和田1-5-23,http://www.mk-logi.com/
1622,大五運送株式会社,1970年, - ,100-499人,静岡県浜松市西区坪井町4493番地の2,http://daigo-unso.co.jp/
1623,陣上工業株式会社,1953年, - ,100-499人,北海道室蘭市仲町16番地,http://www.jing.co.jp/
1624,琉球物流株式会社,1950年, - ,30-99人,沖縄県那覇市港町2丁目17-13,http://www.ryukyu-logi.com/
1625,株式会社ロンコ･ジャパン,1989年, - ,500-999人,大阪府大阪市東成区東小橋1-11-10,http://www.lonco.net/
1626,グリーン物流株式会社,1981年, - ,100-499人,大阪府高槻市西面北2丁目19番1号,https://gr-holdings.co.jp/
1627,センコーグループホールディングス株式会社,1946年, - ,1000人以上,東京都江東区潮見2-8-10 潮見SIFビル,http://www.senkogrouphd.co.jp/
1628,鳥居運送株式会社,1896年, - ,100-499人,大阪府大阪市東住吉区今林3丁目1番55号,https://www.toriiunso.com/
1629,株式会社マルカミ物流,1956年, - ,100-499人,大阪府大東市太子田３丁目４番９号,http://www.marukami.com/
1630,磐栄運送株式会社,1961年, - ,100-499人,福島県いわき市泉町下川字大剣1 番地97,http://www.ban-ei.co.jp/banei/
1631,株式会社日本ロジックス,1953年, - ,30-99人,大阪府大阪市都島区東野田町4丁目1番17号　日本ロジックス　大阪東野田ビル3F,https://www.nihonlogix.co.jp/
1632,ワールド流通株式会社,1975年, - ,100-499人,埼玉県川口市西川口３－１１－１９,http://www.world-ryutsu.co.jp/
1633,滋賀運送株式会社,1949年, - ,500-999人,滋賀県甲賀市水口町名坂840,https://shiga-unso.co.jp/
1634,林田物流株式会社,1971年, - ,100-499人,香川県坂出市林田町4285-198,https://www.hayashida-lc.co.jp/
1635,琵琶倉庫株式会社,1906年, - ,100-499人,滋賀県長浜市祇園町727番地の8,https://www.biwasoko.co.jp/
1636,諏訪倉庫株式会社,1909年, - ,100-499人,長野県岡谷市郷田1-3-1,https://www.suwasoko.co.jp/
1637,株式会社マイロジ,1972年, - ,100-499人,愛知県一宮市木曽川町黒田十二ノ通り1番,http://mylogi.co.jp/
1638,株式会社バルコエキスプレス,1975年, - ,100-499人,大阪府大阪市東住吉区今川8丁目9番16号,http://www.baruko.com/
1639,株式会社杉村倉庫,1919年, - ,30-99人,大阪府大阪市港区福崎1丁目1番57号,https://www.sugimura-wh.co.jp/
1640,フライスター物流株式会社,1989年, - ,30-99人,神奈川県藤沢市善行7-5-2　東大門ビル2F,http://www.frystar-pd.co.jp/
1641,株式会社エィチ･エル･シー千葉,1966年, - ,1000人以上,千葉県茂原市本納3210-11　茂原工業団地,http://www.hlc-chiba.com/
1642,リジョー株式会社,1965年, - ,30-99人,広島県広島市佐伯区石内上1-5-1,https://www.rijo-g.co.jp/
1643,大阪此花運送株式会社,1943年, - ,30-99人,大阪府大阪市西淀川区福町1丁目12番40号,http://www.osakakonohana.co.jp/
1644,太陽流通センター株式会社,1982年, - ,100-499人,大阪府豊中市箕輪3丁目1番10号,http://taiyo-r.co.jp/
1645,長洲通商株式会社,1973年, - ,30-99人,兵庫県伊丹市森本5丁目105番地,http://nagasu-t.com/
1646,株式会社ワールド通商,1995年, - ,1000人以上,千葉県八街市四木1719-4,http://worldexpress.co.jp/
1647,ナガサキロジスティクス株式会社,1970年,阿部浩明,30-99人,飯盛町佐田774番地1,https://nagalogi.co.jp/
1648,ファインハクスイ株式会社,2018年, - , - ,愛知県東海市養父町諸之木8番地,https://fine-h.co.jp/
1649,株式会社須賀川東部運送,1973年, - ,100-499人,福島県須賀川市田中字念仏坦69,http://www.s-tobu.co.jp/
1650,株式会社湯浅運送,1972年, - , - ,宮崎県宮崎市田代町105番1,http://www.yuasa-exp.co.jp/
1651,キチナングループ株式会社,1976年, - ,500-999人,山口県宇部市大字善和字上瀬戸原１８９番７,https://www.kichinan.co.jp/
1652,株式会社フェイズ･インターミックス,2009年, - , - ,千葉県印西市大森781,http://www.phaze-intermix.jp/
1653,株式会社アイアイ･テー,1988年, - ,100-499人,北海道石狩市新港西3丁目700-2,http://www.iit-inc.co.jp/
1654,明治ロジテック株式会社,2008年, - , - ,東京都江東区新砂1-2-10明治東陽町ビル6階,https://www.meiji-logitech.com/
1655,田中運輸倉庫株式会社,1971年, - , - ,大阪府大阪市旭区大宮2-10-9,https://tanaka-unyusouko.com/
1656,株式会社エース,1984年, - ,1000人以上,北海道石狩市新港西1丁目742-10,http://www.e-ace.jp//
1657,株式会社NEXT LINER（ネクストライナー）,2007年, - ,30-99人,埼玉県志木市下宗岡2-18-14,http://nextliner.net/
1658,株式会社テラモト,1932年, - ,1000人以上,神奈川県川崎市川崎区大川町１２番８号,https://www.teramoto-co.net/
1659,江崎運送株式会社,1974年, - ,30-99人,大阪府大阪市東住吉区南田辺5丁目28番28号,https://ezaki-unsou.com/
1660,株式会社アバンテ,1990年, - ,30-99人,大阪府松原市三宅中8-2-8,https://www.abante.co.jp/
1661,東山株式会社,1946年, - ,1000人以上,愛知県名古屋市緑区大高町字二番割23-1,https://www.tozan.co.jp/
1662,株式会社ロジックス,1992年, - ,100-499人,愛知県岡崎市合歓木町字渡嶋90番地3,https://www.lgcs.co.jp/
1663,ロコウェイホールディングス株式会社,2013年, - ,100-499人,愛知県小牧市村中966-1,http://www.locoway.co.jp/
1664,株式会社ロジックナンカイ,1997年, - ,100-499人,大阪府堺市南区高尾1-359-1,https://www.logicnankai.co.jp/
1665,株式会社ヒューテック,1999年, - , - ,愛知県名古屋市北区東味鋺2-2314-4,https://www.hu-tech.jp/
1666,株式会社大一物流,1975年, - , - ,宮城県登米市迫町北方字舟橋前30,https://daiichi-butsuryu.com/
1667,株式会社アムロ,2013年, - , - ,岐阜県岐阜市中鶉2丁目113番地,https://www.amulogi.net/
1668,株式会社アローズ,2018年, - ,10-29人,京都府京都市中京区西ノ京三条坊町2-11,https://arrows-lg.com/jp/
1669,関西陸運株式会社,1963年, - ,500-999人,香川県さぬき市昭和121番地20（高松東ファクトリーパーク内）,http://www.kansairikuun.com/
1670,株式会社中四国丸和ロジスティクス,2002年, - ,100-499人,高知県高知市仁井田字朝日ヶ丘4666-1,https://www.chushikoku-maruwa.com/
1671,株式会社カトーロジック,2009年, - ,30-99人,大分県大分市曲1124-1,https://katologic.com/
1672,株式会社エム・ジ・エルサービス,1987年,石原　英一,10-29人,神奈川県川崎市川崎区大師河原2-4-10,http://www.mgl-service.com
1673,ロジスティード株式会社,1950年,髙木 宏,1000人以上,東京都中央区京橋二丁目9番2号　ロジスティードビル,https://www.logisteed.com/jp/
1674,有限会社神都輸送,1992年, - , - ,東京都武蔵村山市中原4-11-5,http://www.shintoyusou.jp/
1675,株式会社クルーズ,2002年,稲田眞利,10-29人,京都府京都市下京区中堂寺粟田町90番地 KRP8号館,http://www.cruise.co.jp/
1676,水岩運送株式会社,1951年, - ,100-499人,大阪府大阪市大正区泉尾6-1-6,http://www.mizuiwa-un.co.jp
1677,株式会社シティロジテム,2003年,板谷　敏,10-29人,東京都葛飾区西水元3丁目26番22号,http://www.citilogitem.co.jp/
1678,株式会社ディーエーエル,2000年, - ,10-29人,千葉県船橋市潮見町１１番地,http://www.dal.ne.jp/
1679,有限会社加州企画,1990年, - , - ,茨城県小美玉市栗又四ケ1733番地2,http://www.kashu-k.jp/company.html#b
1680,中島運送株式会社,1969年, - ,30-99人,大阪府大阪市加納4丁目13番4号,http://www.nakajima-exp.cleans.jp/
1681,株式会社日商,1991年, - ,1000人以上,三重県亀山市布気町550-4,https://nissyo-net.co.jp/
1682,株式会社BBプロシス,2016年, - , - ,埼玉県入間郡三芳町大字上富2099-2,https://bb-logi.bb-group.jp/bb-porosis
1683,大阪運輸株式会社,1970年, - ,1000人以上,大阪府大阪市住之江区御崎6-3-1,https://www.osakaunyu.jp/
1684,株式会社エィ･ダブリュ･サービス,1983年, - ,100-499人,愛知県岡崎市池金町字中大入1番地57,http://www.aw-s.co.jp/
1685,株式会社 ディ･エス物流,2004年, - ,1000人以上,東京都大田区東糀谷6-1-27　DS・Lヘッドクォーター羽田3階,https://ds-transport.co.jp/
1686,滋賀近交運輸倉庫株式会社,1991年, - ,500-999人,滋賀県長浜市山階町138番地,https://www.kinkog.co.jp/
1687,株式会社ヒガシトゥエンティワン,1944年, - ,500-999人,大阪府大阪市中央区内久宝寺町3-1-9,https://www.e-higashi.co.jp/index.html
1688,やよい運送株式会社,1951年, - ,1000人以上,東京都杉並区荻窪4-33-2 タナベビル,http://www.yayoigroup.jp/top.html
1689,株式会社エスワイロジ,2005年, - ,100-499人,栃木県栃木市岩舟町和泉1587-1,https://www.sylogi.co.jp/
1690,小林運輸倉庫株式会社,1967年,西濱 征治,30-99人,福岡県福岡市東区多の津1-18-5,https://kobayashi-unyu.net/
1691,株式会社大運,1979年, - ,100-499人,佐賀県三養基郡上峰町大字堤3269番地,http://daiun.com/
1692,株式会社ODA,1990年, - ,100-499人,大阪府寝屋川市河北中町37-2,http://oda-coltd.com/
1693,株式会社新鮮便,1965年, - ,500-999人,群馬県伊勢崎市間野谷町1-20,https://www.shinsenbin.com/
1694,ＴＳネットワーク株式会社, - , - , - , - ,http://www.tsnk.co.jp/
1695,日精サービス株式会社,1970年, - ,100-499人,新潟県長岡市十二潟町188-2,https://www.nissei-service.jp/
1696,株式会社リンコーコーポレーション,1905年, - ,100-499人,新潟県新潟市中央区万代五丁目11番30号,https://www.rinko.co.jp/
1697,株式会社ジャパンエキスプレス,1946年, - ,30-99人,福岡県糟屋郡宇美町宇美2447-8,http://www.japex.ne.jp/
1698,株式会社幸新物流センター,1984年, - ,30-99人,大阪府大東市新田中町２－２５,http://koshin-ktc.co.jp/
1699,株式会社月島物流サービス,1968年, - ,1000人以上,東京都中央区勝どき3丁目12番1号フォアフロントタワー13F,https://www.tsukishima-brs.co.jp/
1700,東明倉庫株式会社,1946年, - ,1000人以上,千葉県鎌ケ谷市東道野辺７－４－４４,http://tomei-gp.co.jp/instanthp/page01.html
1701,株式会社クロス,1982年, - ,100-499人,東京都港区赤坂4-3-15　FSK赤坂ビル2F,http://cross-grp.com/
1702,株式会社キッカスアンドカンパニー,2015年,加茂　基香  ​,5-9人,東京都港区北青山2-7-20,https://www.kickas.jp/
1703,株式会社マインドサーティ,2009年,水野　耕太郎,10-29人,東京都板橋区常盤台2-20-18,http://www.m-30.jp
1704,株式会社綜合キャリアオプション,1990年,大泉 高太,1000人以上,東京都港区浜松町2-4-1 世界貿易センタービルディング南館,http://www.sougo-staff.co.jp/
1705,株式会社M＆C,2015年, - ,10-29人,東京都渋谷区宇田川町2-1 1305,https://mandc.tokyo/
1706,株式会社エルアンドエル,1992年,吉村 達也,5-9人,東京都大田区大森北1-19-7,http://www.landl-ltd.com/index.html
1707,KSプレミアムスタッフ株式会社,2008年,堀越　大吉郎,100-499人,千葉県船橋市本町7-10-2 ユニマットガーデンスクエア5階,http://www.ks-premium.jp/
1708,株式会社グランデ,1905年,志村　廣幸,100-499人,埼玉県さいたま市南区南浦和1-23-12　フジモトビル1F.B.,http://www.grande-net.jp/
1709,CAROT株式会社,2019年,嶋田 光宏,5-9人,東京都新宿区新宿1-34-13-1002号室,https://carot.shop/
1710,株式会社キューブマジック,1994年,岩井　隆郎,5-9人,大阪府大阪市西天満5-10-17　西天満パークビル３F,https://cubemagic.co.jp/
1711,株式会社UC,2014年,倉橋 良太,10-29人,東京都足立区西保木間2-13-17-1F,https://uc-demand.inc/
1712,エイジス九州株式会社,1982年,福田 賢司,1000人以上,福岡県福岡市博多区金の隈2-24-10 エイジス九州本社ビル,https://www.ajisk.co.jp/
1713,株式会社ビームコーポレーション,2001年,中嶋 民江,10-29人,東京都品川区東品川２－３－１２　シーフォートスクエアセンタービル７階,https://neo-heat.jp/
1714,株式会社BBF,2011年,細木　和茂,5-9人,土呂町1-38-5-701,http://businessbrain-f.com/index.html
1715,ジャスモックジャパン株式会社,2006年,柿﨑　努,10-29人,愛知県常滑市千代ケ丘1丁目62番地,http://www.jj-ukeoi.com/
1716,コズモスゼネラルサービス株式会社,1986年,弓能家　勤,30-99人,埼玉県新座市本多1丁目7番地29号,http://www.cgs-dm.co.jp/
1717,株式会社スパー・エフエム・ジャパン,2001年,金子 周一郎,5-9人,東京都中央区日本橋3-15-8 アミノ酸会館ビル６F,http://www.sparfmjapan.co.jp/index.html
1718,共通ロジ株式会社,1959年,永原 敏雅,10-29人,北海道札幌市平和通１１丁目北６−１９,https://www.kyotsu.co.jp/company.html
1719,株式会社ユキエ,1976年,宮本　淳,30-99人,茨城県神栖市日川１９６３－２４,http://www.kanban-yukie.com/
1720,Suemaru FT INNOVATORS株式会社,2011年,代表取締役社長　末吉　克也,30-99人,東京都千代田区神田佐久間町1-14　第2東ビル201,http://www.suemaru.co.jp/
1721,巴包装株式会社,1974年,佐々木亮,30-99人,港町2-3-1,http://www.tomoe-pack.co.jp/
1722,明成通信株式会社,1986年,角村 雅実,30-99人,東京都調布市布田4-20-2 調布NKビル301,http://www.meisei-c.co.jp/about.html
1723,株式会社スマイルシステム,2000年,佐藤 裕美,5-9人,北海道滝川市流通団地３丁目１番３２号,http://www.smilesystem-takikawa.jp/index.html
1724,株式会社カンセイ,2009年,葛西 俊治,5-9人,大泉町 吉田 2479-2,https://kansei-inc.com/index.html
1725,株式会社ベルテクス・パートナーズ,2015年,山口 正智,30-99人,東京都港区赤坂9-7-1　ミッドタウン・タワー18階,https://www.vertex-p.com/
1726,株式会社　J 2 B,2005年,佐々木　真人,30-99人,岩手県紫波町犬渕字南谷地32番地34,http://www.j2b.jp/
1727,有限会社オートソクハイ,1987年,早坂勢三,5-9人,宮城県仙台市泉ヶ丘5丁目26-3,http://autosokuhai.web.fc2.com
1728,株式会社トムスエンタープライズ,2014年,孫　海蓮,30-99人,埼玉県草加市吉町1-5-35-602,http://toms-ent.jp/
1729,株式会社福星堂,1996年,代表取締役　小松　英隆,30-99人,神崎郡福崎町西治２,https://fukuseidou.com/
1730,アイビーシステム株式会社,1983年,田中慎一郎,500-999人,長野県諏訪市高島1-26-2 M&Kビル,https://www.ibsystem.jp/
1731,株式会社アビリティ,1905年,中庭　忠,100-499人,茨城県水戸市河和田2-1-10,http://www.ability.ne.jp/
1732,ミクロトータルサポート株式会社,2000年,横井 秀至,5-9人,埼玉県川口市安行吉蔵203番地,http://micro-mts.com/
1733,株式会社ロジテム九州,1956年,末永 浩司,100-499人,福岡県福岡市箱崎ふ頭4-1-28,https://www.logi-q.co.jp/
1734,株式会社東北高速道岩手,2016年,加賀谷　明彦,10-29人,相去町山根梨の木43-153,https://nh-iwate.co.jp/
1735,株式会社インターキャリア,2017年,川瀬　靖雄,5-9人,大阪府大阪市中央区西心斎橋２―１―３　御堂筋ダイヤモンドビル７Ｆ,http://inter-group.jp/
1736,株式会社新栄,2009年,滝沢 英明,100-499人,愛知県岡崎市小針町1丁目12番地8,http://sinei-haken.com/
1737,株式会社ジャッツ,1978年,長島　真治,100-499人,東京都品川区東大井2丁目13番8号ケイヒン東大井ビル4F,https://jats-tokyo.com/
1738,株式会社アウトソーシング,1997年,土井春彦,1000人以上,東京都千代田区丸の内1-8-3 丸の内トラストタワー本館19F,https://www.outsourcing.co.jp/
1739,インフィルデザイン株式会社,2009年,安﨑　彩,5-9人,東京都世田谷区船橋１ー３ー１８ー２０２,https://www.infilldesign.co.jp
1740,株式会社巧,2007年,堀内宗樹,10-29人,愛知県名古屋市中区錦３丁目４番１３号,http://www.e-takumi.co.jp/index.html
1741,株式会社ARDIA,2013年,小松田峰,100-499人,東京都千代田区内神田2-8-5 山口ビル3F,http://ardia.co.jp
1742,株式会社エルシオン,2023年,若林　インドラワニィ,5-9人,谷塚町598-7,http://www.ercyon.co.jp/
1743,株式会社タイプソリューションスタッフ,2016年,長倉 一樹,5-9人,福岡県福岡市中央区大手門1-1-1 2F,https://type-solution.com/
1744,株式会社アクティング,2008年,宮下　浩,30-99人,大阪府大阪市北区堂島浜2ー1ー3 堂島クレイドビル4F,https://www.act-ing.jp/
1745,株式会社ミライ化成,1998年,中川　景介,30-99人,長野県千曲市雨宮2473,https://www.miraikasei.com/index.html
1746,株式会社ワクスタ,2007年,伊田　宗樹,30-99人,大阪府大阪市北区豊崎3-11-6,https://wakusuta.co.jp/
1747,株式会社ソールドアウト,1993年,西古透,10-29人,大阪府大阪市西区新町1丁目5番7号 四ツ橋ビルディング9Ｆ,https://soldout-jp.com/
1748,株式会社SUN-K,2004年,後藤　良三,10-29人,東京都大田区大森南一丁目2番地14号,https://www.sun-k.biz/
1749,株式会社アーツ,2005年,多羅澤 智一,100-499人,扇町４丁目７番１０号,https://arts-group.jp/
1750,村上商事株式会社,1973年,村上 晃徳,100-499人,山口県岩国市飯田町１丁目３０９５－３,https://www.murakamishoji.co.jp/
1751,株式会社岡山臨港,1951年,黒木　良樹,5-9人,岡山県岡山市海岸通 2丁目1番16号,http://www.okarin.co.jp/index.html
1752,合同会社インプレス,2019年,宮前　智,1-4人,北海道江別市野幌若葉町30-10,https://www.impress-event.jp/
1753,合同会社kozy,2021年,湯浅　大樹,5-9人,千葉県成田市西三里塚1-173,https://kozys.co.jp/
