No.,会社名,設立年,代表者名,従業員数,住所,会社URL
876,株式会社グローバルスタッフ, - , - , - ,東京都新宿区荒木町14第五新菱ビルヂング,http://www.globalstaff.co.jp/
877,千代田ユーテック株式会社,1986年, - , - ,神奈川県横浜市神奈川区守屋町3丁目13番地,https://www.utc-yokohama.com/
878,ICON PARTNERS株式会社, - , - , - ,東京都中央区日本橋茅場町3-12-9 NIビル2F,http://www.icon-partners.com/
879,ACS Japan株式会社, - , - , - ,東京都千代田区神田小川町1-1 日光ビル３Ｆ,http://acsjapan.jp/
880,ニッセイ・ビジネス・サービス株式会社,1985年, - , - ,大阪府大阪市中央区今橋3-3-13 ニッセイ淀屋橋イースト12F,http://www.nissay-nbs.co.jp/
881,株式会社ハローネット,1997年,服部　 淳,10-29人,東京都千代田区二番町5番地5番町フィフスビル1階,http://www.hellonet.co.jp/
882,株式会社ジョブアシスト, - , - , - ,兵庫県神戸市灘区六甲町3-3-3神戸発明会館2Ｆ,http://www.job-assist.com/
883,株式会社メイテックキャスト,2000年, - ,30-99人,東京都千代田区神田佐久間町二丁目19番地　櫻岳ビル7階,http://www.meitec-cast.co.jp/
884,ディスタコンサルティング株式会社,1900年, - ,5-9人,東京都港区赤坂7-9-7赤坂小林ビル2階,http://www.dista.jp/
885,株式会社アップロード, - , - , - ,東京都世田谷区喜多見7丁目27番19号,http://www.upload21.net/
886,株式会社アークスター,1998年, - , - ,東京都豊島区東池袋1丁目48番10号２５山京ビル２階,http://www.arkstar.co.jp/medical/
887,有限会社 アゴラ コンサルティング,2003年, - , - ,東京都千代田区神田練塀町45 ライオンズマンション秋葉原1203号室,http://www.agoraconsulting.jp/
888,株式会社東京海上日動キャリアサービス,1984年, - ,500-999人,東京都新宿区新宿6-27-30新宿イーストサイドスクエア 6階,http://www.tcshaken.co.jp/
889,GlobalRefineInc., - , - , - ,東京都千代田区神田富山町21番地神田FKビル4階,http://www.g-refine.co.jp/
890,株式会社グロップ,1975年, - ,500-999人,岡山県岡山市中区さい東町2-2-5,https://www.grop.co.jp/
891,株式会社アーデントスタッフ,1996年, - , - ,神奈川県横浜市神奈川区鶴屋町3-32-13第2安田ビル 2F,https://www.ardent-staff.com/
892,アビリティデザイン株式会社,2000年, - , - ,千葉県千葉市若葉区谷当町1091-3,http://ability-design.co.jp/
893,平成ビジネスアソシエイツ株式会社, - , - , - ,東京都港区赤坂9-6-29 パシフィック乃木坂808,http://www.heisei-business.co.jp/
894,株式会社エーアイエル,1989年, - , - ,東京都千代田区神田小川町3丁目7−13 ヴァンサンクビル9階,http://www.ailltd.co.jp/
895,株式会社人材研究所,2011年,曽和　利光,10-29人,東京都港区白金台2-10-2白金台ビル4F,http://jinzai-kenkyusho.co.jp/
896,テックビジネスサービス株式会社,1986年, - ,30-99人,千葉県習志野市茜浜2丁目8-1ベイテックビル2Ｆ,https://www.tbiz.co.jp/
897,PlaceAndRouteConsulting株式会社, - , - , - ,東京都新宿区西新宿3-7-1　新宿パークタワー30階,http://pandrconsulting.com/
898,株式会社エムシー・ビジネスサポート,2007年, - , - ,東京都港区東新橋２丁目４−１ サンマリーノ汐留 3F,http://www.mcbs07.co.jp/
899,株式会社九電ビジネスフロント,2002年, - , - ,福岡県福岡市中央区天神2丁目12-1  天神ビル4階,http://www.qbfront.co.jp/
900,縁エキスパート株式会社, - , - , - ,愛知県名古屋市瑞穂区洲雲町2-18-1 NIYU桜山ビル,http://www.yukari-expert.com/
901,株式会社ハート・クオリア,1900年, - , - ,神奈川県鎌倉市由比ガ浜4-4-39,http://www.heartqualia.com/
902,クラレテクノ株式会社,1963年, - , - ,大阪府大阪市北区角田町8-1 梅田阪急ビル オフィスタワー39階,http://www.kuraray-techno.com/
903,株式会社エクスオード,2008年, - ,10-29人,東京都新宿区新宿1-36-7 川本ビル9F,http://ex-ord.co.jp/
904,株式会社リージョナルスタイル,2009年, - , - ,東京都港区東新橋2-4-1　サンマリーノ汐留2F,https://www.regional.co.jp/
905,株式会社ソシアリンク, - , - , - ,東京都新宿区西新宿1-8-1新宿ビルディング6階,http://www.socialink.co.jp/
906,株式会社アレクスパート,2010年, - ,10-29人,東京都中央区京橋3-10-1 NEWS京橋3階,http://allexpert.jp/
907,株式会社パワー人材,1988年, - , - ,東京都中央区銀座6丁目16-12 丸高ビル 3F,http://www.power-jinzai.com/
908,佐藤人材・サーチ株式会社, - , - , - ,東京都新宿区須賀町4番地,http://sato-jinzai.com/
909,FVCアドバイザーズ株式会社, - , - ,1-4人,京都府京都市中京区烏丸通六角下ル七観音町623 第11長谷ビル9階,http://www.fvc-ad.co.jp/
910,株式会社アコードアシスト,2006年, - , - ,東京都千代田区神田和泉町１−７−２０みつば第５ビル５階,https://www.accordassist.net/
911,株式会社LIXIL住生活ソリューション, - , - , - ,東京都品川区西品川一丁目1番1号 大崎ガーデンタワー,https://www.ljsshp.jp/page1
912,インテリーガル株式会社, - , - , - ,東京都世田谷区北烏山2-10-C-408,http://www.intelegal.com/
913,株式会社大原キャリアサポート, - , - , - ,大阪府大阪市淀川区西中島3-6-9大原法律公務員専門学校 大阪校2階,http://www.o-hara-cs.com/
914,株式会社プロスタッフ,1987年, - , - ,神奈川県平塚市天沼9-10 日産車体天沼ビル1F,http://www.pro-staff.co.jp/
915,株式会社ワークリレーション,2001年, - , - ,岐阜県岐阜市江添2丁目8-17　山田商業ビル2F南,https://www.work-re.com
916,株式会社ニューキャリア,2003年, - , - ,東京都港区西新橋1-11-3 虎ノ門アサヒビル5階,http://www.newcareer.co.jp/
917,株式会社アビリティーニッケン, - , - , - ,東京都大田区西蒲田7-8-3日研第二ビル7F,https://www.abil.co.jp/index.cfm?fuseaction=contents.fcts&cid=277
918,株式会社SDクリエイティブスタッフ,2005年, - , - ,京都府京都市上京区春帯町349-2　仙石ビル301,http://www.sdcs.jp/
919,Milestone株式会社,2008年, - , - ,福岡県福岡市中央区天神4-8-2 天神プラスビル5F,http://miles-tones.com/
920,株式会社オマージュ,2002年, - , - ,大阪府大阪市中央区難波2-1-2  太陽生命難波ビル3F,https://www.hommage-osc.co.jp/
921,株式会社コンサルティング・エムアンドエス, - , - , - ,東京都品川区東五反田1-21-10三井住友海上五反田ビル5Ｆ,http://www.mands-office.com/
922,株式会社クルース,1997年, - ,10-29人,大阪府大阪市中央区南船場2-12-16 ルグラン心斎橋4F,http://www.cruz.co.jp/
923,株式会社ヒューマンディベロップメントインスティテュート, - , - , - ,東京都中央区日本橋兜町13-1 兜町偕成ビル別館4階,http://www.hdi.co.jp/
924,株式会社アールイー,2000年, - , - ,愛知県名古屋市中区錦2-16-24サン・フシミビル201,http://re2000.co.jp/muryou.htm
925,株式会社エグゼクティブリンク,2011年, - , - ,東京都千代田区内神田2-5-5 ヒューリック大手町北ビル5F,http://www.executive-link.co.jp/
926,株式会社ヒューマンウェイブ,1997年, - ,100-499人,東京都千代田区鍛冶町2-3-1 神田高野ビル7F,https://www.human-wave.co.jp/
927,株式会社プロスタファウンデーション, - , - , - ,東京都豊島区東池袋1-41-6　菊邑91ビル5階,http://www.prosta.co.jp/
928,人材情報株式会社, - , - , - ,東京都中央区1丁目9番13号八重洲駅前合同ビル6階,http://www.jyoho.jp/
929,株式会社SP-Link,1985年, - , - ,福岡県北九州市小倉南区徳力新町1丁目13番30号,http://splink.jp/
930,株式会社キャリアプロダクション, - , - , - ,東京都八王子市石川町94番地1,http://www.capro.co.jp/
931,麹町パートナーズ株式会社, - , - , - ,東京都千代田区麹町1-7相互半蔵門ビルディング,http://www.kojimachi-p.jp/
932,株式会社ロータス,1988年, - , - ,東京都中野区新井1-11-2　ONEST中野ビル6F,http://www.lotus-net.com/
933,株式会社イクソン研究所,2006年, - , - ,東京都江東区青海2-45 タイム24ビル4F,http://www.ixon-institute.com/
934,ブランドステン・ジャパン株式会社,1982年, - , - ,東京都目黒区中町2-50-13 ザ・ピーク4D,http://brandsten.co.jp/
935,株式会社 ツクリベニッセ,1951年, - , - ,東京都板橋区大山西町45-3,http://www.tsukuribe-nisse.co.jp/
936,株式会社オメガコンサルタンツ,1986年, - ,100-499人,東京都豊島区東池袋3-1-1 サンシャイン60 54F,http://www.omgc.co.jp/
937,近畿中央ビジネス株式会社,1985年, - , - ,大阪府堺市堺区戎島町4-45-1 ポルタス・センタービル12F,http://www.kcb-web.co.jp/
938,川庄会計グループ,1981年, - ,30-99人,福岡県福岡市中央区白金1-4-10 SUNSHINE C-PAK,http://www.kawa-sho.co.jp/
939,株式会社エール・ヒューマンソリューション・パートナーズ,1997年, - , - ,山梨県甲府市徳行2-1-7,http://www.yell-yhp.com/
940,T&Uパートナーズ株式会社,2011年, - , - ,東京都港区虎ノ門5-13-1　虎ノ門40MTビル7F,http://www.tu-p.co.jp/
941,株式会社キャリアファーム, - , - , - ,東京都渋谷区恵比寿西1-7-7 EBSビル4F,http://www.careerfirm.co.jp/
942,カムイブレインスコンサルタント株式会社, - , - ,5-9人,静岡県浜松市西区入野町9745-1　KSビル202,http://www.kamui-brains.com/
943,株式会社アイテックサービス,2006年, - , - ,長野県駒ヶ根市赤穂10823番,http://www.itec-service.co.jp/
944,株式会社グレイス, - , - , - ,東京都千代田区麹町5-4-　セタニビル5F,http://www.grace-e.co.jp/
945,インフィス株式会社, - , - , - ,東京都渋谷区渋谷2-12-15日本薬学会長井記念館,http://www.infisjapan.co.jp/
946,タクトシステム株式会社, - , - ,30-99人,東京都港区芝5-29-18ＮＢＣ三田ビル8F,http://www.tact-system.jp/
947,株式会社アイカ,2001年, - , - ,大阪府大阪市中央区南船場3-2-28　日宝タイヨービル4F,http://www.koutouka.jp/
948,株式会社オークス・インターナショナル, - , - , - ,東京都中央区銀座７―１０―１８ 銀座秀芳ビル　９Ｆ,http://www.oaks.co.jp/
949,株式会社インフォーメーション・リサーチ研究所,1995年, - , - ,大阪府大阪市西区靭本町1-5-15第二富士ビル4F,http://www.e-iri.jp/
950,株式会社エクセレンス, - , - , - ,東京都豊島区東池袋2-62-10　池袋5thビル8F,http://www.excellence-cad.jp/
951,アイティエス株式会社,1986年, - , - ,愛媛県今治市北宝来町1丁目2番地2,http://www.ehime-its.co.jp/
952,株式会社大商,1983年, - ,5-9人,東京都豊島区駒込１-４２-２-２０１,http://www.daisho-m.co.jp/
953,株式会社東邦サービス, - , - , - ,埼玉県戸田市本町1丁目3番3号ライオンズマンション戸田公園204号,http://www.toho-service.jp/
954,株式会社タカギ,1988年, - , - ,大阪府大阪市北区浪花町13番38号 千代田ビル北館4階,http://www.takagi-job.com/
955,株式会社多幸,1954年, - , - ,愛知県名古屋市西区則武新町４丁目３番１７号　加島ビル３Ｆ,http://www.takou-m.co.jp/
956,株式会社エイドオール, - , - , - ,群馬県太田市新井町501-2 城代商事ビル １F,http://aid-all.co.jp/
957,株式会社トラストエージェント, - , - , - ,東京都大田区蒲田5-15-8 蒲田月村ビル6F,http://www.trust-agent.co.jp/
958,株式会社アヴァンセ・アジル,2007年, - , - ,東京都渋谷区千駄ヶ谷5−29−11 ナカニシビル7階,https://a-agile.co.jp
959,株式会社エイビス, - , - , - ,愛知県名古屋市中区栄二丁目3番6号 NBF名古屋広小路ビル5F,http://www.eibis.co.jp/
960,株式会社テクノマート, - , - , - ,東京都千代田区鍛冶町1-8-8神田鍛冶町ビル3階,http://www.techno-mart.jp/
961,株式会社フカノ, - , - , - ,東京都千代田区神田須田町2-23-2 CONOE秋葉原万世橋902号室,http://www.fukano-sc.com/
962,有限会社サイショウ,1992年, - , - ,群馬県太田市飯田町1341番地,http://www.yk-saisho.co.jp/
963,センチュリーキャリアコンサルティング株式会社, - , - , - ,東京都千代田区麹町2-10-3リノウ麹町ビル3F（旧イトーピア麹町AAビル）,http://www.ccci.jp/index.html
964,イーパートナー株式会社, - , - , - ,東京都港区南青山6-1-32-419,http://www.e-partner-japan.com/
965,エスワン株式会社, - , - ,5-9人,京都府京都市中京区蛸薬師通烏丸西入橋弁慶町228　AOIビル304,http://www.kyoto-s-one.co.jp/
966,株式会社アスタリスク,2007年, - , - ,東京都多摩市山王下 1-12-16新屋ビル305,http://www.asterisknet.jp/
967,株式会社サクセスフォー,2000年, - ,5-9人,埼玉県戸田市本町５-１１-１ ルシェロ戸田公園２Ｆ,http://www.successfor.co.jp/
968,有限会社プリモス,1990年, - , - ,東京都新宿区西新宿３-５-３-３１６,http://www.jobpop.jp/
969,パシフィック・ビュー・コーポレーション株式会社,1900年, - , - ,東京都新宿区新宿一丁目31番12号 御苑K-1ビル 5階,http://www.pvc-jp.com/
970,株式会社大原キャリアスタッフ,1900年, - , - ,東京都千代田区西神田２−７−１６遠藤ビル１階,http://www.o-hara-cs.jp/
971,株式会社北海道チャイナワーク,1999年, - ,10-29人,北海道札幌市中央区北２条西３丁目1−12 敷島ビル6階,http://www.h-china.com/
972,Trunk株式会社,2015年, - , - ,東京都目黒区駒場1-5-10 小里ビル3F,http://trunk.fm/
973,株式会社ライズ,1994年, - , - ,千葉県松戸市松戸1307-1 松戸ビル16階,http://rise-jms.jp/
974,株式会社マーキュリー,2003年, - , - ,東京都中央区銀座7-4-14　HBC GINZAビル10階,http://www.mercury21.jp/
975,株式会社グッピーズ,2000年, - , - ,東京都新宿区西新宿1-25-1 新宿センタービル13F,http://www.guppy.co.jp/
976,株式会社日本教育クリエイト,1975年, - ,1000人以上,東京都新宿区西新宿1-23-7　新宿ファーストウエスト7F,http://www.nk-create.co.jp/
977,エフリオ株式会社,2015年, - , - ,東京都杉並区阿佐谷北2-14-5　大阪やビル3階,http://f-reo.jp/
978,株式会社さんぽう,1968年, - , - ,東京都渋谷区初台1-31-16　初台壱番館ビル,http://company.sanpou-s.net/
979,株式会社T.Sサービス, - , - , - ,東京都大田区南馬込サンライフ南馬込1-15-2-203,http://www.tssv.co.jp/
980,株式会社テクノプロ・キャリア, - , - , - ,東京都港区南青山1丁目1番1号　新青山ビル西館　10F,https://www.technopro-careers.com/
981,東洋ワーク株式会社,1988年, - ,500-999人,宮城県仙台市青葉区国分町1-7-18　東洋ワークビル　5F,http://www.toyowork.co.jp/
982,株式会社履創,2008年, - , - ,東京都新宿区西早稲田1-22-3 早稲田大学インキュベーションセンター内,http://www.risoh-dream.com/
983,株式会社インプレッション,2004年, - , - ,東京都千代田区九段北1-2-12　九段下プラレールビル５F,https://www.impr.co.jp/
984,東芝ビジネスエキスパート株式会社, - , - ,1000人以上,神奈川県川崎市川崎区日進町7-1　川崎日進町ビル4F,http://www.tbls.toshiba.co.jp/
985,株式会社パソナマーケティング,1978年, - , - ,大阪府大阪市中央区本町2-5-7,http://www.pasona-marketing.co.jp/
986,パーソルテンプスタッフ株式会社,1973年, - ,100-499人,東京都渋谷区代々木2-1-1 新宿マインズタワー,https://www.tempstaff.co.jp/
987,株式会社キイパーソン,1988年, - , - ,東京都渋谷区渋谷1-17-2 CRD渋谷ファーストビル3階,http://www.keyperson.co.jp/
988,株式会社アルトナー,1962年, - ,500-999人,大阪府大阪市北区中之島3-2-18 住友中之島ビル2F,https://www.artner.co.jp/
989,株式会社アヴァンティ,2008年, - , - ,東京都中央区銀座7-13-6サガミビル2階,http://avanti.cc/
990,北電産業株式会社,1974年, - ,500-999人,富山県富山市牛島町13番15号百川ビル7階,https://www.hs-k.co.jp/
991,株式会社SKY CAREER,2013年, - , - ,東京都千代田区九段南3-8-10 川内ビル3階,https://www.skycareer.co.jp/
992,ファイズホールディングス株式会社,2013年, - ,100-499人,大阪府大阪市北区梅田三丁目4番5号 毎日インテシオ13F,https://phyz.co.jp/
993,エージェント・パートナーズ株式会社, - , - , - ,東京都中央区日本橋3-2-14 新槇町ビル別館第一 2階,http://www.agent-partners.com/
994,株式会社オフィスプロデュース,1997年, - ,100-499人,東京都中央区銀座1-22-11 2F,https://www.pcsproduce.co.jp/
995,イムカメディカル株式会社, - , - , - ,東京都台東区台東一丁目11番10号,http://www.imca.co.jp/
996,株式会社ヒューマン・ハーバー,1989年, - ,100-499人,東京都豊島区南池袋2-30-8 友泉南池袋ビル 7F,http://www.human-harbor.co.jp/
997,株式会社プロントサービス,2007年,杉山　和弘,500-999人,東京都港区港南1-8-27日新ビル,http://www.pronto-service.co.jp/
998,株式会社ローザス, - , - , - ,東京都中央区銀座2ー6ー15　第一吉田ビル4階,http://www.rozas.co.jp/
999,ヒューマン・アソシエイツ・ホールディングス株式会社,1996年, - ,30-99人,東京都港区南青山1-3-3　青山一丁目タワー4階,http://www.humanassociates.com/
1000,株式会社グローバルインディペンデント,2003年, - , - ,東京都港区高輪3-23-17 品川センタービルディング3階,http://www.globalindependent.co.jp/
1001,パルド株式会社,2008年, - , - ,東京都中央区日本橋1-2-10 一東洋ビル5F,http://pardo.jp/
1002,ゼスト株式会社, - , - , - ,神奈川県横浜市中区寿町1-2-3 コスモシティ横浜石川町7F,http://zest-agent.co.jp/
1003,株式会社トラストグロース,2008年, - ,30-99人,東京都新宿区西新宿7-16-11 VARCA西新宿6階,http://www.trust-growth.co.jp/
1004,リソウル株式会社, - , - , - ,神奈川県鎌倉市大町2-3-6-2階,http://resoul.jp/
1005,アクター株式会社,2001年, - , - ,東京都中央区八重洲2-11-6 川昌八重洲ビル7F,http://www.iactor.co.jp/
1006,株式会社リンクル, - , - , - ,愛知県名古屋市中区栄5-16-14新東陽ビル5F,http://www.link-smile.co.jp/
1007,株式会社ワールド・キャリアパートナーズ, - , - , - ,福岡県福岡市中央区天神4-9-10　第2正友ビル4F,http://wcp-jp.com/
1008,有限会社タカラ人材センター,1988年, - , - ,愛知県名古屋市中区栄3-11-5 栄ビジネスマンションＮ304号室（受付、登録、相談）、N405号室（着付け教室、研修室）,http://www.hito-takara.co.jp/
1009,NOA・JAPAN株式会社, - , - , - ,埼玉県所沢市小手指町1-10-11沖田ビル2F,http://noa-jpn.com/
1010,ナレッジサーブ株式会社,1999年, - , - ,福岡県福岡市中央区舞鶴3-2-21  赤坂パークビル2F,http://www.knowledgeserve.jp/
1011,AFGコンサルティング株式会社, - , - , - ,東京都千代田区丸の内1-9-1グラントウキョウノースタワー38F,http://www.afg-c.co.jp/company/
1012,株式会社東洋ビジネスパートナーズ, - , - , - ,東京都千代田区紀尾井町4-1ニューオータニビジネスコート10階,http://www.tbpex.com/
1013,株式会社岡山ヒューマンリソース, - , - , - ,岡山県岡山市北区大元駅前３?５０,http://ph-plaza.net/
1014,ケイ・ティー・ビー株式会社, - , - , - ,東京都中央区八重洲2-6-16,http://www.ktb-j.com/
1015,株式会社人創り・組織創り, - , - , - ,東京都中央区佃2-2-11-1205,http://www.hito-soshiki.com/
1016,EMIconsulting株式会社, - , - , - ,東京都中央区日本橋蛎殻町1-8-2,http://emi-consulting.co.jp/
1017,株式会社アパレルコンシェル,2011年, - ,5-9人,東京都渋谷区恵比寿1-22-23　ヴェラハイツ恵比寿316,http://www.apa-con.com/
1018,株式会社アムール・メディカル, - , - , - ,愛知県名古屋市東区東桜1丁目10番9号栄プラザビル8階〒461-0005,http://www.amourmedical.jp/
1019,株式会社ヒューマンサービス,2006年, - , - ,東京都渋谷区代々木5-55-6 コンフォール参宮橋４F,http://www.humanservice.co.jp/
1020,スキルハウス・スタッフィング・ソリューションズ株式会社,1900年, - , - ,東京都港区虎ノ門3-8-27巴町アネックス2号館7F,http://www.skillhouse.co.jp/
1021,シンクトワイス株式会社, - , - , - ,東京都港区赤坂4-8-14 赤坂坂東ビルディング5階,http://www.thinktwice.co.jp
1022,株式会社アルパジャパン,1996年, - , - ,神奈川県川崎市川崎区駅前本町3-1　NMF川崎東口ビル12F,http://alpajapan.co.jp/
1023,株式会社ヒルストンキャリア,2014年, - , - ,東京都千代田区神田鍛冶町3-3-9 喜助新千代田ビル4F,https://www.hillstonecareer.com
1024,株式会社アドバ, - , - , - ,愛知県名古屋市中区栄3-14-7 RICCO栄8F,http://www.adva-hs.jp/
1025,株式会社シー・シー・コンサルティング, - , - , - ,東京都千代田区神田神保町1-105神保町三井ビルディング15階,http://www.ccconsulting.jp/
1026,株式会社スタッフ・アクティオ, - , - , - ,東京都港区新橋1-7-1 近鉄銀座中央通りビル7F,https://www.staffaktio.co.jp/
1027,株式会社リジョブ, - , - , - ,東京都豊島区東池袋3-1-1　サンシャイン60　47F,https://rejob.co.jp/
1028,株式会社ダイバージェンス, - , - , - ,大阪府大阪市浪速区難波中1-10-4 12F,http://www.divergence.co.jp/
1029,スローガン株式会社, - , - , - ,東京都港区南青山2-11-17 第一法規本社ビル 3階,http://www.slogan.jp/
1030,株式会社 アトラエ, - , - , - ,東京都港区麻布十番1-10-10 ジュールA 8F,http://atrae.co.jp/
1031,株式会社ウェルクス,2013年, - ,100-499人,東京都台東区上野3-24-6　上野フロンティアタワー13F,https://welks.co.jp/
1032,ジーニアス株式会社, - , - , - ,東京都千代田区麹町1-7 相互半蔵門ビル9F,https://www.genius-japan.com/
1033,ウォンテッドリー株式会社,2010年, - , - ,東京都港区白金台5-12-7 MG白金台ビル4階,https://wantedlyinc.com/ja
1034,ディレクトリジャパン株式会社, - , - , - ,東京都武蔵野市吉祥寺南町1-11-11 BIBIインターナショナルビル5階,http://www.directoryjapan.jp/
1035,ウェブスタッフ株式会社,1998年, - , - ,東京都渋谷区桜丘町20-1　渋谷インフォスタワー5F,https://www.webstaff.jp
1036,株式会社マンネット,1986年,関　道博,30-99人,東京都渋谷区渋谷3-6-6  渋谷パークビル4F,https://mannet.jp/
1037,ユーコネクト株式会社,2008年, - , - ,福岡県福岡市中央区天神1丁目6-8　天神ツインビル8F,http://www.youcone.co.jp/
1038,株式会社HELIOS,2018年, - , - ,大阪府大阪市西区西本町1-2-1 AXIS本町ビル10F,http://helios-ltd.com/
1039,株式会社Compass,2015年, - , - ,東京都豊島区南大塚二丁目25番15号 South新大塚ビル10F,https://compass8.co.jp/
1040,株式会社パソナ,1988年, - ,1000人以上,東京都千代田区大手町2-6-2,https://www.pasona.co.jp/
1041,株式会社リトルシーズサービス,1999年, - , - ,福島県郡山市東原1丁目292番地,http://www.littleseeds.co.jp/
1042,レバテック株式会社,2017年,林　英司,100-499人,東京都渋谷区渋谷2-24-12 渋谷スクランブルスクエア 24F・25F,https://levtech.jp/
1043,株式会社レキサン,2017年, - , - ,沖縄県那覇市久茂地2-12-21　電波堂ビル 6F,https://rs-okinawa.net/
1044,株式会社JTB沖縄,1988年, - , - ,沖縄県那覇市旭町112番1,https://www.okinawa-career.com/
1045,三陽工業株式会社　京都営業所,2005年, - , - ,京都府京都市南区吉祥院中河原里西町34 永野ビル4F,http://sanyou-ind.co.jp/
1046,株式会社ライフブリッジ,2006年, - , - ,宮城県仙台市泉区泉中央1-7-1　 地下鉄泉中央駅ビル6F,http://www.lifebridge-trans.jp/
1047,株式会社アップトゥユー,2019年, - , - ,長崎県佐世保市宮田町2-18,https://www.uptoyou2019.com/
1048,パーソナルテンプスタッフ・カメイ株式会社,1988年, - , - ,宮城県仙台市青葉区花京院1丁目1番20号 花京院スクエア8階,https://www.tempstaff-kamei.co.jp/
1049,株式会社キャリアマネジメント,2007年, - , - ,秋田県秋田市中通4丁目14-16 アキタスクエアビル3F,http://career-management.co.jp/index.html
1050,メティエキャリアーズ株式会社, - , - , - ,東京都港区麻布台3-1-5   日ノ樹ビル601号,https://metiercareers.co.jp/
1051,レバレジーズ株式会社,2005年, - ,1000人以上,東京都渋谷区渋谷二丁目24番12号 渋谷スクランブルスクエア　24F・25F,http://leverages.jp/
1052,Russel Reynolds（ラッセルレイノルズ）, - , - , - ,東京都港区赤坂5-3-1 赤坂Bizタワー37階,https://www.russellreynolds.com/ja
