No.,会社名,設立年,代表者名,従業員数,住所,会社URL
1,株式会社ジャッツ,1978年,長島　真治,100-499人,東京都品川区東大井2丁目13番8号ケイヒン東大井ビル4F,https://jats-tokyo.com/
2,株式会社grooves,2004年, - ,100-499人,東京都港区南青山5-4-27 Barbizon104 7F,https://www.grooves.com
3,株式会社ツナグ・スタッフィング,2000年,菊地 　元太,30-99人,東京都千代田区神田三崎町3丁目1-16 神保町北東急ビル1F･2F,https://staffing.tsunagu-grp.jp/
4,株式会社nendo,2019年, - , - ,東京都中央区八重洲 1丁目2番16号 ＴＧビルディング 8階,https://nendo.co.jp/
5,ARCH plus株式会社 / ARCH plus協同組合,2018年,瀬戸陽子,5-9人,東区白壁2−25−19 1F,https://arch-plus.co.jp/
6,株式会社エンディングキャリア,2020年,佐藤大介,5-9人,東京都渋谷区恵比寿西2-19-9 フランセスビル1階2階,https://endingcareer.co.jp/
7,株式会社ミライアル,2015年,木田豊彦,1-4人,大阪府吹田市広芝町１０－８董友ビル2階,https://t-miraiaru.com/
8,株式会社スマイループス, - , - , - ,東京都港区三田1-2-17 MSビル4F,https://smiloops.com/
9,株式会社Asian Bridge,2007年,小西　広恭,30-99人,東京都港区芝3-1-15 芝ボートビル 7F,https://asianbridge.co.jp/
10,株式会社リオルサ,2019年, - ,10-29人,愛知県名古屋市中区栄1-21-10つばめ第2栄ビル2F,https://recruit-ask.com/
11,株式会社コネクトグロー,2020年,押元　啓介,1-4人,大阪府吹田市豊津町18-37 江坂ビジネスゾーン405,https://connect-grow.co.jp/
12,株式会社　トレンド,2013年,高谷久志,500-999人,愛知県刈谷市東刈谷町3丁目12番地7,https://www.trendco.biz/
13,株式会社Mate,2022年,-,30-99人,大阪府大阪市中津3−12−8,https://www.mate.town
14,株式会社KAND,2022年, - ,1-4人,久太郎町3丁目1-6　伊藤佑ビル大阪本町6階,https://www.k-and.co.jp/
15,エッセンス株式会社,2009年,米田 瑛紀,10-29人,東京都中央区日本橋蛎殻町１－１１－１,http://www.essence.ne.jp/
16,株式会社UZUZ,2012年, - ,30-99人,東京都新宿区西新宿3丁目11-20　オフィススクエアビル新宿3階,https://uzuz.jp/
17,株式会社IKY,2016年,川西　恭平,10-29人,東京都豊島区南池袋3-13-14 TAKIビル 5-6F,http://i-k-y.co.jp/
18,株式会社リアルミー,2017年, - ,10-29人,東京都港区西新橋2-2-7  マリソルビル3階,https://www.realme-career.com/clients
19,東西株式会社,1957年, - ,500-999人,東京都大田区大森北1-1-10　大森シティビル9F,https://www.touzai.jp/
20,株式会社LULL,2019年,仁藤 敬介,100-499人,東京都渋谷区渋谷3丁目10-13 TOKYU REIT渋谷Rビル B1,https://lull-inc.co.jp/
21,イーバリュー株式会社,2018年, - ,30-99人,愛知県名古屋市中村区名駅4-5-28 桜通豊田ビル18F,https://www.e-value.jp/
22,株式会社プラセム,2018年,川島　裕司,30-99人,福岡県福岡市博多区博多駅前3-13-4リアンプレミアム博多駅前ビル 3F,https://plusem.co.jp/
23,株式会社プラセム（人材コンサルティング事業部）,2018年, - , - ,福岡県福岡市博多駅前3-13-4リアンプレミアム博多駅前ビル 3F, - 
24,株式会社ライフ・サポート,1988年,神谷 宗孝,100-499人,向陽町３丁目４番地,https://lifespt.jp/index.php
25,Dual Depth株式会社,2023年,石井 貴浩,5-9人,東京都荒川区南千住７−１８−６,https://dualdepth.net/
26,株式会社ヒューマリッジ,2015年, - ,10-29人,東京都千代田区神田神保町1-64　神保町協和ビル5Ｆ,http://www.huemaridge.co.jp/
27,株式会社 エクシードジャパン,2005年, - ,30-99人,東京都渋谷区代々木1-2-9 代々木アネックスビル2階,http://www.exceedjapan.co.jp/
28,株式会社アイエスエフネットジョイ,2002年, - , - ,東京都港区赤坂８－４－１４　青山タワープレイス８F,http://www.joy-c.com/about_us/company_info.html
29,株式会社キャリア革命, - , - , - ,東京都港区南青山2-2-8 DFビル10階,http://www.career-kakumei.com/index.html
30,首都高パートナーズ株式会社,2006年,三原　真一,1-4人,東京都中央区日本橋3-11-1 ＨＳＢＣビルディング２階,http://www.shutoko-pn.jp/
31,株式会社シーエーセールススタッフ,2003年, - ,30-99人,東京都港区浜松町1-2-14　ユーデン浜松町ビル5F,https://www.ca-ss.jp/
32,株式会社itk,2006年, - , - ,東京都中央区銀座5-12-5 白鶴ビルディング5F,http://www.i-t-k.co.jp/
33,株式会社BNGパートナーズ,2009年, - ,30-99人,東京都千代田区五番町4-5 五番町コスモビル3階,https://bngpartners.jp
34,株式会社クボモト,1971年,久保本 篤,30-99人,神奈川県横浜市中区太田町6-86　オーパリヴァージュ701,https://www.kubomoto.co.jp/
35,株式会社アクトブレーン,1998年,中原 大志,100-499人,東京都新宿区西新宿1-6-1　新宿エルタワー14F,http://www.actgroup.jp/
36,株式会社チャージ,1995年, - ,30-99人,大阪府大阪市北区芝田1-4-14 芝田町ビル4F,https://charge-staff.co.jp
37,株式会社シニアエイド・イノベーション, - , - ,5-9人,兵庫県神戸市中央区海岸通8番 神港ビルヂング5階 523号,http://senior-aid.jp/
38,株式会社キャリア経営パートナーズ,2014年, - ,1-4人,大阪府大阪市中央区本町橋2-23 第7松屋ビル 827号室,http://career-kp.co.jp/
39,株式会社Acseez,2014年, - ,1000人以上,埼玉県さいたま市大宮区下町2-18　TS-3BLDG1F,http://www.acseez.jp/
40,株式会社小田急プラネット,1992年, - ,500-999人,東京都新宿区西新宿1丁目4番9号,https://www.odakyu-planet.co.jp/
41,株式会社hape,2013年,蔵野　絋二朗,10-29人,東京都渋谷区渋谷3-6-3 渋谷363清水ビル4階,https://hape.co.jp/
42,株式会社デジタルスケープ,1995年,篠原淳,100-499人,東京都渋谷区道玄坂1-10-8 渋谷道玄坂東急ビル8階,http://corp.dsp.co.jp/
43,KSキャリア株式会社,2020年, - ,10-29人,東京都千代田区丸の内1-8-1丸の内トラストタワーN館17階,https://ks-career.co.jp/
44,タイグロンパートナーズ株式会社,2007年,野尻剛二郎, - ,東京都港区虎ノ門２－３－１７　虎ノ門2丁目タワー10階,https://www.tiglon-partners.com/
45,株式会社ジェイ・メイト,2001年,内田　靖博,30-99人,東京都大田区大森北1丁目1−5 YK16ビル601,https://jmate.co.jp
46,株式会社クリエイト・インターナショナル, - , - ,10-29人,東京都新宿区市谷砂土原3-4-1,http://www.create-int.co.jp/
47,株式会社きゃりなっぷ,2014年, - ,1-4人,東京都新宿区西新宿7丁目7番26　ワコーレ新宿第一ビル407,http://carynap.co.jp/
48,株式会社プロフェッショナルバンク,2004年,兒玉　彰,100-499人,東京都千代田区内幸町2-2-2　富国生命ビル10階,http://www.pro-bank.co.jp/
49,日総ブレイン株式会社,1986年, - , - ,神奈川県横浜市鶴見区豊岡町28-26　日総第一ビル神奈川県横浜市神奈川区鶴屋町2-23-2　TSプラザビル16F,http://www.nsbrain.jp/
50,株式会社廣済堂,1954年,根岸 千尋,1000人以上,東京都港区芝浦1-2-3　シーバンスS館13F,https://www.kosaido.co.jp/
51,アドバンテック株式会社,1998年, - , - ,大阪府大阪市淀川区宮原3-5-36 新大阪トラストタワー19F,http://www.advan-t.com/
52,株式会社ジョブメイト,1985年, - , - ,青森県青森市浪打1-14-3　JMGビル,http://www.jobmate.co.jp/
53,株式会社 クイック,1980年, - ,1000人以上,大阪府大阪市北区小松原町2-4　大阪富国生命ビル東京都港区赤坂2-11-7　ATT新館,http://919.jp/
54,株式会社ジェイック,1991年, - ,100-499人,東京都千代田区神田神保町1-101　神保町101ビル6F,http://www.jaic-g.com/
55,株式会社インフィニティー,2001年, - , - ,愛知県名古屋市中区錦1-17-13　名興ビル5F,http://www.in-fy.com/
56,株式会社エヌエムピースペシャリスト,1979年, - ,100-499人,東京都新宿区新宿2-3-11　VORT新宿御苑5階,https://nmp-specialist.com/
57,株式会社ヴォーチェ,2009年,毛受 史江,5-9人,愛知県名古屋市葵１丁目１４−１３アーク新栄ビルディング6F,https://agross.jp/
58,株式会社そると,2015年, - ,10-29人,東京都品川区上大崎2-15-19 MG目黒駅前2階,http://www.saltinc.co.jp
59,株式会社エスプールヒューマンソリューションズ,2009年, - ,100-499人,東京都新宿区西新宿1-25-1 新宿センタービル36階,https://www.spool.co.jp/service/shs/
60,株式会社CROSLAN,2017年,川村敦,5-9人,平野町３丁目３−７ ニューライフ平野町908号室,https://croslan.co.jp/
61,キャリアバンク株式会社,1987年,佐藤　良雄,100-499人,北海道札幌市中央区北五条西五丁目7番地,https://www.career-bank.co.jp/
62,みらい人材サポート株式会社,2015年, - ,5-9人,愛知県名古屋市中区丸の内3-14-32　丸の内三丁目ビル 9F,http://www.career-on.jp/
63,株式会社極東ブレイン,1982年, - , - ,兵庫県芦屋市茶屋之町2番21メイピース芦屋303号,http://fe-brain.com/
64,V-Job株式会社,2017年, - ,1-4人,〒222-0033 神奈川県横浜市港北区新横浜３丁目17番12号ビステーション新横浜,https://v-job.co.jp/home/info
65,株式会社エヌティ,2011年, - ,10-29人,埼玉県鴻巣市松原1-3-18,https://www.k-nt.co.jp/
66,アデコ株式会社,1985年,川崎　健一郎,1000人以上,東京都千代田区霞が関3-7-1　霞が関東急ビル,https://www.adeccogroup.jp
67,キャリア・パートナーズ株式会社, - , - , - ,東京都杉並区堀ノ内1-17-36,http://www.career-partners.biz/
68,株式会社ネオキャリア,2000年,西澤　亮一,1000人以上,東京都新宿区西新宿1-22-2 新宿サンエービル2階,https://www.neo-career.co.jp/
69,株式会社ジャパンクリエイトグループ,2011年, - ,30-99人,大阪府大阪市淀川区東三国4-3-1 グロリア240 3F,http://www.jc-grp.com/
70,株式会社マイベース,2014年, - ,10-29人,東京都新宿区高田馬場3-12-2　高田馬場OCビル4階,http://mybase.co.jp/
71,株式会社リンクスタッフ,1992年, - ,100-499人,東京都港区赤坂4-9-17 赤坂第一ビル5・6F,http://it-link.net/lp
72,株式会社エルティービー,2013年,鈴木 晴美, - ,東京都新宿区西新宿6-12-16,https://livetobusiness.co.jp/
73,株式会社Bridge,2020年, - ,10-29人,大阪府大阪市南船場 2-11-20 GATO三休橋ビル1F 東B,https://tk-bridge.com/
74,株式会社ナイチンゲール,2000年,関根　冨士子,30-99人,東京都渋谷区道玄坂2-8-7 渋谷道玄坂ビル3・4F,http://www.nightingale-web.com/
75,インデュースキャリアプロモーション株式会社,2003年,山口　博史,5-9人,東京都渋谷区渋谷3-7-2 第3矢木ビル5F,http://www.induce.co.jp/
76,株式会社グランシーズ,2005年,代表取締役　小林　久美子,5-9人,東京都新宿区西新宿7-10-6西新宿小林ビル4F,http://granseeds.co.jp/
77,とうざい株式会社,2007年,田中　圭,30-99人,青森県八戸市城下4ー9ー5,https://www.e1031.jp/
78,株式会社ソーシャライズ,2014年, - , - ,東京都渋谷区宇田川町2-1渋谷ホームズ1015,http://sociarise.co.jp/
79,エン・ジャパン,2000年,鈴木　孝二,1000人以上,東京都新宿区西新宿6-5-1 新宿アイランドタワー,https://corp.en-japan.com/
80,株式会社ＨＲビジョン,2000年, - ,30-99人,東京都港区北青山2-7-9 日昭ビル 7階,https://hrvision.co.jp/
81,株式会社アソウ・ヒューマニーセンター,1984年, - , - ,福岡県福岡市中央区天神2-8-41 福岡朝日会館 14階,https://www.ahc-net.co.jp/
82,株式会社ロバート・ハーフ・ジャパン, - , - , - ,東京都千代田区大手町 1-1-3大手センタービル 22 F,https://www.roberthalf.jp/ja
83,株式会社インターワークス,1991年, - ,100-499人,東京都港区西新橋1-6-21　NBF虎ノ門ビル8階,https://interworks.jp/
84,株式会社 アイ・エヌ・ジー・エンタープライズ,1997年, - , - ,東京都新宿区早稲田町12-5 ニュー早稲田ビル6F,http://www.ing-ent.co.jp/
85,株式会社iDA,1999年, - ,1000人以上,東京都渋谷区代々木2-2-1 小田急サザンタワー 7F大阪府大阪市中央区本町3-3-8 山口興産ビル 5F,http://www.ida-mode.com/
86,株式会社ディスコ,1973年, - ,100-499人,東京都文京区後楽2-5-1 飯田橋ファーストビル 9階,http://www.disc.co.jp/corporate/
87,株式会社A・ヒューマン,2000年, - , - ,東京都港区南青山1-3-3 青山一丁目タワー4階,http://www.a-human.net/
88,株式会社ユウクリ,1984年,武藤　覚,30-99人,東京都渋谷区円山町28-3　いちご渋谷道玄坂ビル,https://www.y-create.co.jp/
89,ヒューレックス株式会社,2003年, - ,30-99人,宮城県仙台市青葉区中央1-3-1,http://www.hurex.jp/
90,テクノブレーン株式会社,1992年, - ,30-99人,東京都港区六本木6-10-1 六本木ヒルズ森タワー35階,http://www.techno-brain.co.jp/
91,株式会社キャリアプランニング,1986年, - ,100-499人,岡山県岡山市北区本町6番36号　第一セントラルビル1階,https://www.capla.co.jp/
92,日研トータルソーシング株式会社,1981年, - ,1000人以上,東京都大田区西蒲田7-23-3　日研第一ビル,http://www.nikken-sogyo.co.jp/
93,インターウォーズ株式会社,1995年, - , - ,東京都中央区銀座6-13-16 ヒューリック銀座ウォールビル9階,http://www.interwoos.com/
94,アビリティーセンター株式会社,1986年, - ,100-499人,愛媛県新居浜市坂井町2-3-17　新居浜テレコムプラザ7F,http://www.abi.co.jp/
95,株式会社クリエアナブキ,1986年, - ,100-499人,香川県高松市磨屋町2番地8,http://www.crie.co.jp/
96,富士ヒューマンテック株式会社,2002年, - , - ,埼玉県さいたま市浦和区北浦和4-5-5 北浦和大栄ビル 3F,http://www.fujihumantec.com/
97,株式会社RDサポート,2002年, - , - ,東京都中央区銀座6丁目2番1号 Daiwa銀座ビル3F,http://www.rdsupport.co.jp/
98,株式会社メイツ中国,1989年, - , - ,広島県広島市中区胡町4-21 朝日生命広島胡町ビル,http://www.mateschugoku.co.jp/
99,株式会社博報堂DYキャプコ,1994年, - ,30-99人,東京都港区赤坂2-14-27　国際新赤坂ビル東館11F,http://www.hakuhodo-dy.capco.co.jp/
100,島本パートナーズ,1997年,秦　一成,5-9人,東京都千代田区内幸町1-1-1 帝国ホテルタワー5F,http://www.shimamotop.com/
101,クックビズ株式会社,2007年, - ,100-499人,大阪府大阪市北区芝田2丁目7番18号　LUCID SQUARE UMEDA 8階,http://www.cookbiz.co.jp/
102,シリコンスタジオ株式会社,1999年, - ,100-499人,東京都渋谷区恵比寿1-21-3 NRビル,https://www.siliconstudio.co.jp/
103,株式会社GEEKLY（ギークリー）,2011年, - , - ,東京都渋谷区渋谷1-11-8　渋谷パークプラザ 4F,http://corporate.geekly.co.jp/
104,リス株式会社,1980年,木村　亮郎,30-99人,東京都新宿区西新宿２丁目４番１号　新宿ＮＳビル２５階,http://www.lis21.co.jp/
105,株式会社ニッケン・キャリア・ステーション,2001年, - , - ,東京都豊島区池袋2-38-2　COSMY-? 3F,http://nikkencs.co.jp/
106,ジャーナルスタッフ株式会社,1997年, - , - ,群馬県高崎市栄町3-26 2F,https://a-staff.com
107,サーチファーム・ジャパン株式会社,2003年, - ,30-99人,東京都千代田区麹町 1-7 相互半蔵門ビルディング,http://www.search-firm.co.jp/
108,株式会社アステート,1991年, - , - ,徳島県徳島市昭和町6丁目11番地2,http://www.astate.co.jp/
109,株式会社人材情報センター,1985年, - ,10-29人,石川県金沢市西念1-1-3 コンフィデンス金沢4F,https://www.jjc-net.co.jp/
110,東京エグゼクティブ・サーチ株式会社,1975年, - ,10-29人,東京都千代田区飯田橋2-1-5 S-Glanz KUDAN BLD. 5階,https://www.tesco.co.jp
111,株式会社パスラン,2008年, - , - ,東京都中央区銀座6-7-18　デイム銀座5階,http://www.passrun.co.jp/
112,株式会社スターキャリア,2006年, - , - ,群馬県高崎市新保町1665-1,http://www.starcareer.co.jp/
113,株式会社ダンネット,2005年,林 正史,30-99人,東京都中央区日本橋堀留町1-5-7 YOUビル2階,http://www.dannet.jp/
114,西日本エリートスタッフ株式会社,1987年, - , - ,福岡県久留米市日吉町15-60　ニッセイ久留米ビル9F,http://elite-staff.com/
115,株式会社コンフィアック,2009年, - , - ,東京都港区港南2-16-1　品川イーストワンタワー7F・8F,https://www.confiacc.co.jp
116,株式会社グレート長野,2002年, - ,10-29人,長野県長野市高田413,http://www.great-nagano.co.jp/
117,北陸人材バンク株式会社,1999年, - , - ,富山県富山市千石町3-6-6,http://h-jb.com/
118,株式会社ACR,1967年, - ,100-499人,福岡県福岡市中央区渡辺通4-10-10 紙与天神ビル2F,http://www.acr.gr.jp/
119,ビジネス・コンサート株式会社,1988年, - , - ,大阪府東大阪市荒本北1丁目4-17 クリエイション・コア東大阪　北館307,http://www.b-concert.co.jp/
120,イーキュア株式会社,2004年, - , - ,長野県松本市島立830-11,http://www.e-cure.jp/
121,Man to Man株式会社,2001年,田中　正次,100-499人,愛知県名古屋市中区新栄1丁目7番7号RTセンターステージビル,http://www.man-to-man-g.com/
122,株式会社エース・プロモーション,1973年, - , - ,東京都豊島区東池袋1-22-1　GSハイム池袋306号,http://www.ace-pro.jp/
123,株式会社キープキャリエール,1991年, - , - ,栃木県宇都宮市滝谷町14-7,http://www.keep.ne.jp/
124,株式会社北陸人材ネット,2007年, - , - ,石川県金沢市玉川町11番18号新石川ビル7F,http://www.hokurikujinzainet.com/
125,株式会社コープラス,2006年, - , - ,東京都千代田区九段北1-1-7 カーサ九段ビル７Ｆ,https://co-p.jp/
126,株式会社キャリアプラス,2005年, - ,10-29人,茨城県水戸市本町2丁目12-25,http://www.careerplus.co.jp/
127,株式会社ゼロン,1993年, - ,10-29人,東京都渋谷区渋谷2丁目22-16 渋谷TRビル3F兵庫県神戸市中央区江戸町95 井門神戸ビル4F,http://zeron.jp/
128,株式会社ワークスタイル,1988年, - , - , - ,https://www.work-style.net/
129,株式会社リンク・アンビション,2011年, - , - ,静岡県静岡市葵区紺屋町11‐1　浮月ビル4階,http://rs-shizuoka.net/
130,株式会社ゲートステージ,2004年,淺沼　好春,5-9人,東京都新宿区揚場町2番18号　ブリエ飯田橋ビル6F,http://www.gatestage.co.jp/
131,MutsubiAgent株式会社,2012年, - , - ,徳島県徳島市昭和町1-67,http://mutsubi-a.jp/
132,株式会社トラスト,1985年, - ,30-99人,愛知県岡崎市東大友町並木側13番地1,http://www.trust-family.co.jp/
133,関東サービス株式会社,1988年, - ,100-499人,東京都台東区上野6-16-18上野都信ビル5階,https://www.kantou.co.jp/
134,株式会社とんがりコラボ,1986年, - , - ,東京都港区赤坂2-10-9　ラウンドクロス赤坂7階,https://tongari.co.jp/
135,SBヒューマンキャピタル株式会社,1999年, - ,100-499人,東京都港区六本木2丁目4番5号 六本木Ｄスクエア（旧ビル名：興和六本木ビル）3F,http://www.softbankhc.co.jp/
136,株式会社ビートップツー,1994年, - , - ,東京都港区芝大門1-15-1　第三高千穂ビル2F,http://bt2.net/
137,株式会社広報しえん,1997年, - ,30-99人,新潟県新潟市中央区南笹口1-2-16　新潟CDビル2F,https://www.4en.co.jp/
138,株式会社リクルートメディカルキャリア,1979年, - , - ,東京都千代田区九段北1丁目14-6 九段坂上KSビル,https://www.recruit-mc.co.jp/
139,アスメディックス株式会社,2002年, - ,30-99人,東京都港区東麻布1-5-2　ザイマックス東麻布ビル,https://www.asmedix.co.jp/
140,BCホールディングス株式会社,2001年, - ,100-499人,大阪府大阪市中央区久太郎町3-3-9 ORIX久太郎町ビル10F東京都新宿区西新宿1-24-1 エステック情報ビル18F・19F(受付),http://www.bc-holdings.co.jp/
141,株式会社エラン,1995年, - , - ,東京都新宿区新宿4-3-25 TOKYU REIT 新宿ビル4F宮城県仙台市青葉区本町1-1-8 第一日本オフィスビル7F大阪府大阪市中央区久太郎町2-5-28 久太郎町恒和ビル7F福岡県福岡市博多区上川端町12-28 安田第一ビル8F-C,https://www.elan-jp.com/
142,株式会社ヒューマンコミュニティ,1991年, - , - ,大阪府大阪市中央区久太郎町2-5-31 本町寺田ビルディング,http://human-cmty.co.jp/
143,株式会社パソナテック,1998年, - ,100-499人,東京都千代田区大手町2-6-2,https://www.pasonatech.co.jp/
144,株式会社 リクルートキャリア, - , - , - , - ,https://www.recruitcareer.co.jp/
145,株式会社フレンドパーク,2001年, - ,5-9人,群馬県前橋市南町2-32-5,http://friendpark.co.jp/
146,ランスタッド株式会社,1980年, - , - ,東京都千代田区紀尾井町4-1　ニューオータニガーデンコート21F,https://www.randstad.co.jp/
147,株式会社 エリメントHRC,2006年, - , - ,東京都大田区山王2-5-10　大森野村證券ビル4F,http://www.element-hrc.com
148,株式会社アイスタイルキャリア,2015年, - ,30-99人,東京都港区赤坂1-12-32 アーク森ビル34階,https://career.cosme.net/
149,株式会社リブリッジ,2014年, - , - ,東京都千代田区岩本町3-2-2　千代田岩本ビル4階,https://www.rebridge.co.jp/
150,株式会社ワンアンドオンリーキャスティング,2008年, - ,30-99人,東京都渋谷区代々木2-13-4 新中央ビル4F,https://www.oneandonlycasting.com/
151,アチーブ株式会社, - , - , - ,東京都杉並区高円寺北2-3-4　高円寺ビル405,http://achievejapan.com/
152,ワークパワー株式会社,1986年, - , - ,千葉県佐倉市宮前3-23-15　TCCビル1F,http://www.wp-st.net/
153,株式会社メディウェル,1996年, - ,100-499人,北海道札幌市中央区北1条西5丁目2番地　興銀ビル9階,https://www.mediwel.net/
154,株式会社セイファート,1991年, - ,100-499人,東京都渋谷区渋谷3-27-11　祐真ビル2F,http://www.seyfert.co.jp
155,株式会社ベスト・パートナー,2003年, - ,500-999人,群馬県桐生市相生町5-271-26,http://bg-temporary.com/bp/
156,株式会社ナラーズ,2004年, - ,10-29人,奈良県奈良市今辻子町24-1 若井ビル3F,http://www.nara-s.jp/
157,株式会社東海道シグマ,1987年, - ,30-99人,静岡県静岡市葵区御幸町8-1　JADEビル5F,https://www.sigma-jp.co.jp
158,高木工業株式会社,1965年,高木　茂,100-499人,東京都品川区西五反田七丁目19番1号,http://www.yes-takagi.com
159,株式会社 ジェイ・アライアンス,2009年, - , - ,奈良県奈良市芝辻町500-1,http://www.j-alliance.co.jp/
160,株式会社シグマコミュニケーションズ,1986年, - ,500-999人,東京都港区芝4-1-23 三田NNビル 3F,http://www.sigma-com.co.jp/
161,株式会社スタッフクリエイション, - , - , - ,大阪府大阪市中央区南船場3-2-22 おおきに南船場ビル9階,http://esthetic-career.com/
162,株式会社ベネッセi-キャリア,2015年, - ,100-499人,東京都新宿区西新宿2-1-1 新宿三井ビルディング32階,https://www.benesse-i-career.co.jp/company/
163,株式会社ヒトコト,2006年, - , - ,京都府京都市中京区烏丸通四条上ル笋町688 第15長谷ビル5F,https://www.kotonokoto.jp
164,株式会社富士誇（フジコ）,2007年,可野　大誉,30-99人,東京都港区新橋4-21-3　新橋東急ビル3階,https://www.fujico.co.jp/
165,株式会社R4CAREER,2009年, - , - ,愛知県名古屋市中区栄 2-9-26 ポーラ名古屋ビルA館　3F,http://www.r4career.co.jp/
166,株式会社ウィルウェイズ,2007年, - , - ,長野県松本市平田東2-19-19,http://www.willways.co.jp
167,株式会社ナースパワー人材センター,1985年, - ,100-499人,熊本県熊本市中央区神水1丁目25番7号 パワービル4F,http://www.nursepower.co.jp/
168,株式会社 キャリアネットワーク,2003年, - , - ,福井県福井市新田塚1-25-18　aoiビル3Ｆ,http://www.cnw.co.jp/
169,株式会社エイペックス,2000年, - , - ,滋賀県近江八幡市西庄町724-1ウエストウイング2Ｆ,http://apex.shiga.jp/
170,リージョンズ株式会社,2008年, - ,30-99人,北海道札幌市中央区北1条西4丁目1-2J&Sりそなビル3階,http://www.regions.co.jp/
171,株式会社リージェント,2012年, - , - ,香川県高松市寿町一丁目4番3号　高松中央通りビル2F,http://www.r-regent.jp/
172,株式会社メディカル・コンシェルジュ,2000年, - ,100-499人,東京都渋谷区恵比寿南1-5-5_JR恵比寿ビル11F,https://www.concier.com
173,株式会社アルバイトタイムス,1973年,堀田　欣弘,100-499人,神田富山町5-1 神田ビジネスキューブ7階,http://www.atimes.co.jp/
174,株式会社エス・エム・エスキャリア,2003年, - ,1000人以上,東京都港区芝公園2-11-1　住友不動産芝公園タワー, - 
175,株式会社千葉キャリ,2003年, - ,5-9人,千葉県船橋市本郷町474-1 石井ビル402,http://chibacaricorp.com/
